,Title,Published_date,Views,Likes,Comments,Month
0,Nuclear fusion | Nuclear chemistry | High school chemistry | Khan Academy,2024-02-16,4557,140,8,Feb
1,Half-life | Nuclear chemistry | High school chemistry | Khan Academy,2024-02-09,11018,180,17,Feb
2,Gamma decay | Nuclear chemistry | High school chemistry | Khan Academy,2024-02-03,9623,172,11,Feb
3,AI for ELA with Khan Academy,2024-01-29,8726,107,21,Jan
4,Beta decay | Nuclear chemistry | High school chemistry | Khan Academy,2024-01-26,7357,142,8,Jan
5,Meaning of the reciprocal,2024-01-26,6443,149,11,Jan
6,Interpreting unequal ratios,2024-01-26,2545,33,6,Jan
7,Simplify a ratio from a tape diagram,2024-01-26,2616,35,3,Jan
8,Maintain | Vocabulary | Khan Academy,2024-01-23,4250,65,3,Jan
9,Sanctuary | Vocabulary | Khan Academy,2024-01-23,2353,42,4,Jan
10,Encounter | Vocabulary | Khan Academy,2024-01-23,1282,43,3,Jan
11,Debris | Vocabulary | Khan Academy,2024-01-23,1164,20,0,Jan
12,Ecosystem | Vocabulary | Khan Academy,2024-01-23,830,19,0,Jan
13,Crisis | Vocabulary | Khan Academy,2024-01-23,813,24,1,Jan
14,Develop | Vocabulary | Khan Academy,2024-01-23,891,14,0,Jan
15,Conserve | Vocabulary | Khan Academy,2024-01-23,1041,39,2,Jan
16,Innovative | Vocabulary | Khan Academy,2024-01-23,696,15,0,Jan
17,Contaminate | Vocabulary | Khan Academy,2024-01-23,638,10,0,Jan
18,Resource | Vocabulary | Khan Academy,2024-01-23,1192,43,0,Jan
19,Significant | Vocabulary | Khan Academy,2024-01-23,1072,23,0,Jan
20,A chat with MLK on #MLKDay,2024-01-17,5568,128,2,Jan
21,Alpha decay | Nuclear chemistry | High school chemistry | Khan Academy,2024-01-16,11286,237,15,Jan
22,Intro to radioactive decay | Nuclear chemistry | High school chemistry | Khan Academy,2024-01-12,11183,185,13,Jan
23,The Learners Fund - The Khan Academy story,2023-12-26,16566,421,46,Dec
24,Common Fuel Types and Uses | AP Environmental Science | Khan Academy,2023-12-19,9579,177,43,Dec
25,Renewable and Nonrenewable Energy Resources | AP Environmental Science | Khan Academy,2023-12-19,5457,72,9,Dec
26,Comparing rates example,2023-12-19,4158,52,5,Dec
27,Alienated | Vocabulary | Khan Academy,2023-12-18,5108,65,7,Dec
28,Exclude | Vocabulary | Khan Academy,2023-12-18,2087,27,1,Dec
29,Anxious | Vocabulary | Khan Academy,2023-12-18,2154,30,2,Dec
30,Recognition | Vocabulary | Khan Academy,2023-12-18,1606,27,2,Dec
31,Advantage | Vocabulary | Khan Academy,2023-12-18,1390,17,0,Dec
32,Strategic | Vocabulary | Khan Academy,2023-12-18,1261,20,2,Dec
33,Effective | Vocabulary | Khan Academy,2023-12-18,974,15,0,Dec
34,Interwoven | Vocabulary | Khan Academy,2023-12-18,1117,12,2,Dec
35,Heritage | Vocabulary | Khan Academy,2023-12-18,1013,18,0,Dec
36,Esteem | Vocabulary | Khan Academy,2023-12-18,1005,16,0,Dec
37,Perceive | Vocabulary | Khan Academy,2023-12-18,824,9,0,Dec
38,Collective | Vocabulary | Khan Academy,2023-12-18,918,10,0,Dec
39,Incident | Vocabulary | Khan Academy,2023-12-18,1243,22,1,Dec
40,Enforce | Vocabulary | Khan Academy,2023-12-18,734,12,0,Dec
41,Impose | Vocabulary | Khan Academy,2023-12-18,864,13,2,Dec
42,Resistance | Vocabulary | Khan Academy,2023-12-18,802,12,0,Dec
43,Contentious | Vocabulary | Khan Academy,2023-12-18,906,20,3,Dec
44,Rebellion | Vocabulary | Khan Academy,2023-12-18,684,14,0,Dec
45,Eliminate | Vocabulary | Khan Academy,2023-12-18,834,10,1,Dec
46,Defiant | Vocabulary | Khan Academy,2023-12-18,846,15,0,Dec
47,Invalid | Vocabulary | Khan Academy,2023-12-18,991,15,2,Dec
48,Policy | Vocabulary | Khan Academy,2023-12-18,2102,70,5,Dec
49,Align | Vocabulary | Khan Academy,2023-12-18,1937,46,3,Dec
50,Regulate | Vocabulary | Khan Academy,2023-12-18,3736,84,4,Dec
51,Le Châtelier's principle | Reaction rates and equilibrium | High school chemistry | Khan Academy,2023-12-15,5068,47,2,Dec
52,Reversible reactions and equilibrium | High school chemistry | Khan Academy,2023-12-15,2562,55,3,Dec
53,Catalysts | Reaction rates and equilibrium | High school chemistry | Khan Academy,2023-12-15,1652,36,4,Dec
54,Try this AI for college admissions! #collegeapplications,2023-12-15,9246,290,0,Dec
55,Electronegativity and bond type | States of matter | High school chemistry | Khan Academy,2023-12-14,3707,32,1,Dec
56,London dispersion forces introduction | States of matter | High school chemistry | Khan Academy,2023-12-14,1385,23,2,Dec
57,Endothermic and exothermic reactions | Chemical reactions | High school chemistry | Khan Academy,2023-12-14,1374,29,1,Dec
58,Physical and chemical changes | Chemical reactions | High school chemistry | Khan Academy,2023-12-14,2076,62,3,Dec
59,The Case of the Early Bird | Teacher Resources | Financial Literacy | Khan Academy,2023-12-14,1240,23,2,Dec
60,A Taxing Time | Teacher Resources | Financial Literacy | Khan Academy,2023-12-14,858,14,0,Dec
61,A Tale of Two Credit Scores | Teacher Resources | Financial Literacy | Khan Academy,2023-12-14,1226,32,0,Dec
62,Ionization energy trends | Periodic trends | High school chemistry | Khan Academy,2023-12-14,4866,36,3,Dec
63,Atomic radii trends | Periodic trends | High school chemistry | Khan Academy,2023-12-14,1246,26,0,Dec
64,Lewis diagrams | The periodic table and Lewis diagrams | High school chemistry | Khan Academy,2023-12-14,1326,28,4,Dec
65,Atomic spectra | The Bohr model and atomic spectra | High school chemistry | Khan Academy,2023-12-14,3476,59,4,Dec
66,The mole and Avogadro's number | Moles and molar mass | High school chemistry | Khan Academy,2023-12-13,2546,46,10,Dec
67,Worked example: calculating ion charge | Isotopes and ions | High school chemistry | Khan Academy,2023-12-13,1283,34,4,Dec
68,Worked example: using the mass number equation | High school chemistry | Khan Academy,2023-12-13,1042,22,1,Dec
69,Isotopes | Isotopes and ions | High school chemistry | Khan Academy,2023-12-13,2463,105,8,Dec
70,Elements and atomic number | Atomic structure | High school chemistry | Khan Academy,2023-12-13,1921,63,3,Dec
71,"Protons, neutrons, and electrons in atoms | Atomic structure | High school chemistry | Khan Academy",2023-12-13,2680,64,5,Dec
72,Setting AI Policies for your School Districts: Part 2 of 2,2023-12-12,3078,46,8,Dec
73,7 Principles for AI in Education: Part 1 of 2,2023-12-12,6808,94,8,Dec
74,Khan Academy's Official Digital SAT Prep Webinar,2023-12-01,15434,107,7,Dec
75,Lesson Planning with Khanmigo Webinar,2023-11-30,11755,89,4,Nov
76,"Parents, learn how to boost writing skills with Khanmigo",2023-11-29,7002,104,6,Nov
77,Boost writing skills with Khan Academy's new essay feedback feature,2023-11-29,6043,172,0,Nov
78,Help Khan Academy this giving season,2023-11-21,25594,283,16,Nov
79,Khanmigo Teacher Story - Ms. Bartsch,2023-11-21,4341,67,7,Nov
80,Irregular plural nouns | -f to -ves | The parts of speech | Grammar | Khan Academy,2023-11-10,10254,170,0,Nov
81,Khanmigo: Co-create a Rubric Activity,2023-11-10,4161,41,3,Nov
82,Khanmigo: Class Snapshot Activity,2023-11-09,4217,41,0,Nov
83,AMA with Sal Khan on AI + Education,2023-11-09,5544,107,13,Nov
84,Personalized Stories Starring Your Kids: Khanmigo's Craft a Story! | Bedtime stories for kids,2023-11-09,3266,34,4,Nov
85,Khanmigo: Teacher Activities Overview,2023-11-08,3270,36,1,Nov
86,Khanmigo: Create a Lesson Plan Activity,2023-11-07,4959,79,4,Nov
87,"Teachers, learn how to save 5 hours per week with Khanmigo! | Lesson planning tools for teachers",2023-11-06,9952,74,5,Nov
88,Introducing Constitution 101 from Khan Academy and the National Constitution Center,2023-11-02,6909,145,7,Nov
89,Parents: See how to get 24/7 homework help with Khanmigo | Personal tutor | AI Tutor,2023-10-23,15028,133,10,Oct
90,Khan Academy’s AI Tool for the Classroom: Teacher + Student Edition,2023-10-12,15355,176,19,Oct
91,Introducing Khan Academy’s Magical AI Tool for Teachers: Khanmigo,2023-10-12,9979,129,6,Oct
92,Khanmigo: Your 24/7 Homework Helper #khanacademy #ai,2023-10-11,42874,351,6,Oct
93,Embrace World Mental Health Day with Sal Khan,2023-10-10,6205,346,0,Oct
94,Khanmigo is now available to the public (US only)| Personalized AI tutor & teaching assistant,2023-09-29,125207,801,80,Sep
95,Khan Academy's Content,2023-09-13,16004,174,15,Sep
96,Basic Site Navigation on Khan Academy,2023-09-13,5621,56,5,Sep
97,Mastery Goals on Khan Academy,2023-09-13,2598,32,0,Sep
98,Assignment Reports on Khan Academy,2023-09-13,3104,40,2,Sep
99,Student Tips for Completing Assignments on Khan Academy,2023-09-13,2727,52,0,Sep
100,Student tips for using Mastery Goals on Khan Academy,2023-09-13,2457,32,2,Sep
101,Intro to taxes | Taxes and tax forms | Financial literacy | Khan Academy,2023-09-08,10713,169,23,Sep
102,Credit 101: What is APR? | Loans and debt | Financial literacy | Khan Academy,2023-09-08,3642,76,8,Sep
103,Debt: Good debt and bad debt | Loans and debt | Financial literacy | Khan Academy,2023-09-08,3952,99,7,Sep
104,Sources of loans/credit | Loans and debt | Financial literacy | Khan Academy,2023-09-08,2269,37,1,Sep
105,Introduction to Middle school physics | Khan Academy,2023-09-08,3315,60,3,Sep
106,Introduction to Middle school biology | Khan Academy,2023-09-08,2292,28,1,Sep
107,Revolving vs installment credit | Loans and debt | Financial literacy | Khan Academy,2023-09-08,1478,25,2,Sep
108,Education as an investment | Careers and education | Financial literacy | Khan Academy,2023-09-08,2555,57,4,Sep
109,Compare costs of postsecondary education | Careers and education | Financial literacy | Khan Academy,2023-09-08,853,15,0,Sep
110,The cost of education | Careers and education | Financial literacy | Khan Academy,2023-09-08,2396,52,6,Sep
111,Choosing the right college | Careers and education | Financial literacy | Khan Academy,2023-09-08,1697,47,3,Sep
112,Why invest in yourself? | Careers and education | Financial literacy | Khan Academy,2023-09-08,2324,52,2,Sep
113,SMART goals | Financial goals | Financial literacy | Khan Academy,2023-09-08,2782,53,1,Sep
114,"Short, medium and long term financial goals | Financial goals | Financial literacy | Khan Academy",2023-09-08,2525,37,5,Sep
115,Charitable giving | Financial goals | Financial literacy | Khan Academy,2023-09-08,1039,24,1,Sep
116,Money personalities | Financial goals | Financial literacy | Khan Academy,2023-09-08,1920,40,1,Sep
117,Sources of income during retirement | Investments and retirement | Financial literacy | Khan Academy,2023-09-08,1262,27,0,Sep
118,Saving and investing | Investments and retirement | Financial literacy | Khan Academy,2023-09-08,1300,25,0,Sep
119,Financial institutions and markets  | Investments and retirement | Financial literacy | Khan Academy,2023-09-08,1280,32,1,Sep
120,Saving and investing | Investments and retirement | Financial literacy | Khan Academy,2023-09-08,1402,30,0,Sep
121,Why plan for retirement | Investments and retirement | Financial literacy | Khan Academy,2023-09-08,1045,25,0,Sep
122,What is risk and return? | Investments and retirement | Financial literacy | Khan Academy,2023-09-08,959,22,1,Sep
123,Introduction to life insurance | Insurance | Financial literacy | Khan Academy,2023-09-08,1403,47,1,Sep
124,How insurance works | Insurance | Financial literacy | Khan Academy,2023-09-08,1699,41,3,Sep
125,Ways to manage financial risk | Insurance | Financial literacy | Khan Academy,2023-09-08,768,23,0,Sep
126,Types of financial risk | Insurance | Financial literacy | Khan Academy,2023-09-08,905,32,3,Sep
127,Insurance terminology | Insurance | Financial literacy | Khan Academy,2023-09-08,2721,100,6,Sep
128,Car insurance basics | Insurance | Financial literacy | Khan Academy,2023-09-08,1270,54,2,Sep
129,Consumer protection  | Scams & fraud | Financial literacy | Khan Academy,2023-09-08,1171,43,2,Sep
130,Area with partial grids | Area | 3rd grade | Khan Academy,2023-09-07,2603,69,0,Sep
131,Decimal multiplication with grids | Multiply Decimals | 5th grade | Khan Academy,2023-09-07,5666,57,0,Sep
132,Electric forces | Forces at a distance | Middle school physics | Khan Academy,2023-09-07,4178,81,0,Sep
133,Supplemental insurance | Insurance | Financial literacy | Khan Academy,2023-08-25,9047,90,7,Aug
134,Features of property insurance | Insurance | Financial literacy | Khan Academy,2023-08-25,4106,75,1,Aug
135,Property insurance | Insurance | Financial literacy | Khan Academy,2023-08-25,2833,61,1,Aug
136,Disability and long term care insurance | Insurance | Financial literacy | Khan Academy,2023-08-25,2605,60,3,Aug
137,Sal Khan and Bill Gates Discuss the Future of Learning on Unconfuse Me Podcast!,2023-08-11,33754,1184,0,Aug
138,Types of health insurance plans | Insurance | Financial literacy | Khan Academy,2023-08-11,9029,136,9,Aug
139,Estate planning introduction | Insurance| Financial literacy | Khan Academy,2023-08-11,4212,94,5,Aug
140,What are tax forms? (Part 2) | Taxes and tax forms | Financial literacy | Khan Academy,2023-08-11,3397,83,3,Aug
141,What are tax forms? (Part 1) | Taxes and tax forms | Financial literacy | Khan Academy,2023-08-11,3036,115,9,Aug
142,Key tax terms |Taxes and tax forms |Financial literacy| Khan Academy,2023-08-11,3796,114,8,Aug
143,Associative and commutative properties of addition with negatives | 7th grade | Khan Academy,2023-08-08,5332,61,12,Aug
144,Graphing negative number addition and subtraction expressions | 7th grade | Khan Academy,2023-08-08,3152,37,1,Aug
145,Adding with integer chips | Integers: Addition and subtraction | 7th grade | Khan Academy,2023-08-08,3644,60,5,Aug
146,Adding the opposite with number lines | 7th grade | Khan Academy,2023-08-08,2512,39,2,Aug
147,Adding and subtracting fractions with negatives | 7th grade | Khan Academy,2023-07-28,13360,148,20,Jul
148,Equivalent expressions with negative numbers | 7th grade | Khan Academy,2023-07-28,4993,43,2,Jul
149,Subtracting integers  find the missing value | 7th grade | Khan Academy,2023-07-28,4065,75,7,Jul
150,Adding integers: find the missing value | 7th grade | Khan Academy,2023-07-28,3013,52,3,Jul
151,Adding the opposite with integer chips | 7th grade | Khan Academy,2023-07-27,5021,80,2,Jul
152,AI in Education: Opportunities + Pitfalls,2023-07-26,6047,78,7,Jul
153,Zero pairs worked example,2023-07-26,5785,60,2,Jul
154,Common percentages,2023-07-26,8276,168,11,Jul
155,Plotting inequalities on a number line | Equations & inequalities | 6th grade | Khan Academy,2023-07-26,3490,63,5,Jul
156,Signs of sums on a number line | Integers: Addition and subtraction | 7th grade | Khan Academy,2023-07-26,3682,66,3,Jul
157,Subtracting with integer chips | Integers: Addition and subtraction | 7th grade | Khan Academy,2023-07-26,5001,66,4,Jul
158,Boost Your Kids' Learning with Khanmigo!,2023-07-14,15059,416,0,Jul
159,How to Implement AI in Your Classroom,2023-07-10,13955,259,41,Jul
160,It is almost time for Camp Khan Kids 2023!,2023-06-30,18285,444,0,Jun
161,Welcome to high school biology | High school biology | Khan Academy,2023-06-26,19487,415,37,Jun
162,Come meet Khanmigo and the Khan Academy team in booth 1836! #istelive23,2023-06-26,12945,356,12,Jun
163,Khanmigo: Using Class Snapshot,2023-06-22,6096,95,10,Jun
164,Lesson Planning with Khanmigo,2023-06-22,3553,45,5,Jun
165,Introducing Khanmigo for teachers,2023-06-22,11520,108,7,Jun
166,Khanmigo for Districts,2023-06-21,6608,114,9,Jun
167,Paying yourself first | Budgeting & saving | Financial literacy | Khan Academy,2023-06-08,21271,466,18,Jun
168,Saving wisely: Emergency funds | Budgeting & saving | Financial literacy | Khan Academy,2023-06-08,16349,272,15,Jun
169,Why and how to save  | Budgeting & saving | Financial literacy | Khan Academy,2023-06-08,8006,185,3,Jun
170,What is the better deal? | Budgeting & saving | Financial literacy | Khan Academy,2023-06-08,5259,121,8,Jun
171,Budgeting and the 50:30:20 rule | Budgeting | Financial literacy | Khan Academy,2023-06-02,21331,590,39,Jun
172,How do you build a budget? | Budgeting | Financial literacy | Khan Academy,2023-06-02,17414,525,33,Jun
173,Combining mixtures example,2023-05-30,7414,119,14,May
174,"Teachers, say hello to Khanmigo from Khan Academy!",2023-05-19,30882,267,28,May
175,Learn coding from scratch with Khanmigo,2023-05-19,27589,0,10,May
176,Don't ban A.I.--let's fight together for GOOD A.I.,2023-05-17,30117,1305,38,May
177,3 FREE ways to future-proof your skills in the AI age,2023-05-16,21122,897,24,May
178,Don't use ChatGPT for learning--Try this instead!,2023-05-09,20681,540,0,May
179,How can AI improve education?,2023-05-05,13190,632,0,May
180,Revolutionizing Education with Khanmigo--an AI tutor for every student - Sal Khan's 2023 TED Talk,2023-05-02,18117,923,0,May
181,📝💡 Elevate your writing game with Khanmigo!,2023-05-01,11175,325,4,May
182,Introducing Khanmigo Teacher Mode,2023-04-12,28275,449,38,Apr
183,"NEW! Khan Academy's AI Tutor, Khanmigo - In Depth Demo",2023-03-14,436371,8559,494,Mar
184,Khan Academy announces GPT-4 powered learning guide,2023-03-14,686806,21406,717,Mar
185,Help all students reach their SAT goals with a Khan Academy district partnership,2023-02-16,17539,242,22,Feb
186,Khan Academy Districts Overview,2023-02-16,11937,163,13,Feb
187,Please help Khan Academy this holiday season,2022-12-14,28042,795,70,Dec
188,US Government and Civics Introduction,2022-11-23,32230,575,64,Nov
189,Help Khan Academy this holiday season,2022-11-21,96191,802,45,Nov
190,Thoughts on the nation's report card,2022-10-31,62418,2039,162,Oct
191,Earth's fossil record | Evolution | Middle school biology | Khan Academy,2022-10-27,32546,309,32,Oct
192,Khan Stories: Mr. Brown,2022-10-25,12168,189,14,Oct
193,Internet Safety Course Introduction,2022-10-20,21662,572,42,Oct
194,Sexual reproduction and genetic variation | Middle school biology | Khan Academy,2022-10-20,21553,216,20,Oct
195,"Khan Academy Ed Talks with Begoña Vila, PhD - Thursday October 13",2022-10-13,11605,128,0,Oct
196,Introduction to Middle school Earth and space science | Khan Academy,2022-10-13,6279,81,2,Oct
197,Using the Teacher Skills Report to drive differentiation on Khan Academy,2022-10-12,5056,39,1,Oct
198,Using the Administrator Skills Report to drive differentiation on Khan Academy,2022-10-12,3262,17,2,Oct
199,What are common scams I should be aware of?,2022-10-12,7162,131,16,Oct
200,What can I do to protect my account?,2022-10-12,4684,79,5,Oct
201,Wait have I just been attacked? What do I do now?,2022-10-12,3391,47,6,Oct
202,"How to avoid phishing attempts. However it’s spelled, it’s bad news",2022-10-12,3541,49,3,Oct
203,How to stay safe online shopping,2022-10-12,4106,41,2,Oct
204,Does it really matter what browser I choose?,2022-10-12,3797,59,11,Oct
205,What’s private or incognito mode?,2022-10-12,4005,50,9,Oct
206,Why you should actually read the URL & be careful with free Wi-Fi,2022-10-12,3688,69,1,Oct
207,The basics of safe browsing,2022-10-12,3946,49,1,Oct
208,How can I keep all my smart devices secure?,2022-10-12,2353,40,3,Oct
209,What can I do to protect my devices?,2022-10-12,2580,42,2,Oct
210,How passwords and screenlocks help protect you,2022-10-12,1861,23,5,Oct
211,What do we mean by device security? Why should we care about this?,2022-10-12,2838,38,3,Oct
212,How can I review the security of my account?,2022-10-12,2417,30,2,Oct
213,How adding your phone number and 2-factor authentication helps protect your account,2022-10-12,7560,28,3,Oct
214,"Yes, you need a password manager. Here’s why.",2022-10-12,10524,136,9,Oct
215,Why creating a strong password really matters,2022-10-12,4865,95,8,Oct
216,How to keep your online accounts secure,2022-10-12,9310,147,14,Oct
217,LearnStorm 2022,2022-09-06,26028,424,32,Sep
218,"Khan Academy Ed Talks with Chase Nordengren, PhD",2022-08-30,14446,161,9,Aug
219,Ratios with tape diagrams (part:whole),2022-08-29,25755,189,21,Aug
220,Three things to know about stocks,2022-08-24,26029,770,41,Aug
221,What is a 401k?,2022-08-24,13946,489,32,Aug
222,What is a credit score?,2022-08-24,10998,406,34,Aug
223,Common ancestry and evolutionary trees | Evolution | Middle school biology | Khan Academy,2022-08-23,12548,204,8,Aug
224,Natural resources | Earth and society | Middle school Earth and space science | Khan Academy,2022-08-16,25721,382,4,Aug
225,Student navigation | Using course mastery on Khan Academy | Khan for Educators | Khan Academy,2022-08-11,11555,244,15,Aug
226,Sewage treatment | Aquatic and Terrestrial Pollution | AP Environmental Science | Khan Academy,2022-08-10,12019,300,8,Aug
227,Evidence of evolution: embryology | Evolution | Middle school biology | Khan Academy,2022-08-09,42216,572,7,Aug
228,Evolution | Middle school biology | Khan Academy,2022-07-27,15513,348,0,Jul
229,Introducing middle school science content on Khan Academy,2022-07-27,11945,258,15,Jul
230,Human impacts on the environment | Middle school Earth and space science | Khan Academy,2022-07-27,12103,259,5,Jul
231,Environmental change and adaptation in Galápagos finches | Middle school biology | Khan Academy,2022-07-22,8606,184,30,Jul
232,Natural selection in peppered moths | Middle school biology | Khan Academy,2022-07-22,11350,171,18,Jul
233,Evidence of evolution: anatomy | Evolution | Middle school biology | Khan Academy,2022-07-22,7542,184,5,Jul
234,Fossils | Evolution | Middle school biology | Khan Academy,2022-07-22,7024,79,10,Jul
235,Worked examples: Punnett squares | Inheritance and variation | Middle school biology | Khan Academy,2022-07-22,7464,80,4,Jul
236,Genetics vocabulary | Inheritance and variation | Middle school biology | Khan Academy,2022-07-22,9808,125,6,Jul
237,Mutations | Inheritance and variation | Middle school biology | Khan Academy,2022-07-22,8925,124,4,Jul
238,"Genes, proteins, and traits | Inheritance and variation | Middle school biology | Khan Academy",2022-07-22,10769,138,16,Jul
239,Chromosome pairs | Inheritance and variation | Middle school biology | Khan Academy,2022-07-21,4490,92,1,Jul
240,Chromosomes and genes | Inheritance and variation | Middle school biology | Khan Academy,2022-07-21,20682,257,8,Jul
241,A Thermal Inversion Example in Donora | AP Environmental Science | Khan Academy,2022-07-08,15579,248,14,Jul
242,"Khan Academy Ed Talks with Professor Thomas Guskey, PhD",2022-05-25,24255,204,68,May
243,Humans and ecosystems: how do vultures provide ecosystem services? | Khan Academy,2022-05-25,16889,333,5,May
244,Biodiversity and ecosystem health: a Hawaiian Islands case study | Khan Academy,2022-05-25,12222,252,0,May
245,Ecosystem dynamics: Clark’s nutcrackers and the white bark pine | Khan Academy,2022-05-25,6509,113,2,May
246,Help support Khan Academy,2022-05-12,222737,5623,265,May
247,Natural hazards | Earth and society | Middle school Earth and space science | Khan Academy,2022-05-11,14738,218,3,May
248,Galaxies and gravity | Earth in space | Middle school Earth and space science | Khan Academy,2022-05-11,16091,274,4,May
249,Regional climates | Weather and climate | Middle school Earth and space science | Khan Academy,2022-05-11,14288,435,1,May
250,Plate tectonics and the ocean floor | Middle school Earth and space science | Khan Academy,2022-05-06,17799,248,3,May
251,Introduction to plate tectonics | Middle school Earth and space science | Khan Academy,2022-05-06,22611,233,8,May
252,The solar system | Earth in space | Middle school Earth and space science | Khan Academy,2022-05-06,29937,507,4,May
253,Solar eclipses | The Earth-sun-moon system | Middle school Earth and space science | Khan Academy,2022-05-06,12593,136,3,May
254,Khan Academy Ed Talk with Nicholas Ferroni,2022-05-05,8770,162,7,May
255,Khan Academy Ed Talk with Mike Flanagan,2022-05-04,6825,142,7,May
256,HOW to Study: Learning Scientist Shares 5 Steps to Remember Anything You Learn #Shorts,2022-04-25,81572,5005,52,Apr
257,Global winds and currents | Middle school Earth and space science | Khan Academy,2022-04-20,34029,543,10,Apr
258,Weather | Weather and climate | Middle school Earth and space science | Khan Academy,2022-04-18,21432,264,5,Apr
259,Refraction and frequency | Waves | Middle school physics | Khan Academy,2022-04-18,11008,294,3,Apr
260,Activities to Build Creative Confidence,2022-04-14,13806,312,12,Apr
261,Khan Academy Live Stream,2022-04-13,0,0,0,Apr
262,Creativity break: How can we combine ways of thinking in problem solving? | Algebra 1 | Khan Academy,2022-04-08,14211,272,16,Apr
263,Creativity break: What can we do to expand our creative skills? | Algebra 1 | Khan Academy,2022-04-08,4365,85,2,Apr
264,Creativity break: How are math and creativity changing the world? | Algebra 1 | Khan Academy,2022-04-08,5889,471,6,Apr
265,Creativity break: Why is algebra important to learn? | Algebra 1 | Khan Academy,2022-04-08,9570,155,8,Apr
266,Creativity break: What do you do to get into your creative zone? | Algebra 1 | Khan Academy,2022-04-08,4607,106,2,Apr
267,Creativity break: How does creativity play a role in your everyday life? | Algebra 1 | Khan Academy,2022-04-08,3304,196,0,Apr
268,Creativity break: How can people get creative in algebra | Algebra 1 | Khan Academy,2022-04-08,3084,69,3,Apr
269,Creativity break: When did you first realize that you liked algebra | Algebra 1 | Khan Academy,2022-04-08,1868,32,9,Apr
270,Creativity break: How do you apply creativity in algebra | Algebra 1 | Khan Academy,2022-04-08,1815,23,1,Apr
271,Creativity break: Why is creativity important in STEM jobs? | Algebra 1 | Khan Academy,2022-04-08,2494,42,4,Apr
272,Creativity break: Why is creativity important in algebra? | Algebra 1 | Khan Academy,2022-04-08,2566,39,1,Apr
273,Creativity in algebra | Algebra 1 | Khan Academy,2022-04-08,5494,137,5,Apr
274,Creative algebra at work | Algebra 1 | Khan Academy,2022-04-08,4197,148,8,Apr
275,The future of creativity in algebra | Algebra 1 | Khan Academy,2022-04-08,2099,56,2,Apr
276,Creativity in biology | High school biology | Khan Academy,2022-04-08,4450,77,13,Apr
