,Title,Published_date,Views,Likes,Comments,Month
2063,When there aren't gains from trade | Basic economics concepts | AP Macroeconomics | Khan Academy,2017-10-09,27386,283,19,Oct
2064,Comparative advantage worked example | Basic economics concepts | AP Macroeconomics | Khan Academy,2017-10-09,42031,457,18,Oct
2065,Binompdf and binomcdf functions | Random variables | AP Statistics | Khan Academy,2017-10-09,62429,421,13,Oct
2066,"Equilibrium, allocative efficiency and total surplus",2017-10-06,28879,355,14,Oct
2067,Visualizing marginal utility MU and total utility TU functions,2017-10-06,37497,426,22,Oct
2068,Identifying tax incidence in a graph  | APⓇ Microeconomics | Khan Academy,2017-10-05,59185,447,15,Oct
2069,How price controls reallocate surplus | APⓇ Microeconomics | Khan Academy,2017-10-05,23787,332,13,Oct
2070,Proof of expected value of geometric random variable | AP Statistics | Khan Academy,2017-10-05,67217,548,20,Oct
2071,Cumulative geometric probability (less than a value) | AP Statistics | Khan Academy,2017-10-04,14694,53,4,Oct
2072,Cumulative geometric probability (greater than a value) | AP Statistics | Khan Academy,2017-10-04,18070,51,5,Oct
2073,Probability for a geometric random variable | Random variables | AP Statistics | Khan Academy,2017-10-04,20917,79,2,Oct
2074,Geometric random variables introduction | Random variables | AP Statistics | Khan Academy,2017-10-04,55769,378,14,Oct
2075,Finding the mean and standard deviation of a binomial random variable | AP Statistics | Khan Academy,2017-10-04,64288,450,8,Oct
2076,Expected value of a binomial variable | Random variables | AP Statistics | Khan Academy,2017-10-04,35709,147,8,Oct
2077,Variance of a binomial variable | Random variables | AP Statistics | Khan Academy,2017-10-04,40820,229,14,Oct
2078,Recognizing binomial variables | Random variables | AP Statistics | Khan Academy,2017-10-03,28771,67,2,Oct
2079,Binomial variables | Random variables | AP Statistics | Khan Academy,2017-10-03,75889,409,9,Oct
2080,Capital vs. consumer goods and economic growth | Microeconomics | Khan Academy,2017-10-03,30079,357,12,Oct
2081,Comparative advantage - input approach | Basic economic concepts | Microeconomics | Khan Academy,2017-10-03,12561,58,5,Oct
2082,Comparative advantage - output approach | Basic economic concepts | Microeconomics | Khan Academy,2017-10-03,4051,38,1,Oct
2083,Intuition for why independence matters for variance of sum | AP Statistics | Khan Academy,2017-10-03,20184,110,5,Oct
2084,Variance of sum and difference of random variables | Random variables | AP Statistics | Khan Academy,2017-10-03,51995,304,7,Oct
2085,Polar curve area with calculator,2017-10-02,11782,67,5,Oct
2086,Justification using second derivative: inflection point | AP Calculus AB | Khan Academy,2017-09-28,12878,80,6,Sep
2087,Analyzing related rates problems: equations (trig) | AP Calculus AB | Khan Academy,2017-09-28,25063,105,6,Sep
2088,Worked example: area between curves | AP Calculus AB | Khan Academy,2017-09-28,55270,222,10,Sep
2089,Worked example: differentiating polar functions | AP Calculus BC | Khan Academy,2017-09-28,10890,35,14,Sep
2090,Worked example: Logistic model word problem | Differential equations | AP Calculus BC | Khan Academy,2017-09-27,67761,481,27,Sep
2091,Worked example: over- and under-estimation of Riemann sums | AP Calculus AB | Khan Academy,2017-09-27,29850,80,4,Sep
2092,Over- and under-estimation of Riemann sums | AP Calculus AB | Khan Academy,2017-09-27,71494,244,8,Sep
2093,Limits from graphs | Limits and continuity | AP Calculus AB | Khan Academy,2017-09-27,133648,678,19,Sep
2094,Worked example: problem involving definite integral (algebraic) | AP Calculus AB | Khan Academy,2017-09-23,29979,185,11,Sep
2095,Area between curves | Applications of definite integrals | AP Calculus AB | Khan Academy,2017-09-22,241877,1543,19,Sep
2096,Example: Describing a distribution | AP Statistics | Khan Academy,2017-09-13,39970,237,8,Sep
2097,Example: Comparing distributions | AP Statistics | Khan Academy,2017-09-13,60473,192,5,Sep
2098,Planar motion (with integrals) | Applications of definite integrals | AP Calculus BC | Khan Academy,2017-09-11,4684,21,2,Sep
2099,Approximating limits using tables | Limits and continuity | AP Calculus AB | Khan Academy,2017-09-11,168783,911,30,Sep
2100,Analyzing motion problems: position | AP Calculus AB | Khan Academy,2017-09-11,11248,20,2,Sep
2101,Analyzing motion problems: total distance traveled | AP Calculus AB | Khan Academy,2017-09-11,9525,17,0,Sep
2102,Motion problems with integrals: displacement vs. distance | AP Calculus AB | Khan Academy,2017-09-11,63741,442,13,Sep
2103,Analyzing problems involving definite integrals | AP Calculus AB | Khan Academy,2017-09-11,14752,72,1,Sep
2104,Worked examples: interpreting definite integrals in context | AP Calculus AB | Khan Academy,2017-09-08,11174,48,1,Sep
2105,Interpreting definite integral as net change | AP Calculus AB | Khan Academy,2017-09-08,24262,134,7,Sep
2106,Interpreting behavior of _ from graph of _'=ÃÂ | AP Calculus AB | Khan Academy,2017-09-08,13423,24,4,Sep
2107,_-substitution: definite integrals | AP Calculus AB | Khan Academy,2017-09-08,66582,234,6,Sep
2108,_-substitution: defining _ | AP Calculus AB | Khan Academy,2017-09-08,53502,104,4,Sep
2109,_-substitution: defining _ (more examples) | AP Calculus AB | Khan Academy,2017-09-08,43251,54,4,Sep
2110,Worked example: finding a Riemann sum using a table | AP Calculus AB | Khan Academy,2017-09-08,64683,127,3,Sep
2111,Analyzing related rates problems: expressions | AP Calculus AB | Khan Academy,2017-09-07,23985,31,5,Sep
2112,Mistakes when finding inflection points: not checking candidates | AP Calculus AB | Khan Academy,2017-09-07,7627,36,1,Sep
2113,Mistakes when finding inflection points: second derivative undefined | AP Calculus AB | Khan Academy,2017-09-07,25662,139,7,Sep
2114,Justification using second derivative: maximum point | AP Calculus AB | Khan Academy,2017-09-07,10610,9,0,Sep
2115,Calculus based justification for function increasing | AP Calculus AB | Khan Academy,2017-09-07,10739,15,1,Sep
2116,Conditions for MVT: table | Existence theorems | AP Calculus AB | Khan Academy,2017-09-07,18190,6,0,Sep
2117,Conditions for MVT: graph | Existence theorems | AP Calculus AB | Khan Academy,2017-09-07,32343,21,3,Sep
2118,Introduction to integral calculus | Accumulation and Riemann sums | AP Calculus AB | Khan Academy,2017-09-07,629256,7406,128,Sep
2119,"Connecting f, f', and f'' graphically | AP Calculus AB | Khan Academy",2017-09-06,219223,1601,21,Sep
2120,"Connecting f, f', and f'' graphically (another example) | AP Calculus AB | Khan Academy",2017-09-06,25192,120,4,Sep
2121,Derivatives of inverse functions | Advanced derivatives | AP Calculus AB | Khan Academy,2017-09-06,197679,1648,47,Sep
2122,Derivative of ln(x) | Advanced derivatives | AP Calculus AB | Khan Academy,2017-09-05,44187,181,14,Sep
2123,The West Indies and the Southern colonies | AP US History | Khan Academy,2017-08-26,79536,358,27,Aug
2124,Politics and indigenous relations in the New England colonies | AP US History | Khan Academy,2017-08-26,70786,311,25,Aug
2125,Society and religion in the New England colonies | AP US History | Khan Academy,2017-08-26,150203,787,59,Aug
2126,The Middle colonies | Period 2: 1607-1754 | AP US History | Khan Academy,2017-08-22,120241,514,38,Aug
2127,French and Dutch colonization | Period 2: 1607-1754 | AP US History | Khan Academy,2017-08-22,158124,735,74,Aug
2128,Spanish colonization | Period 1: 1491-1607 | AP US History | Khan Academy,2017-08-22,295924,1973,254,Aug
2129,Native American societies before contact | Period 1: 1491-1607 | AP US History | Khan Academy,2017-08-21,494714,2470,365,Aug
2130,Command and market economies | Basic economics concepts | AP Macroeconomics | Khan Academy,2017-08-14,252048,2555,185,Aug
2131,Adding and subtracting on number line 2 | 2nd grade | Khan Academy,2017-08-14,209214,132,0,Aug
2132,Addition using groups of 10 and 100 | 2nd grade | Khan Academy,2017-08-14,338302,149,0,Aug
2133,Solving 3-digit addition in your head | 2nd grade | Khan Academy,2017-08-14,181787,234,0,Aug
2134,Breaking apart 3-digit addition problems | 2nd grade | Khan Academy,2017-08-14,347175,158,0,Aug
2135,Subtracting 3-digit numbers (no regrouping) | 2nd grade | Khan Academy,2017-08-14,169816,502,0,Aug
2136,Adding 3-digit numbers (no regrouping) | 2nd grade | Khan Academy,2017-08-14,188829,449,0,Aug
2137,Missing numbers in addition and subtraction | 2nd grade | Khan Academy,2017-08-14,194603,363,0,Aug
2138,Addition and subtraction with number lines | 2nd grade | Khan Academy,2017-08-14,168703,129,0,Aug
2139,Strategies for adding 2-digit numbers | 2nd grade | Khan Academy,2017-08-14,144698,60,26,Aug
2140,Subtracting a 1-digit number with regrouping | 2nd grade | Khan Academy,2017-08-14,141781,333,0,Aug
2141,Subtracting two-digit numbers without regrouping (example 2) | 2nd grade | Khan Academy,2017-08-14,83702,148,0,Aug
2142,Subtracting 1 vs. subtracting 10 | Addition and subtraction within 100 | 2nd grade | Khan Academy,2017-08-14,107362,81,0,Aug
2143,Example of vector magnitude from initial and terminal points,2017-08-14,40176,61,5,Aug
2144,Worked example: separable differential equation (with taking log of both sides) | Khan Academy,2017-08-13,3742,24,7,Aug
2145,Normative and positive statements | Basic economics concepts | AP Macroeconomics | Khan Academy,2017-08-11,200290,2250,49,Aug
2146,Solar and lunar eclipses,2017-08-11,60778,375,41,Aug
2147,The Moon,2017-08-11,63358,503,41,Aug
2148,Justification using first derivative | AP Calculus AB | Khan Academy,2017-08-10,14217,10,2,Aug
2149,Examples establishing conditions for MVT,2017-08-10,465,1,1,Aug
2150,Mean of sum and difference of random variables | Random variables | AP Statistics | Khan Academy,2017-08-10,28287,59,3,Aug
2151,Worked example: Parametric arc length | AP Calculus BC | Khan Academy,2017-08-10,19354,143,6,Aug
2152,Parametric curve arc length | Applications of definite integrals | AP Calculus BC | Khan Academy,2017-08-10,45948,432,16,Aug
2153,Polar functions derivatives | Advanced derivatives | AP Calculus BC | Khan Academy,2017-08-10,35259,262,10,Aug
2154,Derivative of __ | Advanced derivatives | AP Calculus AB | Khan Academy,2017-08-10,53060,188,14,Aug
2155,Economic models | Basic economics concepts | AP Macroeconomics and Microeconomics | Khan Academy,2017-08-08,258805,2043,48,Aug
2156,Scarcity | Basic economics concepts | Economics | Khan Academy,2017-08-07,272236,2485,70,Aug
2157,Analyzing mistakes when finding extrema (example 1) | AP Calculus AB | Khan Academy,2017-08-04,16167,30,5,Aug
2158,Conditions for IVT and EVT: graph | Existence theorems | AP Calculus AB | Khan Academy,2017-08-03,18078,14,3,Aug
2159,Conditions for IVT and EVT: table | Existence theorems | AP Calculus AB | Khan Academy,2017-08-03,13566,18,1,Aug
2160,Estimating limits from tables | Limits and continuity | AP Calculus AB | Khan Academy,2017-08-03,80729,97,6,Aug
2161,Impact of transforming (scaling and shifting) random variables | AP Statistics | Khan Academy,2017-08-03,68030,492,18,Aug
2162,Indefinite integrals: sums & multiples | AP Calculus AB | Khan Academy,2017-08-02,31704,88,8,Aug
2163,A message from Sal Khan for the Khan Academy 2016 Annual Report,2017-08-02,3246,121,16,Aug
2164,Horizontal area between curves | Applications of definite integrals | AP Calculus AB | Khan Academy,2017-08-01,38142,201,14,Aug
2165,Area between a curve and and the _-axis | AP Calculus AB | Khan Academy,2017-08-01,30982,96,5,Aug
2166,Worked example: separable differential equations | AP Calculus AB | Khan Academy,2017-08-01,26034,67,12,Aug
2167,Integration by parts: definite integrals | AP Calculus BC | Khan Academy,2017-08-01,90117,725,22,Aug
2168,A message from Sal Khan for the Khan Academy 2016 Annual Report,2017-08-01,12069,406,59,Aug
2169,Rewriting before integrating | AP Calculus AB | Khan Academy,2017-08-01,27021,101,3,Aug
2170,Worked example: Rewriting limit of Riemann sum as definite integral | AP Calculus AB | Khan Academy,2017-08-01,155367,1092,34,Aug
2171,Worked example: Rewriting definite integral as limit of Riemann sum | AP Calculus AB | Khan Academy,2017-08-01,89235,438,20,Aug
2172,Worked examples: Summation notation | Accumulation and Riemann sums | AP Calculus AB | Khan Academy,2017-08-01,36086,215,9,Aug
2173,2017 AP Calculus AB/BC 4c | AP Calculus AB solved exams | AP Calculus AB | Khan Academy,2017-07-31,13447,48,2,Jul
2174,2017 AP Calculus AB/BC 4b | AP Calculus AB solved exams | AP Calculus AB | Khan Academy,2017-07-31,15014,33,8,Jul
2175,2017 AP Calculus AB/BC 4a | AP Calculus AB solved exams | AP Calculus AB | Khan Academy,2017-07-31,32521,81,20,Jul
2176,Midpoint sums | Accumulation and Riemann sums | AP Calculus AB | Khan Academy,2017-07-31,62353,142,9,Jul
2177,Definite integrals intro | Accumulation and Riemann sums | AP Calculus AB | Khan Academy,2017-07-31,166434,840,23,Jul
2178,Khan Academy in the classroom | Limits and continuity | AP Calculus AB | Khan Academy,2017-07-28,114655,154,11,Jul
2179,"Meet Jeff, a creator of AP Statistics on Khan Academy | AP Statistics | Khan Academy",2017-07-28,57677,92,12,Jul
2180,Inflection points from graphs of function & derivatives | AP Calculus AB | Khan Academy,2017-07-27,24974,88,7,Jul
2181,Worked example: Inflection points from second derivative | AP Calculus AB | Khan Academy,2017-07-27,16038,53,5,Jul
2182,Existence theorems intro | Existence theorems | AP Calculus AB | Khan Academy,2017-07-27,31456,187,14,Jul
2183,"Identifying f, f', and f'' based on graphs",2017-07-27,181338,1184,30,Jul
2184,Differentiating using multiple rules: strategy | AP Calculus AB | Khan Academy,2017-07-26,33526,119,6,Jul
2185,Worked example: Differentiating related functions | AP Calculus AB | Khan Academy,2017-07-26,29289,51,10,Jul
2186,Differentiating related functions intro | Advanced derivatives | AP Calculus AB | Khan Academy,2017-07-26,39664,73,3,Jul
2187,Applying the chain rule twice | Advanced derivatives | AP Calculus AB | Khan Academy,2017-07-26,48889,303,14,Jul
2188,Applying the chain rule and product rule | Advanced derivatives | AP Calculus AB | Khan Academy,2017-07-26,52415,283,9,Jul
2189,Quotient rule | Derivative rules | AP Calculus AB | Khan Academy,2017-07-26,119634,478,13,Jul
2190,Proof: the derivative of ln(x) is 1/x | Advanced derivatives | AP Calculus AB | Khan Academy,2017-07-25,81652,1030,62,Jul
2191,Proof: The derivative of __ is __ | Advanced derivatives | AP Calculus AB | Khan Academy,2017-07-25,75800,614,50,Jul
2192,Proof of the derivative of cos(x) | Derivative rules | AP Calculus AB | Khan Academy,2017-07-25,16250,118,5,Jul
2193,Derivatives of sin(x) and cos(x) | Derivative rules | AP Calculus AB | Khan Academy,2017-07-25,54100,349,18,Jul
2194,Limit of sin(x)/x as x approaches 0 | Derivative rules | AP Calculus AB | Khan Academy,2017-07-25,233149,1766,113,Jul
2195,Limit of (1-cos(x))/x as x approaches 0 | Derivative rules | AP Calculus AB | Khan Academy,2017-07-25,106071,868,34,Jul
2196,Local linearity and differentiability | Derivatives introduction | AP Calculus AB | Khan Academy,2017-07-24,26393,113,11,Jul
2197,Differentiability and continuity | Derivatives introduction | AP Calculus AB | Khan Academy,2017-07-21,221179,1811,47,Jul
2198,Estimating derivatives | Derivatives introduction | AP Calculus AB | Khan Academy,2017-07-21,57339,149,8,Jul
2199,Secant lines & average rate of change | Derivatives introduction | AP Calculus AB | Khan Academy,2017-07-20,95825,392,11,Jul
2200,Derivative as a concept | Derivatives introduction | AP Calculus AB | Khan Academy,2017-07-19,789640,14217,275,Jul
2201,Limits of trigonometric functions | Limits and continuity | AP Calculus AB | Khan Academy,2017-07-17,233064,1324,39,Jul
2202,Example: Analyzing the difference in distributions | Random variables | AP Statistics | Khan Academy,2017-07-15,15354,73,8,Jul
2203,Example: Transforming a discrete random variable | Random variables | AP Statistics | Khan Academy,2017-07-14,26200,38,3,Jul
2204,Example: Analyzing distribution of sum of two normally distributed random variables | Khan Academy,2017-07-14,30953,112,3,Jul
2205,Probabilities from density curves | Random variables | AP Statistics | Khan Academy,2017-07-14,64528,127,15,Jul
2206,Variance and standard deviation of a discrete random variable | AP Statistics | Khan Academy,2017-07-14,298479,2224,49,Jul
2207,Mean (expected value) of a discrete random variable | AP Statistics | Khan Academy,2017-07-14,341880,2613,58,Jul
2208,Probability with discrete random variable example | Random variables | AP Statistics | Khan Academy,2017-07-14,110194,273,19,Jul
2209,Valid discrete probability distribution examples | Random variables | AP Statistics | Khan Academy,2017-07-13,69736,54,4,Jul
2210,Conditional probability tree diagram example | Probability | AP Statistics | Khan Academy,2017-07-13,123446,834,33,Jul
2211,Conditional probability and independence | Probability | AP Statistics | Khan Academy,2017-07-13,154964,785,13,Jul
2212,Random numbers for experimental probability | Probability | AP Statistics | Khan Academy,2017-07-13,34155,79,11,Jul
2213,Random number list to run experiment | Probability | AP Statistics | Khan Academy,2017-07-13,47789,158,8,Jul
2214,Experimental versus theoretical probability simulation | Probability | AP Statistics | Khan Academy,2017-07-12,46490,117,9,Jul
2215,Impact of removing outliers on regression lines | AP Statistics | Khan Academy,2017-07-12,29671,86,3,Jul
2216,Interpreting computer regression data | AP Statistics | Khan Academy,2017-07-12,35891,175,6,Jul
2217,Standard deviation of residuals or Root-mean-square error (RMSD),2017-07-12,128744,801,36,Jul
2218,Threshold for low percentile | Modeling data distributions | AP Statistics | Khan Academy,2017-07-12,30605,84,8,Jul
2219,Residual plots | Exploring bivariate numerical data | AP Statistics | Khan Academy,2017-07-12,102646,566,27,Jul
2220,Calculating the equation of a regression line | AP Statistics | Khan Academy,2017-07-11,88618,272,10,Jul
2221,Calculating correlation coefficient r | AP Statistics | Khan Academy,2017-07-11,295506,1985,80,Jul
2222,Finding z-score for a percentile | AP Statistics | Khan Academy,2017-07-11,171055,825,20,Jul
2223,Standard normal table for proportion between values | AP Statistics | Khan Academy,2017-07-10,82698,448,18,Jul
2224,Standard normal table for proportion above | AP Statistics | Khan Academy,2017-07-10,43174,115,6,Jul
2225,Standard normal table for proportion below | AP Statistics | Khan Academy,2017-07-10,42485,70,2,Jul
2226,Worked example finding area under density curves | AP Statistics | Khan Academy,2017-07-07,33732,74,4,Jul
2227,Density curve worked example | Modeling data distributions | AP Statistics | Khan Academy,2017-07-07,31931,45,5,Jul
2228,"Median, mean and skew from density curves | AP Statistics | Khan Academy",2017-07-07,228019,1647,63,Jul
2229,Density Curves | Modeling data distributions | AP Statistics | Khan Academy,2017-07-07,107204,952,28,Jul
2230,Worked example: distance and displacement from position-time graphs | AP Physics 1 | Khan Academy,2017-07-06,180335,1224,32,Jul
2231,Regrouping to add 1-digit number | Addition and subtraction | 1st grade | Khan Academy,2017-07-06,134304,274,0,Jul
2232,Breaking apart 2-digit addition problems | Addition and subtraction | 1st grade | Khan Academy,2017-07-06,149812,143,0,Jul
2233,Adding 2-digit numbers without regrouping 1 | Addition and subtraction | 1st grade | Khan Academy,2017-07-06,206640,293,0,Jul
2234,Adding 1 vs. adding 10 | Addition and subtraction | 1st grade | Khan Academy,2017-07-06,203738,189,0,Jul
2235,Comparison word problems: roly-polies | Addition and subtraction | 1st grade | Khan Academy,2017-07-06,185906,121,0,Jul
2236,Position-time graphs | One-dimensional motion | AP Physics 1 | Khan Academy,2017-07-06,126325,908,24,Jul
2237,Distance and displacement in one dimension | One-dimensional motion | AP Physics 1 | Khan Academy,2017-07-06,117044,942,31,Jul
2238,Distance and displacement introduction | One-dimensional motion | AP Physics 1 | Khan Academy,2017-07-06,616123,6420,205,Jul
2239,The US Constitution | Period 3: 1754-1800 | AP US History | Khan Academy,2017-07-04,203854,1057,38,Jul
2240,The Constitutional Convention | Period 3: 1754-1800 | AP US History | Khan Academy,2017-07-04,130229,501,37,Jul
2241,The Articles of Confederation | Period 3: 1754-1800 | AP US History | Khan Academy,2017-07-03,187161,708,54,Jul
2242,The Declaration of Independence | Period 3: 1754-1800 | AP US History | Khan Academy,2017-07-03,162608,749,74,Jul
2243,How did Russia begin? | 1450 - Present | AP US History | Khan Academy,2017-07-03,68493,677,118,Jul
2244,Types of discontinuities | Limits and continuity | AP Calculus AB | Khan Academy,2017-06-29,128713,845,21,Jun
2245,Functions with same limit at infinity | Limits and continuity | AP Calculus AB | Khan Academy,2017-06-29,42190,65,9,Jun
2246,Infinite limits and asymptotes | Limits and continuity | AP Calculus AB | Khan Academy,2017-06-29,70133,162,10,Jun
2247,Continuity over an interval | Limits and continuity | AP Calculus AB | Khan Academy,2017-06-29,171916,1033,37,Jun
2248,Graphical limit example,2017-06-28,25822,47,2,Jun
2249,Connecting limits and graphical behavior | Limits and continuity | AP Calculus AB | Khan Academy,2017-06-28,77796,155,9,Jun
2250,Comparing Roman and Byzantine Empires | AP US History | Khan Academy,2017-06-28,100708,768,101,Jun
2251,Comparison: Rise of empires | World History | Khan Academy,2017-06-20,62765,480,44,Jun
2252,Continuity-Sikhism connections to Hinduism and Islam | 1450 - Present | World History | Khan Academy,2017-06-20,67881,799,441,Jun
2253,Contextualization--Islam | World History | Khan Academy,2017-06-16,178326,1363,184,Jun
2254,Buddhism: context and comparison | World History | Khan Academy,2017-06-16,46174,460,37,Jun
2255,International Human Rights | 1450 - Present | World History | Khan Academy,2017-06-16,44967,389,18,Jun
2256,The Scientific Revolution and the Age of Enlightenment | World History | Khan Academy,2017-06-16,236185,1688,40,Jun
2257,Frankish women in the Carolingian Dynasty primary source | World History | Khan Academy,2017-06-15,4448,79,10,Jun
2258,Japanese Imperialism | World History | Khan Academy,2017-06-14,108463,1016,44,Jun
2259,Opium Wars  | World History | Khan Academy,2017-06-14,150208,1251,77,Jun
2260,The Holocaust  | World History | Khan Academy,2017-06-11,236242,1186,164,Jun
2261,Independence movements in the 20th Century | World History | Khan Academy,2017-06-09,69274,499,52,Jun
2262,Latin American Independence movements | 1450 - Present | World History | Khan Academy,2017-06-07,135703,868,75,Jun
2263,Industrialization and imperialism | World History | Khan Academy,2017-06-06,265946,1936,103,Jun
2264,Interpreting slope of regression line | AP Statistics | Khan Academy,2017-06-06,83417,237,3,Jun
2265,Interpreting y-intercept in regression model | AP Statistics | Khan Academy,2017-06-06,58346,167,3,Jun
2266,Mughal rule in India | 1450 - Present | World History | Khan Academy,2017-06-05,303735,1410,154,Jun
2267,This school year may be ending but we have lots to do for next year.,2017-06-05,28624,798,72,Jun
2268,Sikhism introduction | World History | Khan Academy,2017-06-03,566318,8208,1112,Jun
2269,"Ottoman, Safavid and Mughal Empires | World History | Khan Academy",2017-05-31,287560,2683,440,May
2270,Khan Academy Live: SAT Writing,2017-05-30,73586,1201,35,May
2271,Timur | 600 - 1450 Regional and interregional interactions | World History | Khan Academy,2017-05-30,55412,405,47,May
2272,Classical Japan during the Heian Period | World History | Khan Academy,2017-05-30,33865,209,16,May
2273,Bhakti movement | World History | Khan Academy,2017-05-27,74251,703,51,May
2274,Why were the Mongols so effective? | World History | Khan Academy,2017-05-26,177188,2088,307,May
2275,Knights Templar | World History | Khan Academy,2017-05-25,99219,1203,161,May
2276,Example estimating from regression line,2017-05-25,72664,129,19,May
2277,Introduction to residuals and least squares regression,2017-05-25,556603,4694,97,May
2278,Calculating residual example | Exploring bivariate numerical data | AP Statistics | Khan Academy,2017-05-24,65089,92,7,May
2279,How parameters change as data is shifted and scaled | AP Statistics | Khan Academy,2017-05-24,37627,68,4,May
2280,Comparing with z-scores | Modeling data distributions | AP Statistics | Khan Academy,2017-05-24,74067,137,3,May
2281,Calculating percentile | Modeling data distributions | AP Statistics | Khan Academy,2017-05-24,225924,893,29,May
2282,Analyzing a cumulative relative frequency graph | AP Statistics | Khan Academy,2017-05-24,81735,334,11,May
2283,Mean and standard deviation versus median and IQR | AP Statistics | Khan Academy,2017-05-24,126347,742,29,May
2284,"Bivariate relationship linearity, strength and direction | AP Statistics | Khan Academy",2017-05-24,129058,980,23,May
2285,Khan Academy Live: SAT Reading (Hangouts on air),2017-05-23,42259,793,25,May
2286,Relating circumference and area,2017-05-23,115953,150,26,May
2287,Example of shapes on a coordinate plane,2017-05-23,36570,90,9,May
2288,Surface area word problem example,2017-05-23,89766,243,24,May
2289,Finding height of a parallelogram,2017-05-23,378007,1050,70,May
2290,Counting faces and edges of 3D shapes,2017-05-23,163142,449,49,May
2291,Example finding area of triangle,2017-05-23,570796,2100,192,May
2292,How volume changes from changing dimensions,2017-05-23,89626,144,13,May
2293,Pythagorean theorem with right triangle,2017-05-23,95392,208,13,May
2294,Partial circle area and arc length,2017-05-23,168766,213,19,May
