,Title,Published_date,Views,Likes,Comments,Month
4078,Interview with Colin Fuller,2015-05-11,5220,45,6,May
4079,Interview with Natalie Rothfels,2015-05-11,6152,86,13,May
4080,Adding mixed numbers introduction | Fractions | 4th grade | Khan Academy,2015-05-08,283166,660,0,May
4081,Interview with Alex Lopatin,2015-05-07,3655,41,4,May
4082,Subtracting mixed numbers introduction | Fractions | 4th grade | Khan Academy,2015-05-07,196514,494,0,May
4083,Interview with Yin Lu,2015-05-06,7745,171,23,May
4084,Interview with James Tynan,2015-05-06,5542,0,9,May
4085,Interview with Chris Klaiber,2015-05-05,3500,38,3,May
4086,Interview with Emily Eisenberg,2015-05-05,11257,0,4,May
4087,Phases of meiosis II | Cells | MCAT | Khan Academy,2015-05-05,286016,855,34,May
4088,Phases of meiosis I | Cells | MCAT | Khan Academy,2015-05-05,541210,1175,52,May
4089,Chromosomal crossover in Meiosis I,2015-05-05,333358,942,25,May
4090,Comparing mitosis and meiosis | Cells | MCAT | Khan Academy,2015-05-05,1764693,11148,422,May
4091,Interview with Ben Eater,2015-05-05,177763,3827,54,May
4092,Interview with Dylan Vassallo,2015-05-05,2426,49,10,May
4093,Mitosis | Cells | MCAT | Khan Academy,2015-05-04,1190534,5344,203,May
4094,Interphase | Cells | MCAT | Khan Academy,2015-05-04,863310,4249,173,May
4095,Interview with David Hu,2015-05-02,11851,206,16,May
4096,Interview with Emily Abrash,2015-05-02,8865,169,11,May
4097,Interview with Murrayl Berner,2015-05-01,4929,55,6,May
4098,Interview with Nick Louie,2015-05-01,4611,72,5,May
4099,Interview with Tom Pryor,2015-05-01,4835,74,5,May
4100,Interview with Karina Murtagh,2015-05-01,3322,59,5,May
4101,Comparing irrational numbers involving radicals | Numbers and operations | 8th grade | Khan Academy,2015-04-29,110250,195,32,Apr
4102,How to classify numbers | Numbers and operations | 8th grade | Khan Academy,2015-04-29,490456,2055,180,Apr
4103,How to approximate square roots | Numbers and operations | 8th grade | Khan Academy,2015-04-29,434185,1550,164,Apr
4104,Dimensions of a cube from its volume | Numbers and operations | 8th grade | Khan Academy,2015-04-28,150613,421,50,Apr
4105,Square root of decimal (example) | Numbers and operations | 8th grade | Khan Academy,2015-04-28,438817,580,32,Apr
4106,Introduction to cube roots | Numbers and operations | 8th grade | Khan Academy,2015-04-28,891278,2415,234,Apr
4107,Introduction to square roots | Numbers and operations | 8th grade | Khan Academy,2015-04-28,1205796,6610,468,Apr
4108,Standard form for linear equations | Algebra I | Khan Academy,2015-04-22,575226,2252,152,Apr
4109,Point-slope and slope-intercept form from two points | Algebra I | Khan Academy,2015-04-22,468766,1459,98,Apr
4110,Slope-intercept form | Algebra I | Khan Academy,2015-04-22,1875918,13157,1221,Apr
4111,Introduction to intercepts |  Algebra I | Khan Academy,2015-04-22,289610,405,26,Apr
4112,Introduction to slope | Algebra I | Khan Academy,2015-04-21,673943,2399,165,Apr
4113,Subtracting in scientific notation | Numbers and operations | 8th grade | Khan Academy,2015-04-21,238761,449,58,Apr
4114,Cheryl's birthday | Puzzles | Math for fun and glory | Khan Academy,2015-04-17,315304,1159,182,Apr
4115,Semiconductor introduction,2015-03-24,251952,2229,134,Mar
4116,Liter intuition | Measurement and geometry | 3rd grade | Khan Academy,2015-03-10,169384,433,0,Mar
4117,Describing subsets of sample spaces exercise | Probability and Statistics | Khan Academy,2015-03-08,180060,82,4,Mar
4118,Vector components from initial and terminal points | Vectors | Precalculus | Khan Academy,2015-03-08,58933,242,3,Mar
4119,Figuring out vector initial point | Vectors | Precalculus | Khan Academy,2015-03-08,31845,102,1,Mar
4120,Constructing a tangent line using compass and straightedge | Geometry | Khan Academy,2015-03-07,63343,153,9,Mar
4121,Another example using compass and straightedge for tangent line | Geometry | Khan Academy,2015-03-07,30411,62,6,Mar
4122,Showing angles have same measure | Angles and intersecting lines | Geometry | Khan Academy,2015-03-07,156697,79,7,Mar
4123,Line and angle proofs exercise | Angles and intersecting lines | Geometry | Khan Academy,2015-03-07,115329,68,8,Mar
4124,"Ways to cut a cube | Perimeter, area, and volume | Geometry | Khan Academy",2015-03-07,193489,474,33,Mar
4125,Geometric precision practice | Introduction to Euclidean geometry | Geometry | Khan Academy,2015-03-06,258659,85,9,Mar
4126,Analyzing polynomial manipulations | Polynomial and rational functions | Algebra II | Khan Academy,2015-03-06,98739,376,12,Mar
4127,Ellipse focus intuition exercise | Conic sections | Algebra II | Khan Academy,2015-03-06,29747,95,9,Mar
4128,Factoring and completing square of higher degree expressions | Algebra II | Khan Academy,2015-03-06,30431,193,8,Mar
4129,Understanding function inverses example | Functions and their graphs | Algebra II | Khan Academy,2015-03-06,141269,71,3,Mar
4130,Understanding inverse functions | Functions and their graphs | Algebra II | Khan Academy,2015-03-06,347213,1110,42,Mar
4131,Product rule proof | Taking derivatives | Differential Calculus | Khan Academy,2015-03-05,159881,1792,74,Mar
4132,Graphing piecewise function | Functions and their graphs | Algebra II | Khan Academy,2015-03-05,477368,687,27,Mar
4133,Piecewise function formula from graph | Functions and their graphs | Algebra II | Khan Academy,2015-03-05,786015,2228,56,Mar
4134,Restricting domain of function to make invertible,2015-03-05,94467,723,24,Mar
4135,Writing expressions with exponents,2015-03-05,18866,57,7,Mar
4136,Simplifying an exponential expression | Algebra II | Khan Academy,2015-03-05,268055,676,24,Mar
4137,Modeling mosquitos with quadratics | Quadratic equations | Algebra I | Khan Academy,2015-03-05,98344,69,5,Mar
4138,Rewriting an exponential expression in a hairier way | Algebra II | Khan Academy,2015-03-05,109580,100,8,Mar
4139,How to find the area of a triangle on a grid | Geometry | 6th grade | Khan Academy,2015-03-04,370066,727,65,Mar
4140,Translating expressions with parentheses | Algebric thinking | 5th grade | Khan Academy,2015-03-04,276184,435,0,Mar
4141,More ways to think about multiplying | Multiplication and division | 4th grade | Khan Academy,2015-03-04,504705,265,0,Mar
4142,Area models to visualize division using place value | 4th grade | Khan Academy,2015-03-04,273382,383,0,Mar
4143,Division using understanding of place value | 4th grade | Khan Academy,2015-03-04,341148,339,0,Mar
4144,Introduction to trigonometric substitution,2015-03-04,351531,1557,80,Mar
4145,Conditional & absolute convergence | Series | AP Calculus BC | Khan Academy,2015-03-03,264284,786,24,Mar
4146,Infinite series as limit of partial sums | Series | AP Calculus BC | Khan Academy,2015-03-03,266273,777,24,Mar
4147,Partial sums intro | Series | AP Calculus BC | Khan Academy,2015-03-03,209252,640,25,Mar
4148,Proof: Differentiability implies continuity | Derivative rules | AP Calculus AB | Khan Academy,2015-03-02,194234,1271,85,Mar
4149,Chain rule proof | Derivative rules | AP Calculus AB | Khan Academy,2015-03-02,159077,1359,82,Mar
4150,"If function u is continuous at x, then _u_0 as _x_0 | AP Calculus AB | Khan Academy",2015-03-02,31223,63,3,Mar
4151,Probability from compound sample space | Statistics and probability | 7th grade | Khan Academy,2015-02-27,282612,329,38,Feb
4152,Compound sample spaces | Statistics and probability | 7th grade | Khan Academy,2015-02-26,174585,233,28,Feb
4153,Constructing probability model from observations | 7th grade | Khan Academy,2015-02-19,232963,276,17,Feb
4154,Comparing theoretical to experimental probabilites | 7th grade | Khan Academy,2015-02-17,400137,1420,178,Feb
4155,Making predictions with probability | Statistics and probability | 7th grade | Khan Academy,2015-02-17,267122,652,50,Feb
4156,Intuitive sense of probabilities | Statistics and probability | 7th grade | Khan Academy,2015-02-17,176286,181,24,Feb
4157,Experimental probability | Statistics and probability | 7th grade | Khan Academy,2015-02-13,475672,1217,169,Feb
4158,Thinking about shapes of distributions | Data and statistics | 6th grade | Khan Academy,2015-02-12,434725,937,56,Feb
4159,Interpreting box plots | Data and statistics | 6th grade | Khan Academy,2015-02-12,592361,2142,160,Feb
4160,Mean absolute deviation example | Data and statistics | 6th grade | Khan Academy,2015-02-09,202669,210,22,Feb
4161,Mean absolute deviation | Data and statistics | 6th grade | Khan Academy,2015-02-09,1053411,3864,463,Feb
4162,Median and range puzzle | Data and statistics | 6th grade | Khan Academy,2015-02-05,110799,114,45,Feb
4163,How to find a missing value given the mean | Data and statistics | 6th grade | Khan Academy,2015-02-05,553766,1649,200,Feb
4164,How to interpret a histogram | Data and statistics | 6th grade | Khan Academy,2015-02-05,429186,1034,73,Feb
4165,How to create a histogram | Data and statistics | 6th grade | Khan Academy,2015-02-04,1142006,5240,531,Feb
4166,Statistical questions | Data and statistics | 6th grade | Khan Academy,2015-02-04,552506,1191,146,Feb
4167,Frequency tables and dot plots | Data and statistics | 6th grade | Khan Academy,2015-02-04,822936,1845,212,Feb
4168,Values to make absolute value inequality true | Negative numbers | 6th grade | Khan Academy,2015-02-03,48353,46,2,Feb
4169,Comparing absolute values on number line | Negative numbers | 6th grade | Khan Academy,2015-02-03,50298,38,6,Feb
4170,Sorting absolute values on number line | Negative numbers | 6th grade | Khan Academy,2015-02-03,164302,54,6,Feb
4171,Interpreting absolute value | Negative numbers | 6th grade | Khan Academy,2015-02-03,238113,108,12,Feb
4172,Ordering rational numbers | Negative numbers | 6th grade | Khan Academy,2015-02-03,305094,871,0,Feb
4173,Comparing negatives with variables | Negative numbers | 6th grade | Khan Academy,2015-02-02,90624,51,7,Feb
4174,Deflate gate | Gases and kinetic molecular theory | Chemistry | Khan Academy,2015-01-31,149239,486,131,Jan
4175,Negative symbol as opposite | Negative numbers | 6th grade | Khan Academy,2015-01-30,250793,218,24,Jan
4176,Number opposites practice | Negative numbers | 6th grade | Khan Academy,2015-01-30,87010,36,10,Jan
4177,Opposite of a number | Negative numbers | 6th grade | Khan Academy,2015-01-30,575267,1020,0,Jan
4178,Idea behind hypothesis testing | Probability and Statistics | Khan Academy,2015-01-27,166384,540,45,Jan
4179,Finding focus and directrix from vertex | Conic sections | Algebra II | Khan Academy,2015-01-27,299208,371,13,Jan
4180,Equation for parabola from focus and directrix | Conic sections | Algebra II | Khan Academy,2015-01-26,671989,1687,70,Jan
4181,Focus and directrix introduction | Conic sections | Algebra II | Khan Academy,2015-01-26,414853,1428,43,Jan
4182,Introduction to line plots | Measurement and data | Early Math | Khan Academy,2015-01-05,675631,1594,171,Jan
4183,Introduction to Mortgage Loans | Housing | Finance & Capital Markets | Khan Academy,2015-01-05,376979,3242,165,Jan
4184,Addition with regrouping | Addition and subtraction within 100 | Early Math | Khan Academy,2014-12-30,444238,1274,150,Dec
4185,Visual understanding of regrouping,2014-12-30,10158,53,5,Dec
4186,Subtracting two digit numbers without regrouping | Early Math | Khan Academy,2014-12-26,399419,622,61,Dec
4187,Subtracting with regrouping (borrowing) | Early Math | Khan Academy,2014-12-26,633872,1917,190,Dec
4188,Ionization energy trends | Periodic table | Chemistry | Khan Academy,2014-12-22,550890,3580,118,Dec
4189,Using Khan Academy,2014-12-18,126628,1338,91,Dec
4190,Coulomb's Law | Electrostatics | Electrical engineering | Khan Academy,2014-12-11,1278251,9073,429,Dec
4191,Triboelectric effect and charge | Physics | Khan Academy,2014-12-11,386762,926,56,Dec
4192,Alleles and genes,2014-12-10,514418,3350,149,Dec
4193,DNA replication and RNA transcription and translation | Khan Academy,2014-12-10,2851762,18786,493,Dec
4194,DNA | Biomolecules | MCAT | Khan Academy,2014-12-10,544045,1726,73,Dec
4195,Constant angular momentum when no net torque | Physics | Khan Academy,2014-12-06,112753,163,9,Dec
4196,"Angular momentum | Moments, torque, and angular momentum | Physics | Khan Academy",2014-12-05,542734,2359,128,Dec
4197,Average height of a building's floor | Multiplication and division | 3rd grade | Khan Academy,2014-12-03,125448,122,0,Dec
4198,Blueberries for friends | Multiplication and division | 3rd grade | Khan Academy,2014-12-03,144700,165,0,Dec
4199,Liters of soda for the party | Multiplication and division | 3rd grade | Khan Academy,2014-12-03,91121,59,0,Dec
4200,Unknowns with multiplication and division | Multiplication and division | 3rd grade | Khan Academy,2014-12-03,224711,347,0,Dec
4201,How many cars can fit in the parking lot | Multiplication and division | 3rd grade | Khan Academy,2014-12-03,143075,84,0,Dec
4202,Negative numbers and number line examples | Pre-Algebra | Khan Academy,2014-12-03,422678,115,16,Dec
4203,Sal Khan on the importance of support from our users,2014-12-01,23785,1579,132,Dec
4204,Free throw binomial probability distribution | Probability and Statistics | Khan Academy,2014-11-27,137632,246,12,Nov
4205,Probability of making 2 shots in 6 attempts | Probability and Statistics | Khan Academy,2014-11-27,274818,642,37,Nov
4206,Generalizing k scores in n attempts | Probability and Statistics | Khan Academy,2014-11-27,123204,174,10,Nov
4207,Graphing basketball binomial distribution | Probability and Statistics | Khan Academy,2014-11-27,84052,97,3,Nov
4208,Binomial distribution | Probability and Statistics | Khan Academy,2014-11-26,2177149,12461,304,Nov
4209,Visualizing a binomial distribution | Probability and Statistics | Khan Academy,2014-11-26,287288,1492,27,Nov
4210,Polynomial remainder theorem to test factor | Algebra II | Khan Academy,2014-11-25,159099,221,20,Nov
4211,Constructing a polynomial that has a certain factor | Algebra II | Khan Academy,2014-11-25,95201,65,2,Nov
4212,Polynomial remainder theorem example | Polynomial and rational functions | Algebra II | Khan Academy,2014-11-25,166948,198,15,Nov
4213,Polynomial remainder theorem proof | Polynomial and rational functions | Algebra II | Khan Academy,2014-11-25,107813,726,62,Nov
4214,Polynomial remainder theorem | Polynomial and rational functions | Algebra II | Khan Academy,2014-11-25,591956,3398,144,Nov
4215,"Empirical, molecular, and structural formulas | AP Chemistry | Khan Academy",2014-11-24,537696,1061,36,Nov
4216,Zero factorial or 0! | Probability and combinatorics | Probability and Statistics | Khan Academy,2014-11-21,287805,710,47,Nov
4217,Possible three letter words | Probability and Statistics | Khan Academy,2014-11-21,337628,771,51,Nov
4218,Handshaking combinations | Probability and combinatorics | Probability and Statistics | Khan Academy,2014-11-21,228597,591,33,Nov
4219,Combination formula | Probability and combinatorics | Probability and Statistics | Khan Academy,2014-11-21,1270314,10674,375,Nov
4220,Factorial and counting seat arrangements | Probability and Statistics | Khan Academy,2014-11-20,451206,1812,56,Nov
4221,Permutation formula | Probability and combinatorics | Probability and Statistics | Khan Academy,2014-11-20,1379943,11341,343,Nov
4222,Introduction to combinations | Probability and Statistics | Khan Academy,2014-11-20,768255,3904,144,Nov
4223,Counting pot and flower scenarios | Statistics and probability | 7th grade | Khan Academy,2014-11-20,149196,72,14,Nov
4224,Counting handshakes at a dinner party,2014-11-20,6927,63,4,Nov
4225,Balancing chemical equation with substitution | Chemistry | Khan Academy,2014-11-19,277515,324,18,Nov
4226,Visually understanding balancing chemical equations | High school chemistry | Khan Academy,2014-11-19,384177,242,27,Nov
4227,Balancing chemical equations | Chemical reactions | High school chemistry | Khan Academy,2014-11-19,1739409,5826,277,Nov
4228,Balancing another combustion reaction | Chemical reactions | High school chemistry | Khan Academy,2014-11-19,351223,468,30,Nov
4229,Balancing more complex chemical equations | Chemical reactions | High school chemistry |Khan Academy,2014-11-19,777761,1693,114,Nov
4230,Factoring algebraic expressions using the distributive property | Algebra I | Khan Academy,2014-11-19,571506,2224,173,Nov
4231,Algebraic expressions with fraction division | Introduction to algebra | Algebra I | Khan Academy,2014-11-08,305506,371,62,Nov
4232,Algebraic expression adding fractions | Introduction to algebra | Algebra I | Khan Academy,2014-11-08,300453,527,22,Nov
4233,Walter Isaacson - President and CEO of the Aspen Institute,2014-11-04,18048,135,14,Nov
4234,Types of escrow in real estate | Housing | Finance & Capital Markets | Khan Academy,2014-11-03,66955,560,16,Nov
4235,Escrow | Housing | Finance & Capital Markets | Khan Academy,2014-11-03,87877,649,27,Nov
4236,Making an offer on a home | Housing | Finance & Capital Markets | Khan Academy,2014-11-03,58051,303,10,Nov
4237,Titles insurance | Housing | Finance & Capital Markets | Khan Academy,2014-10-30,65054,399,14,Oct
4238,Titles and deeds in real estate | Housing | Finance & Capital Markets | Khan Academy,2014-10-30,133241,942,39,Oct
4239,Balloon payment mortgage | Housing | Finance & Capital Markets | Khan Academy,2014-10-29,88125,699,36,Oct
4240,Hybrid ARM | Housing | Finance & Capital Markets | Khan Academy,2014-10-28,31868,86,4,Oct
4241,Adjustable rate mortgages ARMs | Housing | Finance & Capital Markets | Khan Academy,2014-10-28,104858,642,32,Oct
4242,Changing scale of the y axis,2014-10-28,5392,54,6,Oct
4243,Reverse chain rule example,2014-10-24,169161,293,24,Oct
4244,Reverse chain rule introduction,2014-10-24,285217,1280,25,Oct
4245,Integral of tan x,2014-10-24,179428,664,32,Oct
4246,Trig identities for trig integral,2014-10-24,151652,357,27,Oct
4247,Integral of odd powered trig function with u substitution,2014-10-24,99401,130,5,Oct
4248,Using trig identity to use u substitution,2014-10-23,137492,153,7,Oct
4249,Worked example: Definite integral by thinking about the function's graph | Khan Academy,2014-10-23,192088,256,5,Oct
4250,Statistical significance on bus speeds | Probability and Statistics | Khan Academy,2014-10-22,40236,52,12,Oct
4251,Comparing models to fit data | Regression | Probability and Statistics | Khan Academy,2014-10-22,114022,87,4,Oct
4252,Rotation by radians and quadrants | Trigonometry | Khan Academy,2014-10-22,312490,337,10,Oct
4253,Modeling with combined functions | Functions and their graphs | Algebra II | Khan Academy,2014-10-22,163417,48,4,Oct
4254,Arc length as fraction of circumference | Trigonometry | Khan Academy,2014-10-22,179944,129,6,Oct
4255,"Rotating 2D shapes in 3D | Perimeter, area, and volume | Geometry | Khan Academy",2014-10-22,186890,325,20,Oct
4256,Visually understanding long division,2014-10-21,35294,496,41,Oct
4257,L'Hopital's Rule to solve for variable | Differential Calculus | Khan Academy,2014-10-17,73788,170,13,Oct
4258,Tricky L'Hopital's Rule problem | Derivative applications | Differential Calculus | Khan Academy,2014-10-17,302552,2120,134,Oct
4259,How to test solutions to equations using substitution | 6th grade | Khan Academy,2014-10-15,353158,407,28,Oct
4260,How to test solutions to inequalities | 6th grade | Khan Academy,2014-10-15,357726,410,36,Oct
4261,Two-way frequency tables and Venn diagrams | Data and modeling | 8th grade | Khan Academy,2014-10-15,314686,645,23,Oct
4262,Two-way relative frequency tables | Data and modeling | 8th grade | Khan Academy,2014-10-15,297208,190,19,Oct
4263,Interpreting two-way tables | Data and modeling | 8th grade | Khan Academy,2014-10-15,141495,82,5,Oct
4264,Pythagorean theorem in 3D | Geometry | 8th grade | Khan Academy,2014-10-15,143786,346,35,Oct
4265,Worked example: cosine function from power series | Series | AP Calculus BC | Khan Academy,2014-10-14,48418,44,2,Oct
4266,Worked example: Taylor polynomial of derivative function | AP Calculus BC | Khan Academy,2014-10-13,64965,45,4,Oct
4267,Worked example: power series from cos(x) | Series | AP Calculus BC | Khan Academy,2014-10-10,116940,174,11,Oct
4268,Power series of arctan(2x) | Series | AP Calculus BC | Khan Academy,2014-10-10,105361,160,10,Oct
4269,Euler's method program code | First order differential equations | Khan Academy,2014-09-25,85777,199,8,Sep
4270,Worked example: Euler's method | Differential equations| AP Calculus BC | Khan Academy,2014-09-25,213645,359,15,Sep
4271,Euler's method | Differential equations| AP Calculus BC | Khan Academy,2014-09-25,1045899,4508,153,Sep
4272,Modeling population with simple differential equation | Khan Academy,2014-09-24,361176,1380,34,Sep
4273,Applying Newton's Law of Cooling to warm oatmeal | First order differential equations | Khan Academy,2014-09-24,179071,674,49,Sep
4274,Newton's Law of Cooling | First order differential equations | Khan Academy,2014-09-24,502528,2410,94,Sep
4275,Particular solution given initial conditions for population | Khan Academy,2014-09-24,114643,139,7,Sep
4276,Separable differential equations introduction | First order differential equations | Khan Academy,2014-09-23,857684,3897,99,Sep
4277,Particular solution to differential equation example | Khan Academy,2014-09-23,510796,1136,34,Sep
4278,Differential equation from slope field | First order differential equations | Khan Academy,2014-09-22,271105,579,17,Sep
4279,Slope field to visualize solutions | First order differential equations | Khan Academy,2014-09-22,234689,493,14,Sep
4280,Creating a slope field | First order differential equations | Khan Academy,2014-09-18,520990,1508,32,Sep
4281,Differential equation introduction | First order differential equations | Khan Academy,2014-09-17,2797121,18766,446,Sep
4282,Finding particular linear solution to differential equation | Khan Academy,2014-09-17,845962,2344,75,Sep
4283,Worked example: alternating series remainder | Series | AP Calculus BC | Khan Academy,2014-09-11,78482,150,3,Sep
4284,Alternating series remainder | Series | AP Calculus BC | Khan Academy,2014-09-10,165138,587,19,Sep
4285,Ratio test | Series | AP Calculus BC | Khan Academy,2014-09-04,480080,1292,55,Sep
4286,Worked example: Series estimation with integrals | Series | AP Calculus BC | Khan Academy,2014-09-04,54430,75,8,Sep
4287,Radius of convergence using Ratio Test,2014-09-04,471157,2525,78,Sep
4288,Series estimation with integrals | Series | AP Calculus BC | Khan Academy,2014-09-04,77860,126,5,Sep
4289,Limit comparison test | Series | AP Calculus BC | Khan Academy,2014-09-02,426193,1135,46,Sep
4290,ALS - Amyotrophic lateral sclerosis | Miscellaneous | Heatlh & Medicine | Khan Academy,2014-08-26,264659,3041,270,Aug
4291,nth term divergence test | Series | AP Calculus BC | Khan Academy,2014-08-22,474771,1532,55,Aug
4292,Worked example: Integral test | Series | AP Calculus BC | Khan Academy,2014-08-21,322086,647,18,Aug
4293,Integral test | Series | AP Calculus BC | Khan Academy,2014-08-21,257448,885,25,Aug
4294,Worked example: direct comparison test | Series | AP Calculus BC | Khan Academy,2014-08-21,257647,384,12,Aug
4295,Direct comparison test | Series | AP Calculus BC | Khan Academy,2014-08-21,367189,904,17,Aug
4296,Proof: harmonic series diverges | Series | AP Calculus BC | Khan Academy,2014-08-21,202709,1615,106,Aug
4297,Justification for polar arc length formula,2014-08-19,50195,200,15,Aug
4298,Arc length of petal of polar graph,2014-08-19,38246,83,3,Aug
4299,John Legend: Success through effort,2014-08-19,697917,4007,268,Aug
4300,Growing your mind,2014-08-19,1240618,4075,261,Aug
4301,The Growth Mindset,2014-08-19,659543,5295,139,Aug
4302,You Can Learn Anything,2014-08-19,8008579,113412,2396,Aug
4303,Worked example: Area between two polar graphs | AP Calculus BC | Khan Academy,2014-08-18,123795,246,17,Aug
4304,Worked example: Area enclosed by cardioid | AP Calculus BC | Khan Academy,2014-08-18,113070,230,14,Aug
4305,Evaluating definite integral with calculator | AP Calculus BC | Khan Academy,2014-08-18,32143,20,1,Aug
4306,Area bounded by polar curves | Applications of definite integrals | AP Calculus BC | Khan Academy,2014-08-18,145174,338,13,Aug
4307,Partial fraction expansion to evaluate integral | AP Calculus BC | Khan Academy,2014-08-18,533806,1553,72,Aug
4308,Dividing expressions to evaluate integral | AP Calculus BC | Khan Academy,2014-08-18,138907,113,5,Aug
4309,Sean O'Sullivan - Founder of SOSventure | Entrepreneurship | Khan Academy,2014-08-15,60814,278,21,Aug
4310,How to grow your brain,2014-08-14,1106249,29026,725,Aug
4311,Volume with cross sections: semicircle | AP Calculus AB | Khan Academy,2014-08-13,323745,459,28,Aug
4312,Volume with cross sections: triangle | AP Calculus AB | Khan Academy,2014-08-12,252240,515,25,Aug
4313,Another arc length integration example,2014-08-12,126841,257,24,Aug
4314,Arc length intro | Applications of definite integrals | AP Calculus BC | Khan Academy,2014-08-11,200930,831,34,Aug
4315,Worked example: arc length | Applications of definite integrals | AP Calculus BC | Khan Academy,2014-08-11,384582,1060,48,Aug
4316,Examples leveraging integration properties,2014-08-11,43957,46,3,Aug
4317,Breaking up integral interval | Accumulation and Riemann sums | AP Calculus AB | Khan Academy,2014-08-11,82790,102,1,Aug
4318,Definite integral of shifted function,2014-08-08,61413,82,5,Aug
4319,Integrating sums of functions | Accumulation and Riemann sums | AP Calculus AB | Khan Academy,2014-08-08,96010,104,3,Aug
4320,Switching bounds of definite integral | AP Calculus AB | Khan Academy,2014-08-08,96074,215,17,Aug
4321,Integrating scaled version of function | AP Calculus AB | Khan Academy,2014-08-08,122606,95,4,Aug
4322,Definite integral over a single point | AP Calculus AB | Khan Academy,2014-08-08,79341,103,5,Aug
