,Title,Published_date,Views,Likes,Comments,Month
6296,Hedge funds intro | Finance & Capital Markets | Khan Academy,2011-04-19,861173,5911,201,Apr
6297,Exchange traded funds (ETFs) | Finance & Capital Markets | Khan Academy,2011-04-18,255423,820,17,Apr
6298,Closed-end mutual funds  | Finance & Capital Markets | Khan Academy,2011-04-18,126633,365,14,Apr
6299,Open-end mutual fund redemptions (part 2)  | Finance & Capital Markets | Khan Academy,2011-04-18,119291,244,3,Apr
6300,Open-ended mutual fund (part 1)  | Finance & Capital Markets | Khan Academy,2011-04-18,187886,353,9,Apr
6301,Is limited liability or double taxation fair? | Taxes | Finance & Capital Markets | Khan Academy,2011-04-18,62775,277,17,Apr
6302,Corporations and limited liability | Taxes | Finance & Capital Markets | Khan Academy,2011-04-18,156382,1209,85,Apr
6303,Term life insurance and death probability | Finance & Capital Markets | Khan Academy,2011-04-18,276876,627,33,Apr
6304,Back-of-envelope office space conundrum | Finance & Capital Markets | Khan Academy,2011-04-18,28006,84,6,Apr
6305,To invest or pay-off loans,2011-04-15,8288,79,22,Apr
6306,Recognizing odd and even functions | Functions and their graphs | Algebra II | Khan Academy,2011-04-14,868835,3497,163,Apr
6307,Connection between even and odd numbers and functions | Algebra II | Khan Academy,2011-04-14,165931,188,26,Apr
6308,Recognizing direct and inverse variation | Rational expressions | Algebra II | Khan Academy,2011-04-14,265689,433,19,Apr
6309,Direct and inverse variation | Rational expressions | Algebra II | Khan Academy,2011-04-14,1265552,7356,418,Apr
6310,Finding probability example 2 | Probability and Statistics | Khan Academy,2011-04-13,1140463,2998,136,Apr
6311,Acute right and obtuse angles | Angles and intersecting lines | Geometry | Khan Academy,2011-04-12,714223,1030,109,Apr
6312,"Cylinder volume and surface area | Perimeter, area, and volume | Geometry | Khan Academy",2011-04-12,1381222,3611,451,Apr
6313,Find the volume of a triangular prism and cube | Geometry | Khan Academy,2011-04-12,833719,955,96,Apr
6314,Alternative minimum tax | Taxes | Finance & Capital Markets | Khan Academy,2011-04-11,92366,184,20,Apr
6315,Tax deductions introduction | Taxes | Finance & Capital Markets | Khan Academy,2011-04-11,247187,1172,43,Apr
6316,Fair value accounting | Finance & Capital Markets | Khan Academy,2011-04-11,226311,860,37,Apr
6317,"LIBOR | Money, banking and central banks  | Finance & Capital Markets | Khan Academy",2011-04-11,192052,1128,48,Apr
6318,Strokes | Miscellaneous | Heatlh & Medicine | Khan Academy,2011-04-07,229708,931,53,Apr
6319,Common divisibility examples | Factors and multiples | Pre-Algebra | Khan Academy,2011-04-07,431804,385,36,Apr
6320,"Stenosis, ischemia and heart failure | Miscellaneous | Heatlh & Medicine | Khan Academy",2011-04-06,153340,773,58,Apr
6321,Thromboemboli and thromboembolisms | Miscellaneous | Heatlh & Medicine | Khan Academy,2011-04-06,132776,739,20,Apr
6322,Heart Disease and Heart Attacks,2011-04-05,366234,1683,165,Apr
6323,A1C Levels,2011-04-05,138871,843,44,Apr
6324,Glucose Concentration Conversion,2011-04-04,61184,209,14,Apr
6325,Blood Sugar Levels,2011-04-04,288279,834,73,Apr
6326,Glucose Insulin and Diabetes,2011-04-04,708880,3564,169,Apr
6327,Market value of assets | Stocks and bonds | Finance & Capital Markets | Khan Academy,2011-04-01,136273,181,11,Apr
6328,Market capitalization | Stocks and bonds | Finance & Capital Markets | Khan Academy,2011-04-01,137236,213,11,Apr
6329,Basic capital structure differences | Stocks and bonds | Finance & Capital Markets | Khan Academy,2011-04-01,159389,226,8,Apr
6330,Gross and operating profit | Stocks and bonds | Finance & Capital Markets | Khan Academy,2011-04-01,178814,430,21,Apr
6331,Amortization and depreciation | Finance & Capital Markets | Khan Academy,2011-04-01,316331,2160,64,Apr
6332,Depreciation in cash flow | Finance & Capital Markets | Khan Academy,2011-03-31,199986,400,15,Mar
6333,Depreciating the truck | Finance & Capital Markets | Khan Academy,2011-03-31,122450,153,7,Mar
6334,Expensing a truck leads to inconsistent performance | Finance & Capital Markets | Khan Academy,2011-03-31,129952,142,6,Mar
6335,Doing the example with accounts payable growing | Finance & Capital Markets | Khan Academy,2011-03-30,179875,106,7,Mar
6336,Basic cash flow statement | Finance & Capital Markets | Khan Academy,2011-03-30,549670,596,28,Mar
6337,Balance sheet and income statement relationship | Finance & Capital Markets | Khan Academy,2011-03-30,780583,1057,32,Mar
6338,Comparing accrual and cash accounting | Finance & Capital Markets | Khan Academy,2011-03-30,321550,473,27,Mar
6339,Accrual basis of accounting | Finance & Capital Markets | Khan Academy,2011-03-30,547742,1022,34,Mar
6340,Cash accounting | Accounting and financial statements | Finance & Capital Markets | Khan Academy,2011-03-30,491057,449,8,Mar
6341,Upper bound on forward settlement price | Finance & Capital Markets | Khan Academy,2011-03-30,51583,91,6,Mar
6342,Lower bound on forward settlement price | Finance & Capital Markets | Khan Academy,2011-03-30,39159,81,10,Mar
6343,Futures curves II | Finance & Capital Markets | Khan Academy,2011-03-29,64857,174,10,Mar
6344,Contango and backwardation review | Finance & Capital Markets | Khan Academy,2011-03-28,102660,467,11,Mar
6345,Backwardation | Finance & Capital Markets | Khan Academy,2011-03-28,79092,337,10,Mar
6346,Contango | Finance & Capital Markets | Khan Academy,2011-03-28,102771,404,27,Mar
6347,Futures and forward curves | Finance & Capital Markets | Khan Academy,2011-03-23,118564,269,6,Mar
6348,Verifying hedge with futures margin mechanics | Finance & Capital Markets | Khan Academy,2011-03-23,115763,318,32,Mar
6349,Sal on Dylan Ratigan show,2011-03-23,24802,387,86,Mar
6350,Futures margin mechanics | Finance & Capital Markets | Khan Academy,2011-03-22,206976,964,43,Mar
6351,Arbitraging futures contracts II | Finance & Capital Markets | Khan Academy,2011-03-21,93979,401,29,Mar
6352,Arbitraging futures contract | Finance & Capital Markets | Khan Academy,2011-03-21,243256,1238,30,Mar
6353,Arbitrage basics | Finance & Capital Markets | Khan Academy,2011-03-21,551044,4593,146,Mar
6354,Motivation for the futures exchange | Finance & Capital Markets | Khan Academy,2011-03-21,136186,297,9,Mar
6355,Futures introduction | Finance & Capital Markets | Khan Academy,2011-03-18,374671,1636,64,Mar
6356,Forward contract introduction | Finance & Capital Markets | Khan Academy,2011-03-18,425529,1989,79,Mar
6357,Option expiration and price | Finance & Capital Markets | Khan Academy,2011-03-17,88934,174,11,Mar
6358,Ape Clarification,2011-03-17,474481,1489,159,Mar
6359,Actual option quotes | Finance & Capital Markets | Khan Academy,2011-03-17,79069,166,5,Mar
6360,Put-call parity clarification | Finance & Capital Markets | Khan Academy,2011-03-16,94950,183,5,Mar
6361,"China buys US bonds | Money, banking and central banks  | Finance & Capital Markets | Khan Academy",2011-03-16,73886,309,46,Mar
6362,Review of China US currency situation,2011-03-16,53777,163,14,Mar
6363,Data on Chinese M1 Increase in 2010,2011-03-16,32810,53,10,Mar
6364,Data on Chinese Foreign Assets Increase in 2010,2011-03-16,21409,41,9,Mar
6365,Data on Chinese US Balance of Payments,2011-03-16,29198,84,12,Mar
6366,China keeps peg but diversifies holdings,2011-03-16,43827,188,23,Mar
6367,"Chinese inflation | Money, banking and central banks  | Finance & Capital Markets | Khan Academy",2011-03-16,34312,82,6,Mar
6368,Floating Exchange Effect on China,2011-03-16,30331,80,3,Mar
6369,Floating Exchange Effect on US,2011-03-16,27477,66,10,Mar
6370,Floating Exchange Resolving Trade Imbalance,2011-03-16,41169,59,4,Mar
6371,China Pegs to Dollar to Keep Trade Imbalance,2011-03-16,44963,89,9,Mar
6372,American call options | Finance & Capital Markets | Khan Academy,2011-03-16,471225,1234,53,Mar
6373,Basic shorting | Stocks and bonds | Finance & Capital Markets | Khan Academy,2011-03-16,398228,435,28,Mar
6374,American put options | Finance & Capital Markets | Khan Academy,2011-03-16,284832,645,42,Mar
6375,Call option as leverage | Finance & Capital Markets | Khan Academy,2011-03-16,190107,310,25,Mar
6376,Call payoff diagram | Finance & Capital Markets | Khan Academy,2011-03-16,261912,781,16,Mar
6377,Put vs. short and leverage | Finance & Capital Markets | Khan Academy,2011-03-16,172956,405,21,Mar
6378,Put-call parity arbitrage I | Finance & Capital Markets | Khan Academy,2011-03-16,273991,988,50,Mar
6379,Put-call parity arbitrage II | Finance & Capital Markets | Khan Academy,2011-03-16,148804,535,50,Mar
6380,Put payoff diagram | Finance & Capital Markets | Khan Academy,2011-03-16,203055,406,12,Mar
6381,Long straddle | Finance & Capital Markets | Khan Academy,2011-03-16,161523,455,19,Mar
6382,Put as insurance | Finance & Capital Markets | Khan Academy,2011-03-16,134190,270,12,Mar
6383,Call writer payoff diagram | Finance & Capital Markets | Khan Academy,2011-03-16,80927,178,5,Mar
6384,Put-call parity | Finance & Capital Markets | Khan Academy,2011-03-16,375521,1095,33,Mar
6385,Put writer payoff diagrams | Finance & Capital Markets | Khan Academy,2011-03-16,103170,212,4,Mar
6386,Khan Academy on Nightly News,2011-03-11,51740,625,84,Mar
6387,The substitution method | Systems of equations | 8th grade | Khan Academy,2011-03-10,851093,3183,294,Mar
6388,Systems of equations word problems example 3 | Algebra I | Khan Academy,2011-03-10,130098,250,18,Mar
6389,Substitution method 2 | Systems of equations | 8th grade | Khan Academy,2011-03-10,217341,168,25,Mar
6390,Addition elimination method 1 | Systems of equations | 8th grade | Khan Academy,2011-03-10,308562,493,46,Mar
6391,Systems of three variables | Systems of equations and inequalities | Algebra II | Khan Academy,2011-03-10,486453,1000,61,Mar
6392,Addition elimination method 3 | Systems of equations | 8th grade | Khan Academy,2011-03-10,80248,72,6,Mar
6393,Addition elimination method 2 | Systems of equations | 8th grade | Khan Academy,2011-03-10,144375,144,10,Mar
6394,Systems of three variables 2 | Systems of equations and inequalities | Algebra II | Khan Academy,2011-03-10,216025,295,18,Mar
6395,Addition elimination method 4 | Systems of equations | 8th grade | Khan Academy,2011-03-10,47354,40,2,Mar
6396,Three equation application problem | Algebra II | Khan Academy,2011-03-10,84237,77,4,Mar
6397,Solutions to three variable system | Algebra II | Khan Academy,2011-03-10,57988,50,1,Mar
6398,Salman Khan TED Talk 2011 (from ted.com),2011-03-10,5050350,33634,2664,Mar
6399,Graphing systems of equations | Systems of equations | 8th grade | Khan Academy,2011-03-08,445595,1111,141,Mar
6400,Consistent and inconsistent systems | Algebra II | Khan Academy,2011-03-08,345490,1199,57,Mar
6401,Independent and dependent systems | Algebra II | Khan Academy,2011-03-08,199309,409,14,Mar
6402,Checking solutions to systems of equations example | Algebra I | Khan Academy,2011-03-08,310830,364,15,Mar
6403,System of Inequalities Application,2011-03-08,50865,166,8,Mar
6404,Graphical systems application problem | Systems of equations | 8th grade | Khan Academy,2011-03-08,75689,65,3,Mar
6405,Introduction to graphing systems of linear inequalities | Algebra II | Khan Academy,2011-03-08,450360,1003,61,Mar
6406,Checking solutions of systems of inequalities example | Algebra I | Khan Academy,2011-03-08,124997,61,5,Mar
6407,Linear function example: spending money | Linear equations and functions | 8th grade | Khan Academy,2011-03-08,107239,136,6,Mar
6408,Graphing solutions to two-variable linear equations example 1 | Algebra I | Khan Academy,2011-03-08,595788,606,36,Mar
6409,Coordinate plane: plot ordered pairs | Negative numbers | 6th grade | Khan Academy,2011-03-08,603276,476,47,Mar
6410,Coordinate plane: quadrants | Negative numbers | 6th grade | Khan Academy,2011-03-08,614469,652,49,Mar
6411,Graphing using x- and y-intercepts | Graphing lines and slope | Algebra Basics | Khan Academy,2011-03-08,539369,1440,90,Mar
6412,Slope from two ordered pairs example 1 | Algebra I | Khan Academy,2011-03-08,1004574,1245,88,Mar
6413,Ordered pair solutions to equations | Graphing lines and slope | Algebra Basics | Khan Academy,2011-03-08,316388,127,8,Mar
6414,Slope from two ordered pairs example 2 | Algebra I | Khan Academy,2011-03-08,325158,175,17,Mar
6415,Slope of a line: negative slope | Graphing lines and slope | Algebra Basics | Khan Academy,2011-03-08,234185,112,5,Mar
6416,Slope-intercept equation from slope and point | Algebra I | Khan Academy,2011-03-08,479064,259,18,Mar
6417,Slope-intercept equation from two solutions example | Algebra I | Khan Academy,2011-03-08,758876,580,46,Mar
6418,Graphing inequalities 2 | Algebra Basics | Khan Academy,2011-03-08,162415,131,5,Mar
6419,Finding a linear equation given a point and slope | Algebra Basics | Khan Academy,2011-03-08,345557,614,30,Mar
6420,Checking solutions of two-variable linear inequalities example | Algebra I | Khan Academy,2011-03-08,237622,159,14,Mar
6421,Parallel Line Equation,2011-03-08,524026,3088,124,Mar
6422,Slope of Perpendicular Line,2011-03-08,90292,626,29,Mar
6423,Negative numbers introduction | Negative numbers and absolute value | Pre-Algebra | Khan Academy,2011-02-15,2129435,3192,254,Feb
6424,Basic trigonometry II | Basic trigonometry | Trigonometry | Khan Academy,2011-02-15,1837291,5114,435,Feb
6425,Basic trigonometry | Basic trigonometry | Trigonometry | Khan Academy,2011-02-15,3964758,18331,1047,Feb
6426,Khan Academy Exercise Software,2011-02-09,359805,1171,183,Feb
6427,Pangaea | Earth geological and climatic history | Cosmology & Astronomy | Khan Academy,2011-02-08,235943,557,65,Feb
6428,Finding dimensions of triangle from area | Quadratic equations | Algebra I | Khan Academy,2011-02-08,208196,200,22,Feb
6429,Factoring the Difference of Cubes,2011-02-08,63064,195,19,Feb
6430,Solving quadratics by factoring,2011-02-08,18612,41,7,Feb
6431,Factoring trinomials with a non-1 leading coefficient by grouping,2011-02-08,399265,1264,137,Feb
6432,Solving factored equations,2011-02-08,15284,42,5,Feb
6433,Factoring sum of cubes | Polynomial and rational functions | Algebra II | Khan Academy,2011-02-08,455719,907,63,Feb
6434,Example 4: Factoring quadratics as a perfect square of a difference: (a-b)^2 | Khan Academy,2011-02-08,490402,507,58,Feb
6435,Example 1: Factoring trinomials with a common factor | Algebra II | Khan Academy,2011-02-08,1000041,1969,130,Feb
6436,Introduction to grouping | Algebra I | Khan Academy,2011-02-08,354762,261,17,Feb
6437,Example 1: Factoring a difference of squares with two variables | Algebra II | Khan Academy,2011-02-08,619542,403,26,Feb
6438,Factor expressions by grouping,2011-02-08,101283,617,19,Feb
6439,Example 3: Factor a quartic binomial with two variables by taking a common factor | Khan Academy,2011-02-08,430986,536,70,Feb
6440,Finding the greatest common factor of two monomials | Algebra I | Khan Academy,2011-02-08,414434,1223,67,Feb
6441,How we know about the earth's core | Cosmology & Astronomy | Khan Academy,2011-02-04,168690,826,140,Feb
6442,The mohorovicic seismic discontinuity | Cosmology & Astronomy | Khan Academy,2011-02-04,99559,702,43,Feb
6443,Refraction of seismic waves | Cosmology & Astronomy | Khan Academy,2011-02-04,77624,376,23,Feb
6444,Why S-waves only travel in solids | Cosmology & Astronomy | Khan Academy,2011-02-04,77901,394,18,Feb
6445,Seismic waves | Earth geological and climatic history | Cosmology & Astronomy | Khan Academy,2011-02-04,241067,1100,58,Feb
6446,Compositional and mechanical layers of the earth | Cosmology & Astronomy | Khan Academy,2011-02-04,233893,1047,88,Feb
6447,Hawaiian islands formation | Cosmology & Astronomy | Khan Academy,2011-02-03,238194,756,79,Feb
6448,Plates moving due to convection in mantle | Cosmology & Astronomy | Khan Academy,2011-02-03,243614,960,51,Feb
6449,Plate Tectonics-- Geological features of Convergent Plate Boundaries,2011-02-03,174164,512,25,Feb
6450,Plate tectonics: Difference between crust and lithosphere | Cosmology & Astronomy | Khan Academy,2011-02-03,204081,491,37,Feb
6451,Structure of the Earth,2011-02-02,346314,1433,75,Feb
6452,Plate tectonics: Geological features of divergent plate boundaries | Khan Academy,2011-02-01,182807,566,48,Feb
6453,Plate tectonics: Evidence of plate movement | Cosmology & Astronomy | Khan Academy,2011-02-01,302775,849,60,Feb
6454,Salman Khan on KQED MindShift,2011-01-28,23151,397,74,Jan
6455,Exponent properties 3 | Exponent expressions and equations | Algebra I | Khan Academy,2011-01-27,214743,159,5,Jan
6456,Exponent properties 4 | Exponent expressions and equations | Algebra I | Khan Academy,2011-01-27,213441,165,7,Jan
6457,Exponent properties 6 | Exponent expressions and equations | Algebra I | Khan Academy,2011-01-27,81187,100,4,Jan
6458,Exponent properties 5 | Exponent expressions and equations | Algebra I | Khan Academy,2011-01-27,88899,120,3,Jan
6459,Exponent properties 7 | Exponent expressions and equations | Algebra I | Khan Academy,2011-01-27,85082,94,5,Jan
6460,Multiplying in scientific notation (example) | Pre-Algebra | Khan Academy,2011-01-27,373322,358,29,Jan
6461,Express a small number in scientific notation (example) | Pre-Algebra | Khan Academy,2011-01-27,470910,265,36,Jan
6462,Speed of light and distance from sun (scientific notation word problem) | Pre-Algebra | Khan Academy,2011-01-27,118715,143,7,Jan
6463,Example 1: Simplifying polynomials | Algebra I | Khan Academy,2011-01-27,658831,1971,83,Jan
6464,The parts of polynomial expressions | Polynomial and rational functions | Algebra II | Khan Academy,2011-01-27,626316,477,9,Jan
6465,Evaluating a polynomial at a given value |  Algebra I | Khan Academy,2011-01-27,324734,375,29,Jan
6466,Example 4: Adding and subtracting polynomials | Algebra Basics | Khan Academy,2011-01-27,185591,127,8,Jan
6467,Opposite of a Polynomial,2011-01-27,45640,118,1,Jan
6468,Example 3: Subtracting polynomials | Algebra I | Khan Academy,2011-01-27,474642,942,59,Jan
6469,Example 3: Multiplying a monomial by a polynomial | Algebra I | Khan Academy,2011-01-27,355751,718,48,Jan
6470,Example 1: Multiplying a binomial by a binomial | Algebra I | Khan Academy,2011-01-27,687987,1865,107,Jan
6471,Example 1: Multiplying two monomials with a single variable | Algebra I | Khan Academy,2011-01-27,237148,80,7,Jan
6472,Multiplying polynomials example | Polynomial and rational functions | Algebra II | Khan Academy,2011-01-27,248592,455,33,Jan
6473,Polynomial divided by monomial | Polynomial and rational functions | Algebra II | Khan Academy,2011-01-27,250046,247,15,Jan
6474,Simplifying rational expressions (old video) | Algebra II | High School Geometry | Khan Academy,2011-01-27,224860,149,4,Jan
6475,Example 1: Multiplying binomials to get a difference of squares | Algebra I | Khan Academy,2011-01-27,166639,116,6,Jan
6476,Example 2: Finding the square of a binomial with one variable | Algebra I | Khan Academy,2011-01-27,243382,237,19,Jan
6477,Dividing polynomials 1 | Polynomial and rational functions | Algebra II | Khan Academy,2011-01-27,768860,501,35,Jan
6478,Dividing polynomials with remainders | Polynomial and rational functions | Algebra II | Khan Academy,2011-01-27,363476,576,45,Jan
6479,Simplifying an expression with multiple variables,2011-01-27,33905,112,10,Jan
6480,Evaluating an expression with multiple variables,2011-01-27,28283,79,8,Jan
6481,Example 6: Subtracting polynomials with two variables | Algebra I | Khan Academy,2011-01-27,190905,97,12,Jan
6482,Dividing multivariable polynomial with monomial | Algebra II | Khan Academy,2011-01-27,92751,139,4,Jan
6483,Example 2: Multiplying a binomial by a polynomial | Algebra I | Khan Academy,2011-01-27,313209,182,22,Jan
6484,Evaluating exponential expressions 3 | Exponent expressions and equations | Algebra I | Khan Academy,2011-01-27,86624,48,6,Jan
6485,Evaluating exponential expressions 2 | Introduction to algebra | Algebra I | Khan Academy,2011-01-27,292293,108,5,Jan
6486,Exponent properties 2 | Exponent expressions and equations | Algebra I | Khan Academy,2011-01-27,298860,238,12,Jan
6487,Evaluating an algebraic expression with exponents | 6th grade | Khan Academy,2011-01-27,550738,289,27,Jan
6488,Exponent properties 1 | Exponent expressions and equations | Algebra I | Khan Academy,2011-01-27,365019,448,18,Jan
6489,China Pegs to Dollar to Keep Trade Imbalance,2011-01-26,3418,45,23,Jan
6490,Floating Exchange Resolving Trade Imbalance,2011-01-26,7058,71,9,Jan
6491,How to solve equations of the form x/a = b | Linear equations | Algebra I | Khan Academy,2011-01-25,674145,685,42,Jan
6492,Example of plotting a simple inequality on a number line | Pre-Algebra | Khan Academy,2011-01-25,689254,415,22,Jan
6493,Example of solving a one-step equation | Linear equations | Algebra I | Khan Academy,2011-01-25,815156,781,43,Jan
6494,Example 1: Variables on both sides | Linear equations | Algebra I | Khan Academy,2011-01-25,323868,295,23,Jan
6495,Ex 2: Distributive property to simplify | Linear equations | Algebra I | Khan Academy,2011-01-25,150502,147,4,Jan
6496,Multi-Step Inequalities (old),2011-01-25,5540,12,8,Jan
6497,Compound inequalities 2 | Linear inequalities | Algebra I | Khan Academy,2011-01-25,281240,192,12,Jan
6498,Equation special cases | Linear equations | Algebra I | Khan Academy,2011-01-25,322582,244,8,Jan
6499,Compound inequalities | Linear inequalities | Algebra I | Khan Academy,2011-01-25,439596,369,30,Jan
6500,Rearrange formulas to isolate specific variables | Linear equations | Algebra I | Khan Academy,2011-01-25,472131,1121,43,Jan
6501,Word problem: solving equations | Linear equations | Algebra I | Khan Academy,2011-01-25,419512,238,24,Jan
6502,How to evaluate an expression using substitution | Algebra I | Khan Academy,2011-01-25,642330,315,10,Jan
6503,Absolute value inequalities example 2 | Linear inequalities | Algebra I | Khan Academy,2011-01-25,213207,149,14,Jan
6504,One-step inequality involving addition | Linear inequalities | Algebra I | Khan Academy,2011-01-25,313869,308,38,Jan
6505,Multiplying and dividing with inequalities example | Linear inequalities | Algebra I | Khan Academy,2011-01-25,646414,313,18,Jan
6506,Multi-step inequalities 2 | Linear inequalities | Algebra I | Khan Academy,2011-01-25,288247,230,19,Jan
6507,Compound Inequalities 3,2011-01-25,2159,2,2,Jan
6508,Compound inequalities 4 | Linear inequalities | Algebra I | Khan Academy,2011-01-25,188049,117,8,Jan
6509,Absolute value equations example 1 | Linear equations | Algebra I | Khan Academy,2011-01-25,151268,142,5,Jan
6510,Absolute Value Equations 2,2011-01-25,11107,18,2,Jan
6511,First living things on land clarification | Cosmology & Astronomy | Khan Academy,2011-01-24,167399,875,47,Jan
6512,Biodiversity flourishes in Phanerozoic eon | Cosmology & Astronomy | Khan Academy,2011-01-21,75669,204,17,Jan
6513,Ozone layer and eukaryotes show up in the Proterozoic eon | Cosmology & Astronomy | Khan Academy,2011-01-20,98997,241,16,Jan
6514,Beginnings of life | Life on earth and in the universe | Cosmology & Astronomy | Khan Academy,2011-01-20,227213,434,54,Jan
6515,Earth formation | Life on earth and in the universe | Cosmology & Astronomy | Khan Academy,2011-01-20,384330,891,108,Jan
6516,Locate integers on a number line,2011-01-19,12929,31,3,Jan
6517,Adding numbers with different signs (example) | Pre-Algebra | Khan Academy,2011-01-19,1522225,927,94,Jan
6518,Decimals and fractions on a number line | Decimals | Pre-Algebra | Khan Academy,2011-01-19,731220,1173,41,Jan
6519,Absolute value of integers | Negative numbers and absolute value | Pre-Algebra | Khan Academy,2011-01-19,918829,782,45,Jan
6520,How to evaluate an expression with variables | Introduction to algebra | Algebra I | Khan Academy,2011-01-19,1458730,874,53,Jan
6521,Number Sets,2011-01-19,7155,24,4,Jan
6522,Opposite of a given number,2011-01-19,48717,99,5,Jan
6523,Adding fractions with different signs | Fractions | Pre-Algebra | Khan Academy,2011-01-19,684633,312,55,Jan
6524,Adding real numbers with different signs,2011-01-19,19832,25,3,Jan
6525,Adding integers with same sign,2011-01-19,20515,64,3,Jan
6526,Identity property of 0 | Arithmetic properties | Pre-Algebra | Khan Academy,2011-01-19,188105,161,15,Jan
6527,Application of addition of real numbers,2011-01-19,10616,17,1,Jan
6528,Subtracting real numbers,2011-01-19,2941,4,1,Jan
6529,Dividing real numbers with different signs,2011-01-19,12572,33,3,Jan
6530,Adding and subtracting real numbers application,2011-01-19,14179,26,2,Jan
6531,Adding and subtracting real numbers,2011-01-19,30433,103,8,Jan
6532,Multiplying numbers with different signs | Pre-Algebra | Khan Academy,2011-01-19,168468,119,13,Jan
6533,Multiplying real number application,2011-01-19,7388,19,1,Jan
6534,Identity property of 1 (second example) | Arithmetic properties | Pre-Algebra | Khan Academy,2011-01-19,90664,110,20,Jan
6535,Order of operations example: putting it all together | Pre-Algebra | Khan Academy,2011-01-19,598410,321,17,Jan
6536,Commutative property for addition | Arithmetic properties | Pre-Algebra | Khan Academy,2011-01-19,243878,346,28,Jan
6537,Associative property for multiplication,2011-01-19,20198,37,3,Jan
6538,Distributive property 3,2011-01-19,17829,26,2,Jan
6539,Order of Operations 2 (old),2011-01-19,22830,20,4,Jan
6540,Forbes  Names You Need To Know:  Khan Academy,2011-01-14,114803,1181,197,Jan
6541,2003 AIME II problem 15 (part 3) | Math for fun and glory | Khan Academy,2011-01-13,12266,48,15,Jan
6542,2003 AIME II problem 15 (part 2) | Math for fun and glory | Khan Academy,2011-01-13,8715,33,7,Jan
6543,2003 AIME II problem 15 (part 1) | Math for fun and glory | Khan Academy,2011-01-13,16575,50,3,Jan
