,Title,Published_date,Views,Likes,Comments,Month
4774,Ice Highway - Behind the Scenes | Life Below Zero,2015-05-08,20500,129,1,May
4775,Turning Cigarette Butts Into Park Benches | National Geographic,2015-05-07,398573,2262,103,May
4776,How the Huffington Post Elevated Blogging | StarTalk,2015-05-07,2405,37,3,May
4777,Oil-Eating Bacteria Could Be a Solution to Spill Cleanups | National Geographic,2015-05-07,146804,1561,96,May
4778,Survivors Share Personal Stories From Nepal Earthquake | National Geographic,2015-05-06,17204,170,7,May
4779,Sharing in the Information Age | StarTalk,2015-05-06,10263,161,8,May
4780,90 Days in 90 Seconds: Life on the Mekong River | National Geographic,2015-05-06,57830,501,13,May
4781,Oversharing on Social Media | StarTalk,2015-05-05,10742,180,6,May
4782,Stand Next to the Sun Without Burning to Death | National Geographic,2015-05-05,11467,233,32,May
4783,Catch of the Week - Deckhand in Charge | Wicked Tuna,2015-05-04,504779,2044,35,May
4784,Sex and Fruit: The Sweet Life of Bonobos | Nat Geo Live,2015-05-04,2798369,5863,326,May
4785,One Flower to Feed Them All | Nat Geo Live,2015-05-04,5179,123,2,May
4786,Reel Talk Ep. 11 - Three's a Charm | Wicked Tuna,2015-05-04,35823,148,8,May
4787,Moons vs. Moon Words | StarTalk,2015-05-04,3428,106,10,May
4788,Photographing the Real Detroit | Exposure,2015-05-04,16399,311,22,May
4789,Neil deGrasse Tyson on Dan Savage | StarTalk,2015-05-03,6097,95,5,May
4790,Discussing the Science of Sex | StarTalk,2015-05-02,15661,189,22,May
4791,Chernobyl Fox Makes a Six-Layer Sandwich | National Geographic,2015-05-02,186231,2534,195,May
4792,Dan Savage Discusses Relationships | StarTalk,2015-05-01,20313,264,50,May
4793,The Unknown - Behind the Scenes | Life Below Zero,2015-05-01,40204,216,10,May
4794,Amazing Photos - Exploring a Dolphin’s World | Exposure,2015-05-01,39345,309,9,May
4795,In Defense of the One-Night Stand | StarTalk,2015-04-30,17154,212,16,Apr
4796,Real-Life Teddy Bears of the Rain Forest | Expedition Raw,2015-04-30,77705,983,137,Apr
4797,Social Monogamy vs. Sexual Monogamy | StarTalk,2015-04-29,35587,620,152,Apr
4798,Exclusive: Deep-Sea Sharks and More Spotted by New Camera | National Geographic,2015-04-29,405209,2729,118,Apr
4799,"Sex, Explained | StarTalk",2015-04-28,1120787,3252,313,Apr
4800,Here's What We Know About Dolphin Intelligence | National Geographic,2015-04-28,1059669,5601,411,Apr
4801,Reel Talk Ep. 10 - When Push Comes To Shove | Wicked Tuna,2015-04-27,60238,224,22,Apr
4802,Adventure on the Okavango: The Data Artist | Nat Geo Live,2015-04-27,5508,57,2,Apr
4803,Catch of the Week - Back in Business | Wicked Tuna,2015-04-27,58068,239,7,Apr
4804,Why These People Love Detroit | National Geographic,2015-04-27,5249,127,12,Apr
4805,How to Move a Two-Ton Elephant to Safety | Short Film Showcase,2015-04-25,66702,528,44,Apr
4806,Scientific Accuracy in Film | StarTalk,2015-04-24,4704,140,7,Apr
4807,"Stolen 2,600-Year-Old Sarcophagus, Other Artifacts Return to Egypt | National Geographic",2015-04-24,24424,378,73,Apr
4808,Out of Control - Behind the Scenes | Life Below Zero,2015-04-24,349093,1324,45,Apr
4809,The Big Bang - Fan Questions | StarTalk,2015-04-23,5927,151,41,Apr
4810,Wolverine Research Isn’t Pretty | Expedition Raw,2015-04-23,16561,178,20,Apr
4811,Neil deGrasse Tyson Reveals Dream StarTalk Guestlist | StarTalk,2015-04-22,3062,71,7,Apr
4812,Utah Bears End Hibernation Early. That Could Be a Problem | National Geographic,2015-04-22,10316,148,19,Apr
4813,Neil deGrasse Tyson on Christopher Nolan | StarTalk,2015-04-21,101801,2471,64,Apr
4814,Exclusive: Rare Ghost Monkeys Filmed in Colombia | National Geographic,2015-04-21,190440,1605,33,Apr
4815,Neil deGrasse Tyson Reads Mean Tweets - Pluto Edition | StarTalk,2015-04-20,370084,7580,500,Apr
4816,Catch of the Week - Hat Trick for Hard Merch | Wicked Tuna,2015-04-20,287214,1189,14,Apr
4817,George Takei and the Acting Bug | StarTalk,2015-04-20,3983,67,6,Apr
4818,Adventure on the Okavango: The Conservationist | Nat Geo Live,2015-04-20,12196,166,7,Apr
4819,Amateur Photographers Get to Be Nat Geo Photo Editors | National Geographic,2015-04-20,15439,317,37,Apr
4820,Reel Talk Ep. 9 - Wicked Pissed | Wicked Tuna,2015-04-20,42686,149,26,Apr
4821,Neil's Favorite Female Scientists - Fan Questions | StarTalk,2015-04-19,6017,166,10,Apr
4822,Meditative Snow Monkeys Hang Out in Hot Springs | Short Film Showcase,2015-04-18,681645,11655,644,Apr
4823,Neil deGrasse Tyson on George Takei | StarTalk,2015-04-18,9749,143,7,Apr
4824,Armed For Winter - Behind the Scenes | Life Below Zero,2015-04-17,84790,167,8,Apr
4825,Outhouse to the Penthouse | Wicked Tuna,2015-04-17,89550,298,8,Apr
4826,Rock-Climbing China: A Vertical Journey | Nat Geo Live,2015-04-17,26017,316,18,Apr
4827,Bat Man of Borneo | Expedition Raw,2015-04-17,10913,94,4,Apr
4828,Rock-Climbing China: A Stone Forest | Nat Geo Live,2015-04-16,79937,722,26,Apr
4829,Divers Search for Tiny Animals in Iceland’s Fissures | Expedition Raw,2015-04-16,30518,431,12,Apr
4830,The Gulf Oil Spill Disintegrated This Island | National Geographic,2015-04-15,502224,3149,448,Apr
4831,Interviewing for Star Trek | StarTalk,2015-04-15,23264,287,11,Apr
4832,"Austin: Weird, Wacky, and Worth Photographing | National Geographic",2015-04-15,6096,116,6,Apr
4833,A Better Future Through Science | StarTalk,2015-04-14,7125,281,27,Apr
4834,Drones and the Future of Farming | National Geographic,2015-04-14,225748,1068,49,Apr
4835,Warp Drive Dissension | StarTalk,2015-04-13,32960,489,51,Apr
4836,Star Trek's Futuristic Innovations | StarTalk,2015-04-13,11289,255,13,Apr
4837,Rock-Climbing China: A Drone Destroyed | Nat Geo Live,2015-04-13,15304,141,11,Apr
4838,Following the Tracks of Lincoln - A Photographer’s Journey | Exposure,2015-04-13,6593,74,10,Apr
4839,Harsh Reality of Saving Endangered Ferrets | National Geographic,2015-04-10,1901007,15237,5021,Apr
4840,Ready or Not - Behind the Scenes | Life Below Zero,2015-04-09,73963,350,20,Apr
4841,Whales Surprise Baja Paddlers | Expedition Raw,2015-04-09,26117,303,15,Apr
4842,LA Farmers Market | Sue in the City,2015-04-09,26015,258,24,Apr
4843,Pancakes or Waffles? | Building Wild Deleted Scene,2015-04-08,3441,23,5,Apr
4844,Amazing: Watch an Elephant Sniff for Bombs | National Geographic,2015-04-08,9672,151,20,Apr
4845,Tundra Greenhouse | Life Below Zero,2015-04-07,45602,313,14,Apr
4846,Gross or Brilliant? Using Bugs to Feed the Animals We Eat | National Geographic,2015-04-07,603081,5617,350,Apr
4847,See Yankee Stadium Vanish in 30 Seconds | National Geographic,2015-04-06,561341,3650,467,Apr
4848,Living in the Age of Airplanes (Trailer) | National Geographic,2015-04-06,45981,475,50,Apr
4849,Catch of the Week - Harpooning Hollywood | Wicked Tuna,2015-04-06,79335,271,16,Apr
4850,Acting With Reese Witherspoon | Nat Geo Live,2015-04-06,3231,28,0,Apr
4851,Facing Fear in the Wild (Cheryl Strayed) | Nat Geo Live,2015-04-06,7555,64,3,Apr
4852,Reel Talk Ep. 7 - The Maine Event | Wicked Tuna,2015-04-06,26950,129,10,Apr
4853,Grandmas Gone Wild | The Big Picture with Kal Penn,2015-04-05,33944,131,13,Apr
4854,Mosquito Death Squad | The Big Picture with Kal Penn,2015-04-05,743731,5082,669,Apr
4855,Kinky City | The Big Picture with Kal Penn,2015-04-04,31492,165,22,Apr
4856,POV: Ride on the Back of a Giant River Turtle | National Geographic,2015-04-03,273090,1092,78,Apr
4857,Santa Monica Pier | Sue in the City,2015-04-02,18427,204,14,Apr
4858,The Nat Geo View App: What Will You View Today? | National Geographic,2015-04-02,16431,161,31,Apr
4859,Reel Talk Ep. 6 - Tuna Tantrums | Wicked Tuna,2015-04-01,35986,158,9,Apr
4860,“BioBot” Roaches Could Save Lives With Tiny Backpacks | National Geographic,2015-04-01,80890,1062,124,Apr
4861,We Put a Camera on a Manatee’s Peduncle | National Geographic,2015-03-31,22101,204,21,Mar
4862,Refugee Finds a Future in Photography | Nat Geo Live,2015-03-30,4944,45,5,Mar
4863,Photographer Finds Hope in an Orphanage | Nat Geo Live,2015-03-30,3109,29,1,Mar
4864,Kickboxing for Peace | Nat Geo Live,2015-03-30,4619,42,2,Mar
4865,Adult Space Camp Trains Civilians to Study Our Mysterious Atmosphere | National Geographic,2015-03-30,12918,157,5,Mar
4866,Gold Fever | The Big Picture with Kal Penn,2015-03-29,26776,103,7,Mar
4867,Unlikely Treasures | The Big Picture with Kal Penn,2015-03-28,27083,82,5,Mar
4868,Amazing Peacock Spiders Perform a Fascinating Love Dance | National Geographic,2015-03-27,194721,1517,119,Mar
4869,Surfer Sue | Sue in the City,2015-03-26,22679,217,12,Mar
4870,Nat Geo’s Stop-Motion Team Animates History | National Geographic,2015-03-26,73469,1158,26,Mar
4871,Kelsey Grammer on Playing King Herod | Killing Jesus,2015-03-25,12458,88,11,Mar
4872,"Building an Ancient, Mysterious Monument (Amazing Stop-Motion) | National Geographic",2015-03-25,162248,1914,62,Mar
4873,Meet the Fearless Ebola Hunters of Sierra Leone | National Geographic,2015-03-24,65830,443,77,Mar
4874,Stephanie Leonidas on Playing Salome | Killing Jesus,2015-03-23,23237,178,14,Mar
4875,Unsung Heroes of Everest | Nat Geo Live,2015-03-23,1198477,24222,842,Mar
4876,A Tiny Beetle Is Destroying Entire Forests | National Geographic,2015-03-23,23002,221,32,Mar
4877,Catch of the Week - Sandro's in Charge | Wicked Tuna,2015-03-23,222876,828,42,Mar
4878,Behind the Production | Killing Jesus,2015-03-21,7243,48,20,Mar
4879,96 Seconds of Baby Elephants | Short Film Showcase,2015-03-21,139627,1379,47,Mar
4880,Life Below Zero - Series Trailer | Life Below Zero,2015-03-20,147254,427,52,Mar
4881,What Makes These Sculptures Look So Perfect? | Short Film Showcase,2015-03-20,66460,1202,93,Mar
4882,Fox Studios | Sue in the City,2015-03-20,27831,239,17,Mar
4883,The Hair and Make-Up | Killing Jesus,2015-03-20,12095,99,11,Mar
4884,Is It OK to Let These Wolves Go Extinct in the Wild? | National Geographic,2015-03-20,47598,499,279,Mar
4885,A Hundred Million Stars in 3 Minutes | Short Film Showcase,2015-03-19,709306,8110,850,Mar
4886,Abhin Galeya on Playing John the Baptist | Killing Jesus,2015-03-19,9403,72,6,Mar
4887,"Explorer Interrupts Mating Tortoises, Slowest Chase Ever Ensues | National Geographic",2015-03-19,22729062,165687,14999,Mar
4888,The Power Struggle of the Time | Killing Jesus,2015-03-18,8310,56,6,Mar
4889,Stunning Pitcairn Islands Revealed | Edge of the World,2015-03-18,80321,534,41,Mar
4890,Eoin Macken on Playing Antipas | Killing Jesus,2015-03-17,10529,78,12,Mar
4891,Iconic Space Images Are Actually Black-and-White | National Geographic,2015-03-17,154062,2392,152,Mar
4892,For the Love of Jaguars | Nat Geo Live,2015-03-16,119284,1381,96,Mar
4893,Reel Talk Ep. 5 - Go Hard or Go Home | Wicked Tuna,2015-03-16,27263,118,11,Mar
4894,"On ISIS Destruction: Human History ""Is Permanent"" | National Geographic",2015-03-16,104488,811,350,Mar
4895,Swimming With an Endangered Giant | Nat Geo Live,2015-03-16,29838,423,49,Mar
4896,Jason Silva on Faces | Brain Games,2015-03-16,30807,147,11,Mar
4897,Dolphins: Even Smarter Than You Thought | Nat Geo Live,2015-03-16,919298,11019,937,Mar
4898,Stephen Moyer on Playing Pontius Pilate | Killing Jesus,2015-03-16,10068,89,23,Mar
4899,Catch of the Week - Go Hard or Go Home | Wicked Tuna,2015-03-16,3629179,15794,224,Mar
4900,Brain Magic - The Faces Illusion | Brain Games,2015-03-15,109597,718,31,Mar
4901,Getting Into Character with Haaz Sleiman | Killing Jesus,2015-03-15,13389,118,74,Mar
4902,"The Director, Chris Menaul | Killing Jesus",2015-03-14,3044,23,3,Mar
4903,Hollywood Boulevard | Sue in the City,2015-03-13,17628,153,5,Mar
4904,Joe Doyle on Playing Judas | Killing Jesus,2015-03-13,6451,43,3,Mar
4905,Fleeing ISIS Conflict - Photographing Refugees | Exposure,2015-03-13,13389,169,19,Mar
4906,"A Child Prodigy, a Painful Disease, and a Life-Changing Treatment | National Geographic",2015-03-12,930884,19037,824,Mar
4907,Filming in Morocco | Killing Jesus,2015-03-12,14490,133,13,Mar
4908,John Rhys Davies on Playing Annas | Killing Jesus,2015-03-12,5511,39,4,Mar
4909,Big Nine Parade Celebrates New Orleans' Vibrant Spirit | National Geographic,2015-03-11,2935,28,12,Mar
4910,The Costumes | Killing Jesus,2015-03-11,17612,147,14,Mar
4911,Emmanuelle Chriqui on Playing Herodia | Killing Jesus,2015-03-11,24168,161,12,Mar
4912,The Women's Costumes | Killing Jesus,2015-03-11,10282,94,2,Mar
4913,What It's Like to Play Jesus | Killing Jesus,2015-03-11,10982,98,42,Mar
4914,Awkward Stare | Brain Games,2015-03-10,270745,3412,237,Mar
4915,Killing Jesus | National Geographic,2015-03-10,292708,254,329,Mar
4916,Catch of the Week - Paulie's Big Payday | Wicked Tuna,2015-03-09,483674,1666,53,Mar
4917,Sufferfest: 700 Miles of Pain and Glory | Nat Geo Live,2015-03-09,1078096,9946,336,Mar
4918,He’s One of the Best Mountain Climbers Ever | National Geographic,2015-03-09,119095,1864,172,Mar
4919,Reel Talk Ep. 4 - Harpoon Hellraising | Wicked Tuna,2015-03-09,26098,123,9,Mar
4920,Florida's Beautiful but Inhospitable Springs | National Geographic,2015-03-06,18494,262,41,Mar
4921,Saving Kids From Polio in Islamic State Territory | National Geographic,2015-03-05,16850,200,24,Mar
4922,Brain Magic - The Misconception Illusion | Brain Games,2015-03-04,742355,8854,381,Mar
4923,Wet and Wild | Ultimate Survival,2015-03-03,6860,45,4,Mar
4924,Brain Magic - The Peer Pressure Illusion | Brain Games,2015-03-03,142993,1024,27,Mar
4925,Eerie Time-Lapse of Bug-Eating Plants | Short Film Showcase,2015-03-03,2512332,24965,1050,Mar
4926,Jason Silva on Peer Pressure | Brain Games,2015-03-03,35508,369,19,Mar
4927,Risk Takers: Challenging Everest | Nat Geo Live,2015-03-02,78624,554,15,Mar
4928,Jason Silva on Misconceptions | Brain Games,2015-03-02,15407,134,4,Mar
4929,Risk Takers: Working With Deadly Viruses | Nat Geo Live,2015-03-02,15316,321,6,Mar
4930,Risk Takers: Catching Deadly Snakes | Nat Geo Live,2015-03-02,31494,370,15,Mar
4931,Reel Talk Ep. 3 - Payback's a Fish | Wicked Tuna,2015-03-02,24441,115,11,Mar
4932,Jason Silva on Memory | Brain Games,2015-03-01,20258,233,16,Mar
4933,Brain Magic - The Memory Illusion | Brain Games,2015-02-28,581634,10313,204,Feb
4934,Brain Magic - The Morality Illusion | Brain Games,2015-02-27,405791,3164,233,Feb
4935,What the Pear? | Brain Games,2015-02-26,138150,1237,39,Feb
4936,Full Speed Ahead | Building Wild,2015-02-26,8751,47,2,Feb
4937,Miami's Choice: Bigger Ships or Coral Reefs? | National Geographic,2015-02-26,8775,124,28,Feb
4938,A One of a Kind Toilet | Building Wild,2015-02-25,20086,229,16,Feb
4939,"600,000 Salmon Restock River by the Truckful | National Geographic",2015-02-25,18520,224,25,Feb
4940,Question the Herd | Brain Games,2015-02-24,593111,4583,395,Feb
4941,Drones Sacrificed for Spectacular Volcano Video | National Geographic,2015-02-24,13472251,92175,3952,Feb
4942,Risk Takers: Extreme Kayaking | Nat Geo Live,2015-02-23,27803,126,3,Feb
4943,Risk Takers: Archaeology From Space | Nat Geo Live,2015-02-23,15761,160,12,Feb
4944,Catch of the Week: Anchor Anger | Wicked Tuna,2015-02-23,162785,782,6,Feb
4945,Underwater Lemur Graveyard Discovered | National Geographic,2015-02-23,50026,462,15,Feb
4946,Reel Talk Ep. 2 - Wicked Rivals | Wicked Tuna,2015-02-23,73314,347,43,Feb
4947,Tight Squeeze on the Upper Level | Cabin Fever,2015-02-21,14421,125,6,Feb
4948,Chainsaw Built Breakfast Bar | Cabin Fever,2015-02-20,22681,136,6,Feb
4949,Under Pressure | Brain Games,2015-02-19,364232,4201,133,Feb
4950,Haunting Time-Lapses From the End of the Earth | National Geographic,2015-02-19,91845,1396,72,Feb
4951,Official Trailer | Killing Jesus,2015-02-18,1502868,4402,1554,Feb
4952,Glow-in-the-Dark Mushrooms: Nature’s Night Lights | National Geographic,2015-02-18,366690,5563,314,Feb
4953,Heavy Mental Music | Brain Games,2015-02-17,103976,821,62,Feb
4954,Incredible Disguise: Praying Mantis Mimics Flower | National Geographic,2015-02-17,367293,2192,112,Feb
4955,Reel Talk Ep. 1: Opening Day | Wicked Tuna,2015-02-16,17434,110,8,Feb
4956,Bear-ly Keeping Up | Ultimate Survival,2015-02-16,20230,89,2,Feb
4957,Rare Look Inside Antarctic Explorers’ Huts | National Geographic,2015-02-16,2238182,1518,71,Feb
4958,Ice Castle Closes Due to Utah's Warm Winter | National Geographic,2015-02-13,26819,292,57,Feb
4959,Mick the Baker | National Geographic,2015-02-12,462503,2252,142,Feb
4960,Man Castrates Reindeer With His Teeth | National Geographic,2015-02-12,158404,612,213,Feb
4961,Digging up Paperwork | The Legend of Mick Dodge,2015-02-11,394736,1445,74,Feb
4962,Making a Compass | National Geographic,2015-02-11,11738,134,13,Feb
4963,The Chunking Trick | Brain Games,2015-02-11,246607,2007,77,Feb
4964,What Are You Touching in NYC's Subway? | National Geographic,2015-02-11,108048,452,62,Feb
4965,Jason Silva on Morality | Brain Games,2015-02-10,19368,141,36,Feb
4966,The Headphone Trap | Hacking The System,2015-02-10,10406,125,8,Feb
4967,Mating Crabs Busted by Sharks | National Geographic,2015-02-10,155904,831,97,Feb
4968,Chaos in the Heart of Africa | Nat Geo Live,2015-02-09,473398,2427,544,Feb
4969,To Remember or Not to Remember | Brain Games,2015-02-09,169461,1411,41,Feb
4970,Jason Silva on the Paranormal | Brain Games,2015-02-08,18923,0,0,Feb
4971,Finding Love at the Dog Park | Hacking the System,2015-02-08,8916,107,16,Feb
4972,All or Nothing | Ultimate Survival,2015-02-07,10908,70,12,Feb
4973,Staying Cool | Hacking the System,2015-02-07,31379,286,9,Feb
4974,Brain Magic - The Paranormal Illusion | Brain Games,2015-02-07,92648,685,58,Feb
4975,Devil's Slide | Ultimate Survival,2015-02-06,19136,118,7,Feb
4976,Let the Games Begin | The Legend of Mick Dodge,2015-02-06,234913,785,32,Feb
4977,Open House | Brain Games,2015-02-06,166799,1259,67,Feb
4978,Spellbinding Time-Lapses of an African Desert | Short Film Showcase,2015-02-06,81674,1188,69,Feb
4979,The Fortune Teller | Hacking the System,2015-02-06,35817,313,19,Feb
4980,Deadly Flamboyant Cuttlefish Puts on Flashy Display | Short Film Showcase,2015-02-05,324713,2408,171,Feb
4981,Bog Bridge | The Legend of Mick Dodge,2015-02-05,163037,511,24,Feb
4982,Do You Believe? | Brain Games,2015-02-05,3437199,28796,2661,Feb
4983,Don’t Get Suckered by a Scalper | Hacking the System,2015-02-05,27627,356,9,Feb
4984,Tiny Frogs Contain Big Evolutionary Surprise | National Geographic,2015-02-03,16957,222,31,Feb
4985,This Is Your Brain on Nature | Nat Geo Live,2015-02-02,62934,696,16,Feb
4986,Sled Dogs: More Than Meets the Eye | National Geographic,2015-02-02,477621,4637,346,Feb
4987,Homemade Bottle Opener | Hacking the System,2015-01-30,42042,253,31,Jan
4988,Hangout With the Adventurers of the Year | National Geographic,2015-01-30,7532,89,6,Jan
4989,Jason Silva on Money | Brain Games,2015-01-29,22200,235,12,Jan
4990,The Human Cost of Sugar Harvesting | National Geographic,2015-01-29,78683,746,81,Jan
4991,Hoh Dentist | The Legend of Mick Dodge,2015-01-29,339612,1831,119,Jan
4992,Tub Diggin’ | The Legend of Mick Dodge,2015-01-29,220529,1045,45,Jan
4993,Waiting in Line | Hacking the System,2015-01-29,11603,102,7,Jan
4994,Winning the Interview | Hacking the System,2015-01-29,120027,1227,30,Jan
4995,Brain Magic - The Money Illusion | Brain Games,2015-01-28,173998,1438,71,Jan
4996,Hunting Grouse | The Legend of Mick Dodge,2015-01-28,154468,718,50,Jan
4997,Secrets of Successful Arm Wrestling | Hacking the System,2015-01-28,84924,903,29,Jan
4998,NYC’s Non-Blizzard Was Beautiful | National Geographic,2015-01-28,10718,208,22,Jan
4999,Money to Burn | Brain Games,2015-01-27,409256,3140,236,Jan
5000,Forest Stew | The Legend of Mick Dodge,2015-01-27,1032772,5648,446,Jan
5001,How to Make a Debris Shelter | Remote Survival,2015-01-27,6676,44,11,Jan
5002,Brilliant Time-Lapse of Alaska’s Northern Lights | Short Film Showcase,2015-01-27,1117067,11059,448,Jan
5003,Cakes of Deception | Brain Games,2015-01-26,247915,2413,167,Jan
5004,The Curious Life of a Mars Rover | Nat Geo Live,2015-01-26,14403286,152545,11011,Jan
5005,Wicked Tuna - Season 4 Trailer | Wicked Tuna,2015-01-26,13124,47,4,Jan
5006,Wicked Tuna - Season 4 Teaser | Wicked Tuna,2015-01-26,437658,18,4,Jan
5007,"Remarkable POV: Jumbo Squid ""Flash"" to Talk | National Geographic",2015-01-26,91419,978,83,Jan
5008,Eyes on  the Forest | The Legend of Mick Dodge,2015-01-23,367906,1200,48,Jan
5009,"20 Days Later, Their Home Was Still Flooded | National Geographic",2015-01-23,121223,663,38,Jan
5010,Suspect Identified | The Legend of Mick Dodge,2015-01-22,559776,1915,74,Jan
5011,Would You Go to Mars If You Could Never Come Back to Earth? | Short Film Showcase,2015-01-22,81418,890,479,Jan
5012,Berry Ingenuity | The Legend of Mick Dodge,2015-01-21,327007,1380,61,Jan
5013,Amazing Slow-Mo: Rare Tiger Released Into Wild | Short Film Showcase,2015-01-21,128780,1652,93,Jan
5014,How to Feel Safe in the City | Hacking the System,2015-01-21,15069,180,5,Jan
5015,Barista Undercover | Brain Games,2015-01-21,137059,1193,72,Jan
5016,How to Get Around 'No Vacancy' | Hacking the System,2015-01-20,15995,192,22,Jan
5017,Hoh Taxi | The Legend of Mick Dodge,2015-01-20,215242,571,37,Jan
5018,Most Earth-Friendly Home Ever Built? | National Geographic,2015-01-20,30074,259,15,Jan
5019,How to Spot Knock-Offs | Hacking the System,2015-01-20,14417,156,14,Jan
5020,Helping Hands | Brain Games,2015-01-20,263288,2208,237,Jan
5021,From Farm to Table | Nat Geo Live,2015-01-19,173218,1673,43,Jan
5022,Fighting to Save Coral in the Florida Keys | National Geographic,2015-01-19,16293,277,32,Jan
5023,"Left Game, Right Game | Brain Games",2015-01-17,143316,1013,60,Jan
5024,Dangerous Trek to Myanmar’s Highest Peak (Preview) | National Geographic,2015-01-16,73389,776,28,Jan
5025,Fountain Pens Are Actually Fascinating | National Geographic,2015-01-16,213785,5430,204,Jan
5026,World's Hardest Climb Goal of Yosemite Wall Climber | National Geographic,2015-01-15,2814100,14678,891,Jan
5027,Meet Team Lower 48 | Ultimate Survival Alaska,2015-01-15,8594,39,6,Jan
5028,Meet Team Alaskans | Ultimate Survival Alaska,2015-01-15,19871,142,6,Jan
5029,The Gibberish Game | Brain Games,2015-01-15,581309,4941,298,Jan
5030,Meet Team Military | Ultimate Survival Alaska,2015-01-15,29256,187,4,Jan
5031,This Dog's Nose Saves Bees | National Geographic,2015-01-15,89861,485,32,Jan
5032,High-Octane Race to Survive | National Geographic,2015-01-15,97921,106,2,Jan
5033,Meet Team Endurance | Ultimate Survival Alaska,2015-01-14,14758,83,7,Jan
5034,Jason Silva on Left vs. Right | Brain Games,2015-01-14,15212,123,4,Jan
5035,How to Build a Teepee | The Pioneers,2015-01-14,614146,4297,190,Jan
5036,Brain Magic - The Common Sense Illusion | Brain Games,2015-01-14,1238273,12913,398,Jan
5037,Brain Magic - The Left vs. Right Illusion | Brain Games,2015-01-14,656297,5744,243,Jan
5038,Big Trouble for Little Birds | National Geographic,2015-01-14,18689,266,12,Jan
5039,Public Wi-Fi | Hacking the System,2015-01-13,153690,1550,108,Jan
5040,Creatures in the Dark | The Pioneers,2015-01-13,3908,37,3,Jan
5041,Untamed Horses in Iceland's Mountains | National Geographic,2015-01-13,219456,538,19,Jan
5042,The Amazing Brains of Babies | National Geographic,2015-01-13,46358,305,8,Jan
5043,The ATM Scam | Hacking the System,2015-01-12,68359,491,54,Jan
5044,Art of the Matter | Nat Geo Live,2015-01-12,10005,80,7,Jan
5045,"Arizona Arms | Underworld, INC",2015-01-12,26827,188,56,Jan
5046,Rube Goldberg Mouse Trap | Brain Games,2015-01-12,81360,302,25,Jan
5047,Jason Silva on Common Sense | Brain Games,2015-01-12,17779,163,13,Jan
5048,Brain Teasers | Brain Games,2015-01-12,552501,5040,263,Jan
5049,"The Ultimate Black Market Weapon | Underworld, INC",2015-01-11,4841235,39534,3095,Jan
5050,Is Eating Venomous Sea Snakes a Bad Thing? | National Geographic,2015-01-09,4467286,6763,1370,Jan
5051,17-Year-Old Cancer Researcher Already Making an Impact | National Geographic,2015-01-08,83002,1288,113,Jan
5052,First Look | Killing Jesus,2015-01-07,261648,1122,472,Jan
5053,Moving a Ten-Ton Dino Deathtrap | National Geographic,2015-01-07,22428,218,6,Jan
5054,Pups Rescued From Dog Meat Farm Need Adoption | National Geographic,2015-01-07,48672,850,201,Jan
5055,This Hotel Is Made Entirely of Salt | National Geographic,2015-01-06,261846,1903,154,Jan
5056,Zombie Parasites | Nat Geo Live,2015-01-05,2217507,38190,2669,Jan
5057,World's Most Dangerous Road? | National Geographic,2015-01-05,217068,1129,64,Jan
5058,This Man Risked It All to Change Uganda's Energy Destiny | National Geographic,2015-01-02,37265,786,43,Jan
5059,Fighting for Brazil's Stolen Species | National Geographic,2015-01-01,16722,210,16,Jan
5060,Grueling 80-Mile Horse Race Demands More Than Speed | National Geographic,2014-12-31,381238,1965,115,Dec
5061,Rescuing the Wagon | The Pioneers,2014-12-30,6424,46,8,Dec
5062,Rule Your World: Time Flies | Crowd Control,2014-12-30,24108,158,8,Dec
5063,Rainstorm | The Pioneers,2014-12-30,9723,66,7,Dec
5064,Did Humans Make These Ancient Cave Paintings? | National Geographic,2014-12-30,237226,1587,273,Dec
5065,The Community of Food | Nat Geo Live,2014-12-29,18407,116,2,Dec
5066,Incredible Solar Stickers Capture Sun's Energy | National Geographic,2014-12-29,25832,512,42,Dec
5067,Why I Love Africa's Largest City | National Geographic,2014-12-25,38534,336,98,Dec
5068,A Year of Images in 30 Seconds: Photo of the Day | National Geographic,2014-12-24,34645,464,29,Dec
5069,Why Is It Important to Explore? | National Geographic,2014-12-24,34566,390,32,Dec
5070,Rule Your World: Do the Right Thing | Crowd Control,2014-12-23,60193,305,5,Dec
5071,Rule Your World: Food for Thought | Crowd Control,2014-12-23,33587,259,7,Dec
5072,Life and Death in a Bird E.R. | National Geographic,2014-12-23,37147,723,61,Dec
5073,The Cheesemaker! | National Geographic,2014-12-22,8689,94,5,Dec
