,Title,Published_date,Views,Likes,Comments,Month
0,Inca Island in the Sky (Full Episode) | Lost Cities with Albert Lin,2024-02-17,5128,522,22,Feb
1,Dr. Martin Luther King Jr.'s Sermon | Genius: MLK/X | National Geographic,2024-02-16,8057,360,19,Feb
2,Paid content for @Prada. Facing the invasive Atlantic blue crab,2024-02-15,15995,619,17,Feb
3,Lost Nukes of the Cold War (Full Episode) | Drain the Oceans,2024-02-15,68986,1314,57,Feb
4,The Meeting of Two Minds | Genius: MLK/X | National Geographic,2024-02-13,20017,439,29,Feb
5,How would you react if your vacation was cut short for this? 🗼 #BestoftheWorld #NatGeo,2024-02-13,15885,420,2,Feb
6,Space Invaders: Solving the Invasive Species Explosion | National Geographic,2024-02-12,43635,863,37,Feb
7,5 lessons from an omakase sushi chef 🍣 #BestoftheWorld #NatGeo,2024-02-12,14607,455,6,Feb
8,Uncovering the Secrets of the International Space Station (Full Episode) | Superstructures,2024-02-11,359706,4786,315,Feb
9,How do chefs react when other chefs try their food? 👨‍🍳 #BestoftheWorld #shorts,2024-02-11,18524,622,6,Feb
10,Romance Scams (Full Episode) | Trafficked with Mariana van Zeller,2024-02-10,182225,2751,445,Feb
11,Are you this neat when you meal prep?? #BestoftheWorld #NatGeo Check out the full episode!,2024-02-10,29079,648,5,Feb
12,Paid content for @ExploreCanada. Experiencing the season of bounty. #Canada,2024-02-09,18371,536,5,Feb
13,"""Umi"" an Original Song by Alewya for #NatGeoQueens",2024-02-09,14009,710,12,Feb
14,How to properly butcher a fish from a world-class Japanese sushi chef 🔪 #BestoftheWorld,2024-02-09,13980,386,4,Feb
15,"The beautiful art of sushi making at Udatsu Sushi in Tokyo, Japan 🐟 #BestoftheWorld #NatGeo",2024-02-08,17734,627,7,Feb
16,Photographer | Official Trailer | National Geographic,2024-02-08,131392,5526,124,Feb
17,LA Mega Stadium: Building Impossible with Daniel Ashville (Full Episode) | National Geographic,2024-02-08,6342,162,11,Feb
18,Secrets of the Octopus | Official Trailer | National Geographic,2024-02-08,48476,1471,79,Feb
19,Super Nanny Ant | National Geographic #Shorts,2024-02-07,18253,944,11,Feb
20,QUEENS | Official Trailer | National Geographic,2024-02-07,1495843,1338,76,Feb
21,See how this sushi merges tradition & evolution in Episode 1 of #BestoftheWorld 🍣 #shorts,2024-02-06,12146,343,5,Feb
22,Paid content for @Prada. Indigenous lessons in the Arctic #nature,2024-02-05,14164,717,10,Feb
23,Who doesn’t love a sweet surprise during their omakase experience? 🍤 #BestoftheWorld #NatGeo,2024-02-05,20186,528,7,Feb
24,A Tokyo sushi experience so rare the host couldn’t even explain it 😶 #BestoftheWorld #NatGeo,2024-02-04,23183,639,4,Feb
25,Visiting Historic Green Book Locations (Full Episode) | Black Travel Across America,2024-02-04,22595,559,23,Feb
26,Mariana van Zeller Sits Down with Marvel's Echo Star Alaqua Cox | National Geographic,2024-02-03,46103,437,32,Feb
27,Before Free Solo (Full Episode) | Edge of the Unknown with Jimmy Chin,2024-02-03,240893,5160,171,Feb
28,This sushi dish blew Lucas’s mind AND purified his soul 🤯 Check it out in Ep 1! #BestoftheWorld,2024-02-03,18682,734,11,Feb
29,Natural Custodians: Indigenous Lessons in Reconnecting with Nature | National Geographic,2024-02-02,30670,929,45,Feb
30,Who doesn't love a scavenger hunt?🔍 Full episode now up! #BestoftheWorld #NatGeo,2024-02-02,13839,424,4,Feb
31,The Power of Us | The Story of Us with Morgan Freeman (Full Episode),2024-02-01,397427,5832,270,Feb
32,Forget an alarm clock—from now on we only want to wake up to a rice alarm🍚 #BestoftheWorld,2024-01-31,18090,670,3,Jan
33,Nat Geo's #BestOfTheWorld guide is out now! #shorts,2024-01-30,16215,601,2,Jan
34,Experience Tokyo’s Ultimate Omakase Sushi with Lucas Sin | Nat Geo’s Best of the World,2024-01-30,407577,9758,328,Jan
35,The Space Race | Official Trailer | National Geographic,2024-01-29,29545,644,38,Jan
36,Surviving the Grasslands (Full Episode) | Hostile Planet,2024-01-28,293941,2939,133,Jan
37,"Guac, Coke, and Human Smuggling (Full Episode) | To Catch a Smuggler",2024-01-27,792816,4248,307,Jan
38,Watch as a swarm of army ants devour their prey | Jungle Predators | A Real Bug's Life,2024-01-26,51621,1000,70,Jan
39,Leafcutter Ant Traffic Jam | National Geographic #Shorts,2024-01-26,20966,1100,16,Jan
40,Paid content for @Prada. Protecting our marine biodiversity in Raja Ampat #reefs #marinelife,2024-01-26,15341,756,7,Jan
41,Queen Bee Escapes Chicken Coop | National Geographic #Shorts,2024-01-25,33980,1497,28,Jan
42,Behind the Scenes of Incredible Animal Journeys (Full Episodes) | National Geographic,2024-01-25,16812,434,17,Jan
43,Raja Ampat: The Last Stronghold of Healthy Coral Reefs | National Geographic,2024-01-23,140910,2886,131,Jan
44,Behind the scenes: Flying a drone like albatross | Incredible Animal Journeys | National Geographic,2024-01-22,29852,690,19,Jan
45,Uncovering the Secrets of New York City (Full Episode) | Drain the Oceans,2024-01-21,1030618,11409,316,Jan
46,Petra's Hidden Origins | Lost Cities with Albert Lin (Full Episode),2024-01-20,390675,5873,231,Jan
47,Paid content for Travel Alaska. Follow Indigenous photographer Brian Adams on assignment in Juneau.,2024-01-19,24752,932,15,Jan
48,The Fight for Peace (Full Episode) | The Story of Us,2024-01-18,55455,1932,86,Jan
49,Experiencing the Rich History and Food of Canada's Season of Bounty | National Geographic,2024-01-18,40063,549,23,Jan
50,Explorer Albert Lin explores a cave burial site filled with ancient carvings #shorts,2024-01-17,22865,720,5,Jan
51,Explorer Albert Lin explores a cave burial site filled with ancient carvings,2024-01-17,49266,886,31,Jan
52,Arctic Ascent with Alex Honnold | Official Trailer | National Geographic,2024-01-16,542917,6839,273,Jan
53,Monarch Migration and Metamorphosis | Incredible Animal Journeys | National Geographic,2024-01-16,61772,1164,55,Jan
54,Developing tech to monitor life-threatening infections #shorts,2024-01-15,18202,764,12,Jan
55,Investigating Black Market Surgery (Full Episode) | Trafficked with Mariana Van Zeller,2024-01-14,96963,2384,140,Jan
56,Polar (Full Episode) | Hostile Planet | National Geographic,2024-01-13,270716,3270,106,Jan
57,Explorer Albert Lin descends into an epic underground cavern #shorts,2024-01-12,27631,1204,31,Jan
58,Explorer Albert Lin descends into an epic underground cavern,2024-01-12,75850,1390,63,Jan
59,Genius: MLK/X | Official Trailer | National Geographic,2024-01-11,2880081,3626,459,Jan
60,Let the Science Fair Begin (Full Episode) | Science Fair: The Series,2024-01-11,7336,156,7,Jan
61,Albert Lin climbs up a treacherous waterfall in search of ancient tombs #shorts,2024-01-10,23203,665,12,Jan
62,"🔴 LIVE: Scams, Cocaine, and Counterfeiting: Trafficked with Mariana van Zeller | S1 FULL EPISODES",2024-01-10,446351,4939,0,Jan
63,Albert Lin climbs up a treacherous waterfall in search of ancient tombs,2024-01-10,39431,741,39,Jan
64,Watchers of the Land | Short Film Showcase | National Geographic,2024-01-09,25071,743,29,Jan
65,Working to improve electric vehicles #shorts,2024-01-08,27127,1031,21,Jan
66,The Mission to Contact (Full Episode) | Nat Geo Documentary,2024-01-07,30737,495,151,Jan
67,Pink salmon mom battles an uphill river journey | Incredible Animal Journeys | National Geographic,2024-01-06,74422,1159,62,Jan
68,Solving world hunger with potatoes #shorts,2024-01-05,29737,1467,45,Jan
69,The Rise of the Roman Empire (Full Episode) | Drain the Oceans,2024-01-04,526373,4914,195,Jan
70,When disaster strikes: Explorer Albert Lin nearly gets crushed by falling boulder #shorts,2024-01-03,42387,1074,33,Jan
71,When disaster strikes: Explorer Albert Lin nearly gets crushed by falling boulder,2024-01-03,45759,864,87,Jan
72,Albatross Love Story | Incredible Animal Journeys | National Geographic,2024-01-02,43381,1379,53,Jan
73,Are You Ready? A Sneak Peek into Nat Geo 2024 | National Geographic,2024-01-01,36546,946,27,Jan
74,Rob Lowe Breaks Down the Wildest Moments of the 80s (Full Episode) | The 80's: Top Ten,2023-12-31,51958,944,54,Dec
75,Explorer Albert Lin dives into an ancient flooded tomb beneath a pyramid in Sudan #shorts,2023-12-30,45519,1454,18,Dec
76,Explorer Albert Lin dives into an ancient flooded tomb beneath a pyramid in Sudan,2023-12-30,372902,1905,121,Dec
77,Reducing harmful algae blooms worldwide #shorts,2023-12-29,40379,1731,31,Dec
78,Oceans Odysseys: Incredible Animal Journeys (Full Episode) | National Geographic,2023-12-28,48528,832,39,Dec
79,Proving social norms using science #shorts,2023-12-27,42042,1233,164,Dec
80,Explorer Albert Lin searches for the lost city of the Maya #shorts,2023-12-26,32750,1143,15,Dec
81,Explorer Albert Lin searches for the lost city of the Maya | Lost Cities With Albert Lin,2023-12-26,51351,1063,37,Dec
82,Buried Secrets of the Bible with Albert Lin: Sodom & Gomorrah (Full Episode) | National Geographic,2023-12-24,1603600,24338,1253,Dec
83,Perilous Red Crab Migration | Incredible Animal Journeys | National Geographic,2023-12-23,64262,1376,62,Dec
84,Inside Airport: Lost & Found (Full Episode) | National Geographic,2023-12-21,437604,2645,98,Dec
85,Arctic Fox Love Story | Incredible Animal Journeys | National Geographic,2023-12-19,138352,5312,137,Dec
86,The source of life for the Okavango | National Geographic,2023-12-18,30217,678,13,Dec
87,Rewind the 90's: A Decade of Disruption (Full Episode) | National Geographic,2023-12-17,91572,1642,125,Dec
88,Animal Showdown: Cheetah vs. Zebra Family | National Geographic,2023-12-16,79194,1270,35,Dec
89,Buried Secrets of the Bible with Albert Lin (Full Episode) | The Parting of the Red Sea: The Truth,2023-12-14,842668,10198,722,Dec
90,Everything is Gonna Be Alright | Bobi Wine: The People’s President | National Geographic,2023-12-13,34000,536,40,Dec
91,"Ancient Cities, Treasure, & Deadly Secrets | Drain the Oceans MEGA EPISODE | Season 1 FULL EPISODES",2023-12-12,2431537,8369,185,Dec
92,Death Stroll in Alaska's Winter (Full Episode) | Life Below Zero: First Alaskans,2023-12-10,175465,1671,75,Dec
93,Into the Wilderness: Trapping a Wolf | Life Below Zero,2023-12-09,58276,859,96,Dec
94,Friends & Enemies in the 90s: The Last Great Decade (Full Episode) | National Geographic,2023-12-07,36292,810,54,Dec
95,The Bardia | Short Film Showcase | National Geographic,2023-12-06,25383,605,50,Dec
96,Building an Outhouse | Life Below Zero,2023-12-05,47776,656,22,Dec
97,A Wild Life: Survival in Alaska (Full Episode) | Alaska: The Next Generation,2023-12-03,68509,837,36,Dec
98,Hunting Caribou | Life Below Zero,2023-12-02,40450,681,20,Dec
99,Meet Kevin! #ScienceFairTheSeries premieres Dec 10 on National Geographic. Streaming on Disney+,2023-11-30,24355,716,4,Nov
100,UNCOVERED: Hidden Secrets of Pompeii (Full Episode) | Lost Treasures of Rome,2023-11-30,443064,5376,110,Nov
101,All Hands on the Float House Deck | Life Below Zero,2023-11-28,58267,805,29,Nov
102,Protecting a Flamingo Paradise | Incredible Animal Journeys | National Geographic,2023-11-27,51260,973,27,Nov
103,King Tut's Treasures: Hidden Secrets Rediscovered (Full Episode) | National Geographic,2023-11-26,879903,8016,392,Nov
104,Into the Snow Storm: Checking for Predators | Life Below Zero,2023-11-25,71660,894,33,Nov
105,Kayaking the Highest Waterfall EXTREME (Full Episode) | Science of Stupid,2023-11-23,43794,641,22,Nov
106,Fishing Under the Ice | Life Below Zero,2023-11-21,38108,746,16,Nov
107,Ghost Ships of the Great Lakes: Lost Beneath the Waves (Full Episode) | National Geographic,2023-11-19,314881,2738,73,Nov
108,Building a Gym with Reusable Materials | Life Below Zero,2023-11-18,39637,697,21,Nov
109,Meet Fred the Tap-Dancing Turkey | Short Film Showcase | National Geographic,2023-11-17,44967,965,100,Nov
110,Witness a humpback whale birth caught on camera in Hawaii | National Geographic,2023-11-17,404101,6096,223,Nov
111,The March on Washington: Keepers of the Dream (Full Episode) | National Geographic,2023-11-16,13536,582,37,Nov
112,How can we protect the polar regions and fight climate change? We went to Paris to find out,2023-11-14,17247,550,72,Nov
113,Dominica: The Nature Island (2023) | Pristine Seas | National Geographic Society,2023-11-14,291942,3783,150,Nov
114,JFK's Assassination: One Day in America (Full Episode) | National Geographic,2023-11-12,57575,1631,234,Nov
115,Building with the Brothers | Life Below Zero,2023-11-11,35350,571,12,Nov
116,Science Fair: The Series | Official Trailer | National Geographic,2023-11-10,32127,657,20,Nov
117,The Legends of El Dorado: City of Gold (Full Episode) | Lost Cities with Albert Lin,2023-11-09,952599,10016,304,Nov
118,Ecotone | Short Film Showcase | National Geographic,2023-11-08,31057,804,35,Nov
119,Hunting for Deer | Life Below Zero,2023-11-07,45575,543,39,Nov
120,Bobi Wine: The People's President (Full Episode) | Nat Geo Documentary,2023-11-05,222329,8562,0,Nov
121,Fishing in Thorne Bay | Life Below Zero,2023-11-04,49711,1148,35,Nov
122,Why jumping out of a plane with no parachute is a bad idea (Full Episode) | Science of Stupid,2023-11-02,52229,856,40,Nov
123,Black Market Organs (Full Episode) | Trafficked with Mariana van Zeller,2023-10-29,659800,8502,652,Oct
124,How a young Bill Clinton made waves during his presidential campaign | Rewind the '90s,2023-10-28,32186,509,48,Oct
125,Presented by Subaru. Go leaf peeping with Nat Geo Photographer Jonathan Irish.,2023-10-27,38310,1781,29,Oct
126,1989: A World in Revolution (Full Episode) | 1989: The Year That Made Us,2023-10-26,53173,1093,55,Oct
127,Bertie Gregory's Favorite Moments | Animals Up Close | Disney+ | National Geographic,2023-10-25,37799,1305,27,Oct
128,Suspicious driver prompts officer to search a car for narcotics | To Catch a Smuggler,2023-10-24,33012,593,36,Oct
129,Botswana from above,2023-10-23,88961,3386,28,Oct
130,Villains of the Underworld: Secrets of the Ocean Floor (Full Episode) | Drain the Oceans,2023-10-22,195314,2258,47,Oct
131,How the End of the Cold War Led to Birth of the International Space Station | Rewind the '90s,2023-10-21,36594,526,40,Oct
132,Biggest Cocaine Busts: The Best of To Catch a Smuggler (Full Episode Compilation),2023-10-19,497468,4544,233,Oct
133,Genius: MLK/X | The Making Of | National Geographic,2023-10-19,43008,512,54,Oct
134,Arctic Ascent with Alex Honnold | Show Open | National Geographic,2023-10-18,141541,2029,94,Oct
135,Incredible Animal Journeys | Official Trailer | National Geographic,2023-10-18,34844,1007,28,Oct
136,A Real Bug’s Life | Official Trailer | National Geographic,2023-10-18,154450,1489,146,Oct
137,With Grace | Short Film Showcase | National Geographic,2023-10-18,10826,336,14,Oct
138,Deep concealment: searching for hidden narcotics in cars | To Catch a Smuggler,2023-10-17,44776,814,56,Oct
139,The beauty of the Galapagos,2023-10-16,53983,2694,37,Oct
140,It Smelled of Death... (Full Episode) | Something Bit Me,2023-10-15,88714,1578,59,Oct
141,Double Drug Bust | To Catch a Smuggler,2023-10-14,46926,801,40,Oct
142,Ancient Islands: Ghost City of the Pacific (Full Episode) | Lost Cities with Albert Lin,2023-10-12,2804594,27919,966,Oct
143,Landing the 900: The moment Tony Hawk became a legend | Rewind the '90s,2023-10-10,43484,917,50,Oct
144,Humpbacks vs. Orcas,2023-10-09,133865,7062,55,Oct
145,Skeletons of the Inca Rebellion (Full Episode) | SPECIAL,2023-10-08,353834,4746,225,Oct
146,Fake machine guns found at JFK mail facility | To Catch a Smuggler,2023-10-07,34934,709,72,Oct
147,Maui Shark Mystery (Full Episode) | SPECIAL,2023-10-05,473432,5181,260,Oct
148,The Space Race | Meet Ed Dwight | National Geographic Documentary Films,2023-10-05,17926,533,23,Oct
149,Sailing through the Ice Gauntlet: The Maze of Icebergs | Explorer: Lost in the Arctic,2023-10-03,31182,843,36,Oct
150,Jellyfish invasion!,2023-10-02,47465,2214,31,Oct
151,Swimming with Sharks in Mexico (Full Episode) | Never Say Never with Jeff Jenkins,2023-10-01,8032,253,24,Oct
152,Hitching a ride with the Gabra tribe's camel train | Primal Survivor: Extreme African Safari,2023-09-30,54545,836,54,Sep
153,How can a dandelion hold back a flood? | Initiating the butterfly effect for good,2023-09-29,22134,793,16,Sep
154,Gordon Ramsay: Uncharted | Holy Mexico: Exploring Oaxaca's Famous Cuisine (Full Episode),2023-09-28,1451979,27323,1367,Sep
155,Touring a unique terraced backyard farm | Farm Dreams,2023-09-26,25367,602,18,Sep
156,Prettiest night skies ever 🥺 #stargazing,2023-09-25,37329,3024,48,Sep
157,Shark Attack: Jaws Invasion SPECIAL (Full Episode) | Jaws Invasion,2023-09-24,137951,1891,76,Sep
158,Hanging out with a monitor lizard | Primal Survivor: Extreme African Safari,2023-09-23,46424,807,29,Sep
159,JFK: One Day In America | Official Trailer | National Geographic,2023-09-21,4231951,4818,655,Sep
160,Gordon Ramsay: Uncharted | Peru's Sacred Valley (Full Episode),2023-09-21,860789,8245,238,Sep
161,Harvesting microgreens with Chef Mory | Farm Dreams,2023-09-19,34828,642,23,Sep
162,Into the icy arctic... #northwestpassage #exploration,2023-09-18,32277,1428,31,Sep
163,From Baja to Patagonia (Full Episode) | Sobrevolando: Latin America from Above,2023-09-17,144469,2268,75,Sep
164,Honey hunting in the dead of night | Primal Survivor: Extreme African Survivor,2023-09-16,48936,663,30,Sep
165,Changing the narrative with Nat Geo Photographer Sofia Jaramillo | Hispanic Heritage Month,2023-09-15,16408,427,25,Sep
166,America's Wild West: Discovery of a Land (Full Episode) | What Really Happened,2023-09-14,839260,5359,304,Sep
167,Caught in a mangrove rip tide | Primal Survivor: Extreme African Safari,2023-09-12,35981,844,37,Sep
168,Behold the sea angel (Clione limacina),2023-09-11,45510,2591,58,Sep
169,Shark Queens: Rulers of the Ocean SPECIAL (Full Episode) | Shark Queens,2023-09-10,419142,3394,137,Sep
170,A school of hippos gives an aggressive warning sign | Primal Survivor: Extreme African Safari,2023-09-09,63902,968,41,Sep
171,"In rare footage, humpback whales attempt to disrupt a killer whale hunt in Antarctica",2023-09-07,2480601,8855,580,Sep
172,*N Sync vs Backstreet Boys | The Greatest Rivalries of the 90's (Full Episode) | Rewind the 90's,2023-09-06,12885,283,20,Sep
173,The secrets to year-round homesteading | Farm Dreams,2023-09-05,24971,695,21,Sep
174,Everyone say hi to Beans the polar bear! 🐻‍❄️🥹,2023-09-04,48963,1708,24,Sep
175,The South Tower (Full Episode) | 9/11 One Day in America,2023-09-03,10805922,103613,7941,Sep
176,Scientists stumble upon a 12-foot long male tiger shark | Sharks of the Bermuda Triangle,2023-09-02,59189,966,35,Sep
177,The Mission | Official Trailer | National Geographic Documentary Films,2023-08-31,368671,1360,492,Aug
178,Rob Lowe Breaks Down Street Fashion from the 80's (Full Episode) | The 80's: Top Ten,2023-08-31,22773,564,32,Aug
179,Bobi Wine performs live in Central Park | National Geographic,2023-08-29,0,1,0,Aug
180,Bear Grylls shows Bradley Cooper how to cross a ravine | Running Wild with Bear Grylls,2023-08-29,63947,813,80,Aug
181,You just can't keep a clever bird away from a tasty treat! #cockatoos,2023-08-28,46989,1788,27,Aug
182,Desert Nomads (Full Episode) | Primal Survivor: Extreme African Safari,2023-08-27,25268,512,36,Aug
183,Investigating Shark Attacks (Full Episode) | Jaws Vs. Boats,2023-08-24,85854,1147,92,Aug
184,The Value of Rooftop Farming for the Community | Farm Dreams,2023-08-22,25240,794,41,Aug
185,Sharks. Are. Awesome. #sharkfest #shorts,2023-08-21,60948,1987,27,Aug
186,Cynthia Erivo climbs out of a cave | Running Wild with Bear Grylls,2023-08-19,24352,505,16,Aug
187,Finding the World's Biggest Hammerhead Shark (Full Episode) | World's Biggest Hammerhead,2023-08-17,307404,3147,148,Aug
188,Wading for Change | Short Film Showcase | National Geographic,2023-08-16,23724,691,30,Aug
189,Paid content for Finish.💧 Protecting our rivers.,2023-08-15,46394,1530,33,Aug
190,Sharing Nkashi: Race for the Okavango with people of the Okavango Delta | National Geographic,2023-08-15,13334,453,19,Aug
191,Passing atmospheric levels of cool 🧑‍🚀🌏 #womeninstem #space,2023-08-14,46975,1109,35,Aug
192,It Takes a Village (Full Episode) | First Alaskans,2023-08-13,463325,4264,79,Aug
193,Benedict Cumberbatch solo rappels down a cliff | Running Wild with Bear Grylls,2023-08-12,80632,1723,82,Aug
194,"Adventurers Jim & Tori Baird on their son’s FOXG1 diagnosis, life in the wild | National Geographic",2023-08-11,21829,610,39,Aug
195,How Baby Sharks Survive in a Dangerous World (Full Episode) | Baby Sharks,2023-08-10,172157,2292,111,Aug
196,Finding Michigan’s Wild Side: A Journey through the Upper Peninsula | National Geographic,2023-08-09,247690,1153,57,Aug
197,Using carbon rich kelp to fertilize the farm | Farm Dreams,2023-08-08,23090,635,38,Aug
198,Could this be the oldest known human burial? #archaeology,2023-08-07,62181,1851,45,Aug
199,Jungle Manhunt: Tracking the Cocaine Kingpin (Full Episode) | Drug Lords: The Takedown,2023-08-06,696179,4152,155,Aug
200,Bradley Cooper attempts to cross a snowy ravine on his own | Running Wild with Bear Grylls,2023-08-05,68160,1164,57,Aug
201,Natalie Portman Takes on the Escalante Desert (Full Episode) | Running Wild with Bear Grylls,2023-08-03,293736,5681,306,Aug
202,Paid Content for Travel Texas. Follow Nat Geo Photographer Dina Litovsky as she explores Fort Worth.,2023-08-02,24979,2085,38,Aug
203,Oppenheimer vs. Heisenberg: Race to the Atomic Bomb (Full Episode) | American Genius,2023-08-01,230137,1872,93,Aug
204,Creating a Food Forest | Farm Dreams,2023-07-31,28508,712,23,Jul
205,Experiencing the currents of the coral reef | Never Say Never with Jeff Jenkins,2023-07-29,33366,835,34,Jul
206,UFO Sightings at Nuclear Bases (Full Episode) | UFOs: Investigating the Unknown,2023-07-28,653998,7832,668,Jul
207,Bobi Wine performs live in Central Park | National Geographic,2023-07-27,151303,2227,298,Jul
208,Fortress of the Knights Templar (Full Episode) | Lost Cities with Albert Lin,2023-07-27,692150,10009,297,Jul
209,Belonging | Short Film Showcase | National Geographic,2023-07-26,29156,767,29,Jul
210,Official Trailer | Animals Up Close with Bertie Gregory | Disney+,2023-07-25,76074,993,33,Jul
211,Rappelling down a cliff for the first time | Never Say Never with Jeff Jenkins,2023-07-25,12585,432,47,Jul
212,This grandma bear is an absolute legend 🐻 #grizzly,2023-07-24,31235,1130,43,Jul
213,Heavy is the Crown (Full Episode) | Wicked Tuna,2023-07-23,162542,1155,26,Jul
214,Exploring the danger & beauty of an ice cave for the first time | Never Say Never with Jeff Jenkins,2023-07-22,31955,1075,52,Jul
215,Paid Content for Travel Texas. See Austin through the lens of Nat Geo Photographer Kiliii Yuyan.,2023-07-21,23211,600,6,Jul
216,The Lethal Reality of Gun Trafficking (Full Episode Deep Dive) | Trafficked with Mariana van Zeller,2023-07-20,133641,2581,191,Jul
217,"Officer dismantles a car and discovers over $275,000 worth of hidden drugs | To Catch a Smuggler",2023-07-18,358130,2961,153,Jul
218,Bobi Wine: The People’s President | Official Trailer | National Geographic Documentary Films,2023-07-17,225367,2668,256,Jul
219,Paid content for The Maine Office of Tourism. The sounds of Maine are a ✨ vibe ✨,2023-07-17,21969,1213,20,Jul
220,Us and Them (Full Episode) | The Story of Us with Morgan Freeman,2023-07-16,495202,7853,373,Jul
221,Why more White Sharks are pushing north into Canadian waters | Shark Below Zero,2023-07-15,110810,1583,85,Jul
222,Cocaine Crackdown (Full Episode Highlights) | To Catch a Smuggler,2023-07-13,682097,5668,220,Jul
223,Debunking 3 myths about air pollution | Nat Geo Explores,2023-07-12,26283,779,74,Jul
224,Paid Content for The Maine Office of Tourism. Summers in Maine☀️,2023-07-11,25077,947,24,Jul
225,Trapped in the icy waters of the Northwest Passage | Podcast | Overheard at National Geographic,2023-07-11,21481,417,12,Jul
226,Exploring New Zealand (Full Episode) | Never Say Never with Jeff Jenkins,2023-07-10,16308,552,59,Jul
227,Collecting Crab Pots | Alaska: The Next Generation,2023-07-08,36795,852,29,Jul
228,Paid Content for The Maine Office of Tourism. Life in Maine 🦞,2023-07-06,38582,1132,27,Jul
229,Florence Pugh Takes on Volcanic Rainforests (Full Episode) | Running Wild with Bear Grylls,2023-07-06,557463,13402,271,Jul
230,Passenger with suspicious packages questioned in Fort Lauderdale | To Catch a Smuggler,2023-07-04,94090,1035,97,Jul
231,Nat Geo Explorers discuss the importance of inclusive communities | Pride Month Roundtable | Nat Geo,2023-07-03,14888,356,102,Jul
232,Australia's Deadliest Coast (Full Episode) | When Sharks Attack: There Will Be Blood,2023-07-02,384618,3921,223,Jul
233,"Undercover agent busts a $36,000 meth deal | To Catch a Smuggler",2023-07-01,117051,1308,89,Jul
234,National Geographic digs into the history behind Indiana Jones and the Dial of Destiny | Nat Geo,2023-06-30,43155,860,48,Jun
235,Servants of the Serpent Goddess (Full Episode) | Kingdom of the Mummies,2023-06-29,1296460,10588,434,Jun
236,Tradition in the Old West: How Past and Present Co-Exist in Fort Worth | National Geographic,2023-06-27,594913,544,18,Jun
237,Building a Sled | Alaska: The Next Generation,2023-06-27,22104,554,25,Jun
238,Killer Ketamine (Full Episode) | To Catch a Smuggler,2023-06-25,894540,8390,402,Jun
239,Life in Alaska: Keeping an eye out for salmon and bears | Alaska: The Next Generation,2023-06-24,42933,877,37,Jun
240,"The Survival of the Kangaroo: Bushfire, Drought, and Heat Waves (Full Episode) | The Kangaroo King",2023-06-22,138457,1577,71,Jun
241,"From Summit to Subterranean: Chasing Adventure in San Antonio, Texas | National Geographic",2023-06-20,596026,562,12,Jun
242,Moose Hunting Season | Alaska: The Next Generation,2023-06-20,41663,711,22,Jun
