,Title,Published_date,Views,Likes,Comments,Month
2326,Watch: Curious Puffin Befriends a Tourist | National Geographic,2017-07-21,602289,11977,541,Jul
2327,Here's How Much Plastic Trash Is Littering the Earth | National Geographic,2017-07-20,398690,3734,349,Jul
2328,Watch: Fire Ants Create Towers With Their Own Bodies | National Geographic,2017-07-20,44336,651,60,Jul
2329,China’s Extreme Flooding: See Dramatic Scenes of Rescue and Ruin | National Geographic,2017-07-19,1526712,4921,341,Jul
2330,Watch: 'Slime Eels' Explode on Highway After Bizarre Traffic Accident | National Geographic,2017-07-18,201337,1424,197,Jul
2331,Watch: Lion Cub Rescued After Falling Down 80-Foot Well | National Geographic,2017-07-18,45122,1112,102,Jul
2332,"See Hummingbirds Fly, Shake, Drink in Amazing Slow Motion | National Geographic",2017-07-18,746740,12723,500,Jul
2333,These Sea Spiders 'Breathe' Through Their Legs | National Geographic,2017-07-17,165816,2308,200,Jul
2334,Watch: Elephant Rescued After Being Swept 10 Miles Out to Sea | National Geographic,2017-07-17,36797,768,62,Jul
2335,"Manta Ray 'Brunch': Like Us, They're Social Eaters | National Geographic",2017-07-17,43900,1294,75,Jul
2336,See the Huge Crack in West Antarctica Before Iceberg Broke Off | National Geographic,2017-07-17,244039,3041,1024,Jul
2337,See What Canyon Life Is Like for a Navajo Pageant Winner | Short Film Showcase,2017-07-16,1023681,26616,2023,Jul
2338,A Camera Filmed a Tree for a Year—Here's What It Saw | National Geographic,2017-07-15,863674,7782,370,Jul
2339,Pro Boxer Inspires Girls to Fight for Their Futures | National Geographic,2017-07-15,20872,656,55,Jul
2340,Watch: Bear Charges Car | National Geographic,2017-07-14,212429,1788,241,Jul
2341,Watch a Male Tarantula Risk Death for Sex | National Geographic,2017-07-14,261543,2743,351,Jul
2342,Scientists Fly a Drone to Collect Whale Snot | National Geographic,2017-07-13,49522,974,42,Jul
2343,"These Weird, Wondrous Animals Live Under Greenland's Ice Caps | National Geographic",2017-07-12,57123,1628,113,Jul
2344,Watch: Rescuers Free Seal Trapped By Fishing Line | National Geographic,2017-07-11,21100,742,36,Jul
2345,Bizarre 'Legless' Lizard Has T-Rex Arms | National Geographic,2017-07-11,340795,3370,341,Jul
2346,Watch: Orcas Hunt a Whale in Rare Video | National Geographic,2017-07-10,478948,2904,258,Jul
2347,Lost Baby Wildebeest Mistakes Car for Mom | National Geographic,2017-07-10,36856,1005,86,Jul
2348,The Illegal and Secretive World of Chameleon Ranching | National Geographic,2017-07-10,572548,9589,491,Jul
2349,"Bodies in Urns Found in 1,000-Year-Old Cemetery | National Geographic",2017-07-09,46644,892,55,Jul
2350,Why Is This Field Full of Huge Presidents? | Short Film Showcase,2017-07-09,143324,3059,345,Jul
2351,She's a Big Mountain Skier on a Mission to Keep Others Safe | National Geographic,2017-07-08,22111,437,39,Jul
2352,A Walrus Pup’s Swimming Lesson | Animal 24,2017-07-07,257641,2100,104,Jul
2353,See a Sea Turtle Devour a Jellyfish Like Spaghetti | National Geographic,2017-07-07,50285641,219170,17324,Jul
2354,Remarkable Time-Lapse: Watch Caterpillars Transform Into Butterflies | National Geographic,2017-07-07,161249,1725,144,Jul
2355,"Revealing the Face of a 1,600-Year-Old Mummy | National Geographic",2017-07-06,4451421,46124,1411,Jul
2356,Scientists Rush to Save This Melting Piece of Earth's History | National Geographic,2017-07-06,48313,1018,73,Jul
2357,Captivating Storm Footage From Nat Geo Storm Chasers | National Geographic,2017-07-06,53162,741,22,Jul
2358,"Sun-Worshippers Built This Massive Altar 3,000 Years Ago | National Geographic",2017-07-05,56669,960,85,Jul
2359,Beautiful and Elusive: This Bird Is Losing Its Home | National Geographic,2017-07-05,30123,828,24,Jul
2360,Adorable Bear Cubs Hitch a Ride on Mom's Back | National Geographic,2017-07-04,65645,1598,64,Jul
2361,The Glass Frog: Ultimate Ninja Dad | Animal 24,2017-07-03,727713,10770,592,Jul
2362,Plant-Eating Sharks Actually Exist? | National Geographic,2017-07-03,118560,2010,237,Jul
2363,See Why This Vibrant Fish Is Excellent at Hide-and-Seek | National Geographic,2017-07-03,43152,808,28,Jul
2364,Civil War Forced Them to Run Where Water Is Scarce | National Geographic,2017-07-02,11702,235,21,Jul
2365,The Long Road Home - Trailer | National Geographic,2017-07-01,124856,592,54,Jul
2366,See Why Sochi Is One of Russia's Best Vacation Spots | National Geographic,2017-07-01,126687,1568,158,Jul
2367,A Smarter Path | Chasing Genius | National Geographic,2017-06-30,32799,755,109,Jun
2368,Cockatoos Become Drummers to Pick Up Chicks | National Geographic,2017-06-30,51199,1249,73,Jun
2369,Young Hippo Tries to Play With Crocodile | National Geographic,2017-06-30,24220463,112525,4723,Jun
2370,How 2 Million Pounds of Wildebeest Carcasses Help the Serengeti | National Geographic,2017-06-29,48925,635,31,Jun
2371,How Growing Trees Helps Fight Poverty in Cameroon | National Geographic,2017-06-28,24805,1108,49,Jun
2372,Rare Zebra Gets Second Chance Thanks to Rescuers | National Geographic,2017-06-27,45897,762,47,Jun
2373,Watch: Deadly Tsunami Hits Greenland | National Geographic,2017-06-27,958613,1371,115,Jun
2374,He Hears Music in the Quietest Place on Earth—Can You? | Short Film Showcase,2017-06-27,61565,2252,114,Jun
2375,Listen: Cougars Are Terrified of Human Chatter | National Geographic,2017-06-26,181306,2776,592,Jun
2376,Watch: Man Removes 'World's Deadliest Snake' from Home | National Geographic,2017-06-26,979745,3366,555,Jun
2377,Dog Meat Sales Continue at Chinese Festival Despite Expected Ban (GRAPHIC) | National Geographic,2017-06-25,123216,954,870,Jun
2378,See Inside Russia's Famed Mariinsky Ballet Theatre | National Geographic,2017-06-25,27007,452,21,Jun
2379,"Why Four Cowboys Rode Wild Horses 3,000 Miles Across America (Part 3) | Nat Geo Live",2017-06-24,37531,664,33,Jun
2380,Watch: Elephants Rescue Their Baby From a Pool | National Geographic,2017-06-23,70276,1689,96,Jun
2381,"Like Spider-man, This Spider Shoots Silk to Attack Its Prey | National Geographic",2017-06-23,129622,1019,75,Jun
2382,Experience a Historical Russian Bathhouse | National Geographic,2017-06-23,29379,492,41,Jun
2383,Spouts of Hope | Chasing Genius | National Geographic,2017-06-22,23823,899,60,Jun
2384,Life in Flight | Chasing Genius | National Geographic,2017-06-21,39075,1111,55,Jun
2385,This Russian Palace is Home to 150 Fountains | National Geographic,2017-06-21,36200,759,35,Jun
2386,Coal Mining's Environmental Impact | From The Ashes,2017-06-20,341187,2746,416,Jun
2387,Rare Video: Cougar Pounces on Deer | National Geographic,2017-06-20,103008,1250,81,Jun
2388,My Water Is Not Safe to Drink | From The Ashes,2017-06-20,56094,974,152,Jun
2389,A Mysterious Fungus Is Killing Rattlesnakes | National Geographic,2017-06-20,100575,1433,266,Jun
2390,Lions 360° | National Geographic,2017-06-19,32052887,186073,1972,Jun
2391,"Stranded Beluga Whale Rescued, Flown Back to Sea | National Geographic",2017-06-19,18860,615,37,Jun
2392,Adorable Raccoon Babies Make Human Friend | National Geographic,2017-06-19,2481071,32621,1448,Jun
2393,These Two Young Bushmen Hope for a New Life in the Modern World | Short Film Showcase,2017-06-18,17654,460,62,Jun
2394,The Letter That Led to the Atomic Bomb | Genius,2017-06-18,4080799,52828,1200,Jun
2395,"Explorers Festival, Saturday June 17 | National Geographic",2017-06-17,28064,538,6,Jun
2396,"Why Four Cowboys Rode Wild Horses 3,000 Miles Across America (Part 2) | Nat Geo Live",2017-06-17,68017,873,62,Jun
2397,"Explorers Festival, Friday June 16 | National Geographic",2017-06-16,23542,367,12,Jun
2398,Taking a Jet Pack Flight | Explorer,2017-06-16,34466,897,60,Jun
2399,Watch: Spider Battles Scorpion Twice Its Size | National Geographic,2017-06-16,102570,1062,120,Jun
2400,"Usually Enemies, Bald Eagles Adopt Red-Tailed Hawk Chick | National Geographic",2017-06-16,73732,1308,91,Jun
2401,"Explorers Festival, Thursday June 15 | National Geographic",2017-06-15,32593,596,12,Jun
2402,These Slimy Fish Lips Are Made for Eating Coral | National Geographic,2017-06-15,33524,364,18,Jun
2403,"Attacked for Being Albino, Kids Receive Prosthetic Limbs and New Hope | National Geographic",2017-06-15,50477,1289,230,Jun
2404,Meet a Beautiful Beetle That Loves to Eat Poop | National Geographic,2017-06-15,186611,2942,260,Jun
2405,Here's What You Missed on Episode 8 | Genius,2017-06-14,404094,2507,54,Jun
2406,Clingy Orangutan Gets Too Close For Comfort | National Geographic,2017-06-13,250875,1262,121,Jun
2407,Watch: Owl 'Swims' for Its Life in Rare Video | National Geographic,2017-06-13,1060163,15841,746,Jun
2408,Defending Marine Wildlife | Explorer,2017-06-13,37012,716,50,Jun
2409,This Deep-Sea Lizard Fish Will Give You Nightmares | National Geographic,2017-06-13,132652,1671,131,Jun
2410,This Sea Creature Does an Awesome Hermit Crab Impression | National Geographic,2017-06-12,488125,2823,109,Jun
2411,Wasp Paralyzes Spider—But the Food Fight Isn't Over | National Geographic,2017-06-12,58302,917,123,Jun
2412,Escape from ISIS Control | Hell on Earth,2017-06-11,46425,783,70,Jun
2413,Inside the Extraordinary Mind of a Pinball World Champion | Short Film Showcase,2017-06-11,218804,3328,295,Jun
2414,The Uncertainty Principle | Genius,2017-06-11,4139221,74056,2573,Jun
2415,Photo Walk in Napa Valley | National Geographic,2017-06-10,32133,510,44,Jun
2416,A Napa Valley Nature Walk | National Geographic,2017-06-10,27871,525,29,Jun
2417,"Why Four Cowboys Rode Wild Horses 3,000 Miles Across America (Part 1) | Nat Geo Live",2017-06-10,190957,2148,126,Jun
2418,"For Seagulls, Mating Is a Balancing Act | National Geographic",2017-06-09,67104,498,61,Jun
2419,Can You Tell a Monkey's Mood From Its Face? | National Geographic,2017-06-09,34426,379,12,Jun
2420,Ravens Like You Better When You're Being Fair | National Geographic,2017-06-08,62120,1598,111,Jun
2421,See How They Track Polar Bears in Russia | National Geographic,2017-06-08,36048,414,33,Jun
2422,Take Me Back | 10 Days of Genius | National Geographic,2017-06-08,576932,7181,300,Jun
2423,Are These the Oldest Modern Human Fossils Ever Found? | National Geographic,2017-06-08,70385,920,190,Jun
2424,He Risked Death as First American to Explore Africa's Deepest Parts | National Geographic,2017-06-07,46875,898,165,Jun
2425,Stick with Me | 10 Days of Genius | National Geographic,2017-06-07,89953,903,28,Jun
2426,Here's What You Missed on Episode 7 | Genius,2017-06-07,229196,1423,39,Jun
2427,"Siberian Tiger Rescued From City Streets, Returned to Wild | National Geographic",2017-06-06,335013,4098,337,Jun
2428,Gravity vs. Love | 10 Days of Genius | National Geographic,2017-06-06,131957,1183,48,Jun
2429,Giant Spider Devours Cricket On Man's Hand | National Geographic,2017-06-06,122969,1418,196,Jun
2430,See First Video of Most Dangerous Rope-Free Climb Ever (Alex Honnold) | National Geographic,2017-06-06,966888,3745,449,Jun
2431,"This ""Walking"" Fish Has Scientists Stumped | National Geographic",2017-06-05,1705594,9706,1179,Jun
2432,Curiosity | 10 Days of Genius | National Geographic,2017-06-05,206780,4193,78,Jun
2433,Beneath Iran's Dusty Desert Lie Ancient Water Tunnels Still in Use | National Geographic,2017-06-05,332047,3400,261,Jun
2434,Female Snipers Fighting ISIS | Hell on Earth,2017-06-04,555413,5700,477,Jun
2435,These Are the Mental Health Pioneers | Explorer,2017-06-04,14164,337,40,Jun
2436,Falling in Love | 10 Days of Genius | National Geographic,2017-06-04,110000,1233,99,Jun
2437,Einstein the Mad Scientist | Genius,2017-06-04,10571961,158301,3983,Jun
2438,Close Call: Great White Shark Collides With Diving Cage | National Geographic,2017-06-03,75567,923,121,Jun
2439,When Pigs Fly | 10 Days of Genius | National Geographic,2017-06-03,80200,808,91,Jun
2440,See Why These Cute Little Goats Are the Latest Yoga Craze | Short Film Showcase,2017-06-02,56510,911,44,Jun
2441,Watch This Tarantula Crawl Out of Its Own Skeleton | National Geographic,2017-06-02,163306,1873,202,Jun
2442,Movement | 10 Days of Genius | National Geographic,2017-06-02,81437,710,26,Jun
2443,Renewable Energy For the People | From the Ashes,2017-06-02,19103,543,47,Jun
2444,Where No Grid Has Gone Before | Breakthrough,2017-06-01,39212,829,74,Jun
2445,Relativity Ramen | 10 Days of Genius | National Geographic,2017-06-01,188567,2284,81,Jun
2446,Managing the New York City Power Grid | Breakthrough,2017-06-01,33119,737,63,Jun
2447,Here's What You Missed on Episode 6 | Genius,2017-05-31,127460,995,78,May
2448,The Mirror | 10 Days of Genius | National Geographic,2017-05-31,194581,1885,50,May
2449,Ruins—and Fierce Weaponry—From Bloody Roman Battle Discovered | National Geographic,2017-05-31,25209,495,11,May
2450,Watch: Killer Whales Charge Blue Whale (Rare Drone Footage) | National Geographic,2017-05-30,3589509,19364,1942,May
2451,The Instrument | 10 Days of Genius | National Geographic,2017-05-30,169449,2649,57,May
2452,Watch an Octopus Pursue Crab in Mesmerizing Chase | National Geographic,2017-05-30,127337,1596,132,May
2453,Orangutans Nurse Their Young For Much Longer Than You'd Think | National Geographic,2017-05-29,18958,365,19,May
2454,WATCH: Two of World's Deadliest Snakes Battle on Golf Course | National Geographic,2017-05-29,271115,2486,246,May
2455,This Empowering Memorial Honors the Legacies of Military Women | National Geographic,2017-05-28,13426,336,80,May
2456,Tattoo Parlors Are Illegal in Cuba. This Guy Started One Anyway | Short Film Showcase,2017-05-28,27854,494,25,May
2457,My Life As an Adventure Filmmaker and Photographer  (Part 3) | Nat Geo Live,2017-05-27,37384,662,25,May
2458,Shelter From a Snowstorm | Primal Survivor,2017-05-27,194720,1525,48,May
2459,Cooking With Cannabis | Assignment Explorer,2017-05-26,38797,821,89,May
2460,First-Ever Look at the Intricate Way Ladybugs Fold Their Wings | National Geographic,2017-05-26,366861,3763,287,May
2461,The Future of Weather Forecasting | Breakthrough,2017-05-25,30402,464,32,May
2462,Why Science Says It's Good for Kids to Lie | National Geographic,2017-05-25,35940,560,97,May
2463,Elevator Thought Experiment | Genius,2017-05-25,2483700,48628,1103,May
2464,"See What It Takes to Move a 1,100-Ton Stone Tomb | National Geographic",2017-05-24,53626,751,79,May
2465,Here's What You Missed on Episode 5 | Genius,2017-05-24,214761,1684,80,May
2466,Endangered Baby Bird Rescued and Returned to the Sea | National Geographic,2017-05-23,24626,656,34,May
2467,Watch Rare Wild Sheep Run Up Steep Mountainside With Ease | National Geographic,2017-05-22,48625,770,62,May
2468,"A Day in the Life of 'The Dogist,' Pet Photographer Extraordinaire | Short Film Showcase",2017-05-21,135405,5308,127,May
2469,Inside a Civil War Most People Have Never Heard of | National Geographic,2017-05-21,431253,6292,969,May
2470,Einstein's Escape from Hitler | Genius,2017-05-20,4343982,63381,2173,May
2471,How to Fix a Leaky Wooden Boat | Primal Survivor,2017-05-20,130464,1373,70,May
2472,My Life As an Adventure Filmmaker and Photographer (Part 2) | Nat Geo Live,2017-05-20,27592,494,18,May
2473,Watch: Clever Raven Outsmarts a Trash Can | National Geographic,2017-05-19,144595,2100,238,May
2474,"""Cyclops"" Goat Born in India | National Geographic",2017-05-19,3779601,30982,7512,May
2475,Mystery Behind Narwhals' Iconic Tusks Revealed | National Geographic,2017-05-19,94174,1199,58,May
2476,The Two Einsteins: Behind the Scenes | Genius,2017-05-19,209900,2950,106,May
2477,Are Drones a Threat? | Breakthrough,2017-05-18,25015,401,75,May
2478,'T. rex' Ant Found Alive for First Time (Rare Species) | National Geographic,2017-05-18,300745,2753,202,May
2479,38 Million Pieces of Plastic Trash Cover This Remote Island | National Geographic,2017-05-17,77539,893,141,May
2480,How Do You Get a Camera to Stick to a Manta Ray? Peanut Butter | National Geographic,2017-05-17,35460,698,45,May
2481,Here's What You Missed on Episode 4 | Genius,2017-05-17,219929,1839,59,May
2482,360° Thought Experiment Trailer | Genius,2017-05-16,157306,1719,44,May
2483,Watch: Baby Kangaroo Rescued After His Mother Dies | National Geographic,2017-05-16,338305,1614,76,May
2484,"Once, This Island Had Just One Tree—Look at It Now | National Geographic",2017-05-16,974364,14062,745,May
2485,Watch: Cape Seal Collides With Kayaker | National Geographic,2017-05-15,37850,641,33,May
2486,Newly Unveiled Dinosaur Fossil is Best Preserved Of Its Kind | National Geographic,2017-05-15,1830570,8325,1143,May
2487,Watch: Buffalo Herd Charges Hyenas to Defend Calf | National Geographic,2017-05-15,35570,648,46,May
2488,This Taxi Driver Has an Amazing Life Story You'll Want to Hear | Short Film Showcase,2017-05-14,745372,14863,1019,May
2489,Looking at Nat Turner's Legacy | Explorer,2017-05-14,210279,2442,689,May
2490,Love and Science | Genius,2017-05-14,538533,6647,211,May
2491,My Life As an Adventure Filmmaker and Photographer (Part 1) | Nat Geo Live,2017-05-13,32810,607,20,May
2492,How to Make Your Own Fishing Line | Primal Survivor,2017-05-13,229714,2388,62,May
2493,This Rock Climbing Kid Has a Hidden Strength: His Super Mom | Short Film Showcase,2017-05-13,85992,1644,113,May
2494,Watch: Eel Swallows a Pufferfish Whole | National Geographic,2017-05-12,645285,2984,358,May
2495,"This Vibrant Fish Looks Crazy, But It’s Pretty Lazy | National Geographic",2017-05-12,32048,621,31,May
2496,An In-Depth Interview with Emily Watson From 'Genius' | Genius,2017-05-12,36459,250,16,May
2497,The Challenges with Cancer Trials | Breakthrough,2017-05-11,11153,224,3,May
2498,Finding a Cancer Killer | Breakthrough,2017-05-11,42055,981,84,May
2499,How Would You Envision a Space Colony? | Short Film Showcase,2017-05-10,295914,5249,590,May
2500,How I Got Arrested Working to Save Elephants | National Geographic,2017-05-10,20039,701,42,May
2501,Here's What You Missed on Episode 3 | Genius,2017-05-10,140905,1146,40,May
2502,Watch a Gorgeous Time-Lapse of Monkeys in the Ethiopian Highlands | National Geographic,2017-05-09,42492,683,22,May
2503,Ferocious Fight: Male Cuttlefish Battle Over Mate (Never Before Seen) | National Geographic,2017-05-09,45372,678,48,May
2504,"Shocking Footage of Baby Elephant Tossed Around by Adult, Explained | National Geographic",2017-05-09,2017640,12664,1986,May
2505,Under Sea Ice in Antarctica | Explorer,2017-05-08,28110,550,37,May
2506,How One Orphaned Gorilla Inspired Her to Save Hundreds More | National Geographic,2017-05-08,116955,1980,109,May
2507,"The Protectors, Walk in the Ranger's Shoes (Full VR Documentary) | National Geographic",2017-05-08,255239,1288,67,May
2508,Discover This Island's Hidden Treasures in a Stunning Time-Lapse | Short Film Showcase,2017-05-08,41647,1278,61,May
2509,She Fears Her Tribe's Story Will Be Forgotten | Short Film Showcase,2017-05-07,59794,1983,197,May
2510,This is the World’s Most Expensive Spice | National Geographic,2017-05-07,2504186,26440,1487,May
2511,Finding Water in the Desert | Primal Survivor,2017-05-06,1031293,7806,579,May
2512,What Does 'Genius' Mean? | Genius,2017-05-05,1040018,19418,572,May
2513,Jeff Goldblum Joins Explorer | Explorer,2017-05-05,13067,368,32,May
2514,Watch: Great White Shark Feasts on Dead Whale | National Geographic,2017-05-05,319991,2263,132,May
2515,"For Jumping Spiders, Choosing the Wrong Mate Turns Deadly | National Geographic",2017-05-04,71651,1199,107,May
2516,Molecules Bumping Into One Another | Genius,2017-05-04,613061,8975,221,May
2517,LA 92 (Full Documentary) | National Geographic,2017-05-04,3039932,61230,10606,May
2518,Crashing Into Saturn: This Cassini Mission Is the Most Epic Yet | Short Film Showcase,2017-05-04,4735201,86621,7025,May
2519,Here's What You Missed From Episode 2 | Genius,2017-05-03,284026,2040,83,May
2520,Made in Space: 3-D Printing Could Change the Way Astronauts Travel | Short Film Showcase,2017-05-03,77131,2219,126,May
2521,See Inside a 124-Mile-Long Cave | National Geographic,2017-05-02,47830,812,37,May
2522,Cheetahs vs. Wild Dogs: Who Will Win This Food Fight? | National Geographic,2017-05-02,207934,1049,122,May
2523,See One of the World's Rarest Big Cats | National Geographic,2017-05-01,62190,1521,74,May
2524,POV: See Antarctica From the Back of a Whale | National Geographic,2017-05-01,61056,1286,57,May
2525,Cows for Cash | Explorer,2017-05-01,19134,268,34,May
2526,Watch: Monkeys Forced to Perform in Circus on Nature Reserve | National Geographic,2017-05-01,63563,467,96,May
2527,Mozart Helps Me Think | Genius,2017-04-30,1805342,29246,831,Apr
2528,Making Incredible Artwork Out of Cow Dung | National Geographic,2017-04-30,33742,859,81,Apr
2529,"He Grew Up on the Streets, Now He's Making Them a Better Place | Short Film Showcase",2017-04-30,40616,1582,122,Apr
2530,What is Farming Heroin? | Explorer,2017-04-30,103345,960,86,Apr
2531,More Questions Than Answers | LA 92,2017-04-29,28636,293,59,Apr
2532,The Isolation of Addiction | Breakthrough,2017-04-29,23731,475,43,Apr
2533,Soar Above a Fairy-Tale World in This 2-Minute Drone Video | Short Film Showcase,2017-04-29,56822,2772,110,Apr
2534,How Bicycles Changed Women's Lives | Origins: The Journey of Humankind,2017-04-28,68124,1418,112,Apr
2535,Why Does This Octopus Carry Shells Around? | National Geographic,2017-04-28,58930,1183,69,Apr
2536,A 750-Year-Old Secret: See How Soy Sauce Is Still Made Today | Short Film Showcase,2017-04-28,2342295,25954,1285,Apr
2537,The Power of Transportation | Origins: The Journey of Humankind,2017-04-27,103310,1275,48,Apr
2538,Here's What You Missed From Episode 1 | Genius,2017-04-27,422561,3569,101,Apr
2539,This Small Satellite Could Predict the Next Hurricane | Short Film Showcase,2017-04-26,93197,2291,94,Apr
2540,See Blue Whales Lunge For Dinner in Beautiful Drone Footage | National Geographic,2017-04-25,15662712,113882,4585,Apr
2541,Would You Stay if Your Home Became a Desert? | National Geographic,2017-04-25,49746,713,58,Apr
2542,"These ""Naked Rats"" Can Survive 18 Minutes Without Oxygen | National Geographic",2017-04-25,39708,697,76,Apr
2543,The Fascinating Lives of Bleeding Heart Monkeys (Part 3) | Nat Geo Live,2017-04-25,17700,251,18,Apr
2544,Around the World on Sun Power | Origins: The Journey of Humankind,2017-04-24,49315,1185,71,Apr
2545,This Captive-Born Panda Just Made a Breakthrough in the Wild | National Geographic,2017-04-24,32696,721,45,Apr
2546,"50 Years Ago, This Was a Wasteland. He Changed Everything | Short Film Showcase",2017-04-24,5492268,168517,5781,Apr
2547,A Dangerous Night In L.A. | LA 92,2017-04-23,264153,2264,298,Apr
2548,"3,500-Year-Old Egyptian Tomb Explored: What Was Inside? | National Geographic",2017-04-23,144268,1248,102,Apr
2549,"Two Champions, One Family: Hear Their Inspiring Story | Short Film Showcase",2017-04-23,15656,431,30,Apr
2550,The Mobile Home Economics | Explorer,2017-04-23,71218,751,70,Apr
2551,Our Drive to Boldly Go | Origins: The Journey of Humankind,2017-04-22,34023,697,22,Apr
2552,Spend a Relaxing Hour in Yellowstone’s Beautiful Landscapes | National Geographic,2017-04-22,1591862,7840,244,Apr
2553,How To Survive Quicksand | Primal Survivor,2017-04-22,2798667,20435,1129,Apr
2554,The Japanese Government Wants You to Date | Explorer,2017-04-21,265990,2925,635,Apr
2555,Riding Alongside a Light Beam | Genius,2017-04-21,561425,6206,376,Apr
2556,Cute Octopus Latches Onto Diver's Arm | National Geographic,2017-04-21,148195,3770,308,Apr
2557,Behind the Scenes with Geoffrey Rush | Genius,2017-04-21,82196,1149,61,Apr
2558,"Weird, Deep-Sea 'Worm' As Long As an Arm | National Geographic",2017-04-20,523709,4184,551,Apr
2559,The Decline in Drug Research | Breakthrough,2017-04-20,17854,446,30,Apr
2560,"If We Colonize the Moon, This Company Wants to Ship Our Stuff | Short Film Showcase",2017-04-19,78702,1382,141,Apr
2561,Robot vs. Volcano: “Sometimes It’s Just Fun to Blow Stuff Up” (Exclusive) | National Geographic,2017-04-19,329403,1816,56,Apr
2562,Egg-Stealing Baboon Incurs Wrath of Geese | National Geographic,2017-04-18,53676,509,43,Apr
2563,Watch Squid Snatch Squid in Surprise Attack | National Geographic,2017-04-18,98677,1257,108,Apr
2564,The Fascinating Lives of Bleeding Heart Monkeys (Part 2) | Nat Geo Live,2017-04-18,32515,372,20,Apr
2565,Hell on Earth - Official Film Trailer | National Geographic,2017-04-17,185303,2328,331,Apr
2566,From the Ashes - Official Film Trailer | National Geographic,2017-04-17,54284,488,32,Apr
2567,"POV: If A Lion Bit You, Here's What You'd See | National Geographic",2017-04-17,76488,1435,114,Apr
2568,"Here, Cutting Down Millions of Trees is Actually a Good Thing | National Geographic",2017-04-17,433438,6008,724,Apr
2569,This Artist's Amazing Transformation Will Blow Your Mind | Short Film Showcase,2017-04-16,35723,2159,61,Apr
2570,See Why This Roller Skating Girl Squad Is the First of Its Kind | Short Film Showcase,2017-04-16,24594,603,85,Apr
2571,The Evolution of Shelter | Origins: The Journey of Humankind,2017-04-15,57092,904,56,Apr
2572,360° Giant Sequoias on a Changing Planet – Part 2 | National Geographic,2017-04-15,152495,1237,51,Apr
2573,A Dangerous Job in Afghanistan | Explorer,2017-04-15,32507,462,31,Apr
2574,Durian Fruit: A Stinky Jungle Treasure | Primal Survivor,2017-04-15,442027,2043,413,Apr
2575,Why Are Bunnies Associated With Easter? | National Geographic,2017-04-14,47164,870,121,Apr
2576,War-Torn Zoo's Last Surviving Animals Rescued in Mosul | National Geographic,2017-04-14,22385,717,55,Apr
2577,"""Paramedic"" Ants Save the Wounded in Termite Wars | National Geographic",2017-04-14,86914,1221,122,Apr
2578,TIL: These Birds Trick Others Into Raising Their Gigantic Kids | Today I Learned,2017-04-14,259530,2551,239,Apr
2579,Here's What Earthquakes Look Like From Inside the Earth | National Geographic,2017-04-13,140050,1844,124,Apr
