,Title,Published_date,Views,Likes,Comments,Month
1362,The Infinite Hotel Paradox - Jeff Dekofsky,2014-01-16,24355642,506875,38878,Jan
1363,Start a TED-Ed Club today!,2014-01-14,170291,1496,63,Jan
1364,The mystery of motion sickness - Rose Eveleth,2014-01-13,1540895,14714,1180,Jan
1365,How to build a fictional world - Kate Messner,2014-01-09,7492317,245103,6152,Jan
1366,How sugar affects the brain - Nicole Avena,2014-01-07,16325691,305097,6683,Jan
1367,How to fossilize...yourself - Phoebe A. Cohen,2014-01-06,938045,14348,951,Jan
1368,Should we eat bugs? - Emma Bryce,2014-01-02,3054214,28123,4768,Jan
1369,How do we smell? - Rose Eveleth,2013-12-19,1622071,12824,517,Dec
1370,"The popularity, plight and poop of penguins - Dyan deNapoli",2013-12-17,518457,6299,278,Dec
1371,The true story of 'true' - Gina Cooke,2013-12-16,442396,10360,302,Dec
1372,The death of the universe,2013-12-12,1314119,23639,1879,Dec
1373,A father-daughter dance ... in prison - Angela Patton,2013-12-11,6184,88,3,Dec
1374,Deep sea diving ... in a wheelchair - Sue Austin,2013-12-11,74193,385,33,Dec
1375,The beautiful nano details of our world - Gary Greenberg,2013-12-11,13085,123,3,Dec
1376,A child of the state - Lemn Sissay,2013-12-11,5554,98,7,Dec
1377,My glacier cave discoveries - Eddy Cartaya,2013-12-11,127130,742,19,Dec
1378,From DNA to Silly Putty: The diverse world of polymers - Jan Mattingly,2013-12-10,301902,2481,86,Dec
1379,How to sequence the human genome - Mark J. Kiel,2013-12-09,1423569,25009,479,Dec
1380,What makes us feel good about our work? - Dan Ariely,2013-12-06,76140,771,20,Dec
1381,Mysteries of vernacular: Odd - Jessica Oreck and Rachael Teel,2013-12-05,203823,1287,55,Dec
1382,Agile programming -- for your family - Bruce Feiler,2013-12-03,11056,130,6,Dec
1383,Could your language affect your ability to save money? - Keith Chen,2013-12-03,59694,560,56,Dec
1384,Learn to read Chinese ... with ease! - ShaoLan,2013-12-03,334178,9193,484,Dec
1385,Music and creativity in Ancient Greece - Tim Hansen,2013-12-03,666904,21626,260,Dec
1386,"The loathsome, lethal mosquito - Rose Eveleth",2013-12-02,12447981,44031,4802,Dec
1387,Mysteries of vernacular: Yankee - Jessica Oreck and Rachael Teel,2013-11-26,81255,808,40,Nov
1388,Making a TED-Ed Lesson: Visualizing big ideas,2013-11-25,226107,1988,51,Nov
1389,Mysteries of vernacular: Lady - Jessica Oreck and Rachael Teel,2013-11-21,127941,1363,53,Nov
1390,The chemistry of cookies - Stephanie Warren,2013-11-19,3481607,59642,1407,Nov
1391,The chemical reaction that feeds the world - Daniel D. Dulek,2013-11-18,685868,8047,364,Nov
1392,The five major world religions - John Bellaimey,2013-11-14,12241501,212595,38671,Nov
1393,Where does energy come from? - George Zaidan and Charles Morton,2013-11-12,401948,4806,179,Nov
1394,The operating system of life - George Zaidan and Charles Morton,2013-11-11,406041,6928,361,Nov
1395,Why is yawning contagious? - Claudia Aguirre,2013-11-07,2359102,20342,2379,Nov
1396,The fight for the right to vote in the United States - Nicki Beaman Griffin,2013-11-05,698829,3965,462,Nov
1397,The deadly irony of gunpowder - Eric Rosado,2013-11-04,3001105,42656,1886,Nov
1398,Mysteries of vernacular: Robot - Jessica Oreck and Rachael Teel,2013-10-31,109246,1082,45,Oct
1399,"Vampires: Folklore, fantasy and fact - Michael Molina",2013-10-29,3701824,71755,4438,Oct
1400,How we conquered the deadly smallpox virus - Simona Zompi,2013-10-28,8690060,91654,7517,Oct
1401,The strengths and weaknesses of acids and bases - George Zaidan and Charles Morton,2013-10-24,955240,10230,364,Oct
1402,Why does ice float in water? - George Zaidan and Charles Morton,2013-10-22,1729179,26937,1208,Oct
1403,Is time travel possible? - Colin Stuart,2013-10-21,3844192,54962,4548,Oct
1404,Mysteries of vernacular: Ukulele - Jessica Oreck and Rachael Teel,2013-10-18,77739,1010,50,Oct
1405,What is the shape of a molecule? - George Zaidan and Charles Morton,2013-10-17,310105,5284,125,Oct
1406,How atoms bond - George Zaidan and Charles Morton,2013-10-15,1017574,12031,351,Oct
1407,The uncertain location of electrons - George Zaidan and Charles Morton,2013-10-14,855086,12265,506,Oct
1408,Why don't oil and water mix? - John Pollard,2013-10-10,1200305,14782,1291,Oct
1409,The science of stage fright (and how to overcome it) - Mikael Cho,2013-10-08,1529260,25388,1286,Oct
1410,Why extremophiles bode well for life beyond Earth - Louisa Preston,2013-10-07,135838,1472,102,Oct
1411,How art can help you analyze - Amy E. Herman,2013-10-04,1005669,6889,405,Oct
1412,Speech acts: Constative and performative - Colleen Glenney Boggs,2013-10-03,193475,2651,69,Oct
1413,The most groundbreaking scientist you've never heard of - Addison Anderson,2013-10-01,3004884,63225,1589,Oct
1414,Kabuki: The people's dramatic art - Amanda Mattes,2013-09-30,979267,18016,477,Sep
1415,"Are Elvish, Klingon, Dothraki and Na'vi real languages? - John McWhorter",2013-09-26,2890754,51034,2743,Sep
1416,Birth of a nickname - John McWhorter,2013-09-24,433276,8576,502,Sep
1417,Human sperm vs. the sperm whale - Aatish Bhatia,2013-09-23,4365742,58101,1397,Sep
1418,"Light waves, visible and invisible",2013-09-19,923448,7882,371,Sep
1419,"Bird migration, a perilous journey - Alyssa Klavans",2013-09-17,235087,2757,122,Sep
1420,Why are frogs disappearing? - Kerry M. Kriger,2013-09-16,380615,3857,392,Sep
1421,Natural pest control ... using bugs! - Shimon Steinberg,2013-09-13,17055,71,10,Sep
1422,America's native prisoners of war - Aaron Huey,2013-09-13,121290,1328,150,Sep
1423,Urbanization and the future of cities - Vance Kite,2013-09-12,2474247,24226,1307,Sep
1424,What are stem cells? - Craig A. Kohn,2013-09-10,1735945,22305,755,Sep
1425,What is love? - Brad Troeger,2013-09-09,1728522,39083,1695,Sep
1426,The true power of the performing arts - Ben Cameron,2013-09-06,22339,170,17,Sep
1427,The game layer on top of the world - Seth Priebatsch,2013-09-06,17286,109,15,Sep
1428,A trip through space to calculate distance - Heather Tunnell,2013-09-06,152368,1110,205,Sep
1429,Cicadas: The dormant army beneath your feet - Rose Eveleth,2013-09-05,472557,6376,345,Sep
1430,The moon illusion - Andrew Vanden Heuvel,2013-09-03,767430,10807,697,Sep
1431,The neurons that shaped civilization - VS Ramachandran,2013-08-31,131087,2095,84,Aug
1432,The beautiful tricks of flowers - Jonathan Drori,2013-08-31,25190,301,17,Aug
1433,"Your online life, permanent as a tattoo - Juan Enriquez",2013-08-30,19283,217,10,Aug
1434,The key to growth? Race with the machines - Erik Brynjolfsson,2013-08-30,11722,77,3,Aug
1435,Txtng is killing language. JK!!! - John McWhorter,2013-08-30,45525,738,54,Aug
1436,The art of asking - Amanda Palmer,2013-08-30,32472,783,39,Aug
1437,A clean energy proposal -- race to the top! - Jennifer Granholm,2013-08-30,5545,100,10,Aug
1438,How we found the giant squid - Edith Widder,2013-08-30,8449,150,11,Aug
1439,We need better drugs -- now - Francis Collins,2013-08-30,8680,126,16,Aug
1440,Why do Americans and Canadians celebrate Labor Day? -Kenneth C. Davis,2013-08-30,532734,3936,285,Aug
1441,Are droids taking our jobs? - Andrew McAfee,2013-08-29,11329,99,16,Aug
1442,Demand a fair trade cell phone - Bandi Mbubi,2013-08-29,2402,48,5,Aug
1443,"Design for people, not awards - Timothy Prestero",2013-08-29,3215,59,3,Aug
1444,How to step up in the face of disaster - Caitria + Morgan O'Neill,2013-08-29,5064,45,2,Aug
1445,A teacher growing green in the South Bronx - Stephen Ritz,2013-08-29,4197,75,5,Aug
1446,"The future race car -- 150mph, and no driver - Chris Gerdes",2013-08-29,6740,67,6,Aug
1447,What's your 200-year plan? - Raghava KK,2013-08-29,3285,22,5,Aug
1448,Four ways to understand the Earth's age - Joshua M. Sneideman,2013-08-29,646040,4941,454,Aug
1449,Reinventing the encyclopedia game - Rives,2013-08-28,9754,76,1,Aug
1450,What is déjà vu? What is déjà vu? - Michael Molina,2013-08-28,4940612,115275,8970,Aug
1451,"The Higgs Field, explained - Don Lincoln",2013-08-27,964211,21267,922,Aug
1452,Gravity and the human body - Jay Buckey,2013-08-26,439184,5015,246,Aug
1453,The 3 A's of awesome - Neil Pasricha,2013-08-25,50797,459,31,Aug
1454,On reading the Koran - Lesley Hazleton,2013-08-25,1537032,34841,3900,Aug
1455,True success - John Wooden,2013-08-24,68871,515,16,Aug
1456,How to use experts—and when not to - Noreena Hertz,2013-08-24,20562,137,19,Aug
1457,The art of choosing - Sheena Iyengar,2013-08-24,115646,1749,42,Aug
1458,Where is home? - Pico Iyer,2013-08-23,7170,124,10,Aug
1459,Meet global corruption's hidden players - Charmian Gooch,2013-08-23,9177,169,18,Aug
1460,A Saudi woman who dared to drive - Manal al-Sharif,2013-08-23,18300,265,37,Aug
1461,Is the obesity crisis hiding a bigger problem? - Peter Attia,2013-08-23,76683,1210,90,Aug
1462,"The emergence of ""4D printing"" - Skylar Tibbits",2013-08-23,15359,203,12,Aug
1463,"We the People, and the Republic we must reclaim - Lawrence Lessig",2013-08-23,5740,134,15,Aug
1464,A mini robot -- powered by your phone - Keller Rinaudo,2013-08-23,6950,76,4,Aug
1465,"The good news on poverty (Yes, there's good news) - Bono",2013-08-23,7886,112,11,Aug
1466,Mysteries of vernacular: Bewilder - Jessica Oreck and Rachael Teel,2013-08-23,59316,782,34,Aug
1467,Shakespearean dating tips - Anthony John Peters,2013-08-22,429953,4268,136,Aug
1468,The other inconvenient truth - Jonathan Foley,2013-08-21,41713,251,39,Aug
1469,Older people are happier - Laura Carstensen,2013-08-21,11836,66,9,Aug
1470,How to buy happiness - Michael Norton,2013-08-21,10278,93,6,Aug
1471,How to use a paper towel - Joe Smith,2013-08-21,36459,343,30,Aug
1472,Gaming for understanding - Brenda Brathwaite,2013-08-21,12331,191,11,Aug
1473,Perspective is everything - Rory Sutherland,2013-08-21,16249,326,8,Aug
1474,A teen just trying to figure it out - Tavi Gevinson,2013-08-21,87487,958,36,Aug
1475,Religions and babies - Hans Rosling,2013-08-21,17461,330,16,Aug
1476,What your designs say about you - Sebastian Deterding,2013-08-21,2268,24,1,Aug
1477,ET is (probably) out there -- get ready - Seth Shostak,2013-08-21,266250,2959,1073,Aug
1478,Will our kids be a different species? - Juan Enriquez,2013-08-21,28184,433,68,Aug
1479,The myth of the gay agenda - LZ Granderson,2013-08-21,35315,647,384,Aug
1480,Pop an ollie and innovate! - Rodney Mullen,2013-08-21,47733,393,17,Aug
1481,Women should represent women in media - Megan Kamerick,2013-08-21,19280,226,8,Aug
1482,Lessons from death row inmates - David R. Dow,2013-08-21,7718,115,8,Aug
1483,Tour the solar system from home - Jon Nguyen,2013-08-21,21769,122,7,Aug
1484,India's invisible innovation - Nirmalya Kumar,2013-08-21,251585,4652,162,Aug
1485,Overcoming obstacles - Steven Claunch,2013-08-21,1008431,9128,354,Aug
1486,Defining cyberwarfare...in hopes of preventing it - Daniel Garrie,2013-08-20,111646,1299,197,Aug
1487,The Arctic vs. the Antarctic - Camille Seaman,2013-08-19,4520794,74424,2256,Aug
1488,How to learn? From mistakes - Diana Laufenberg,2013-08-18,43146,153,7,Aug
1489,"The walk from ""no"" to ""yes"" - William Ury",2013-08-18,32050,196,14,Aug
1490,Navigating Our Global Future - Ian Goldin,2013-08-17,51563,199,32,Aug
1491,Time-lapse proof of extreme ice loss - James Balog,2013-08-17,71201,640,67,Aug
1492,"Symmetry, reality's riddle - Marcus du Sautoy",2013-08-17,37779,224,17,Aug
1493,On being a woman and a diplomat - Madeleine Albright,2013-08-17,53959,902,77,Aug
1494,A short intro to the Studio School - Geoff Mulgan,2013-08-16,2378,33,1,Aug
1495,A doctor's touch - Abraham Verghese,2013-08-16,13931,244,9,Aug
1496,Fighting a contagious cancer - Elizabeth Murchison,2013-08-16,3778,69,6,Aug
1497,Hire the hackers! - Misha Glenny,2013-08-16,10853,194,64,Aug
1498,Our failing schools. Enough is enough! - Geoffrey Canada,2013-08-16,13444,237,15,Aug
1499,Teachers need real feedback - Bill Gates,2013-08-16,23880,328,25,Aug
1500,Cloudy with a chance of joy - Gavin Pretor-Pinney,2013-08-16,4261,67,16,Aug
1501,The voice of the natural world - Bernie Krause,2013-08-16,5607,69,5,Aug
1502,Michael Green: Why we should build wooden skyscrapers,2013-08-16,5809,93,12,Aug
1503,Sex needs a new metaphor. Here's one ... - Al Vernacchio,2013-08-16,11187,200,17,Aug
1504,What's wrong with our food system - Birke Baehr,2013-08-16,112347,673,66,Aug
1505,Protecting the brain against concussion - Kim Gorgens,2013-08-16,18601,57,8,Aug
1506,The science of macaroni salad: What's in a molecule? - Josh Kurz,2013-08-16,289190,1995,144,Aug
1507,Why you will fail to have a great career - Larry Smith,2013-08-15,146200,2015,70,Aug
1508,My immigration story - Tan Le,2013-08-15,5646,73,8,Aug
1509,An unexpected place of healing - Ramona Pierson,2013-08-15,1247,26,4,Aug
1510,My friend Richard Feynman - Leonard Susskind,2013-08-15,10270,264,11,Aug
1511,Using nature to grow batteries - Angela Belcher,2013-08-15,6726,103,3,Aug
1512,A radical experiment in empathy - Sam Richards,2013-08-15,13847,155,10,Aug
1513,A whistleblower you haven't heard - Geert Chatrou,2013-08-15,8196,100,10,Aug
1514,Gaming to re-engage boys in learning - Ali Carr-Chellman,2013-08-15,5119,95,15,Aug
1515,What nonprofits can learn from Coca-Cola - Melinda French Gates,2013-08-15,8462,109,7,Aug
1516,My seven species of robot - Dennis Hong,2013-08-15,36565,273,12,Aug
1517,The economic case for preschool - Timothy Bartik,2013-08-15,980,18,5,Aug
1518,Crowdsource your health - Lucien Engelen,2013-08-15,5601,18,3,Aug
1519,What you don't know about marriage - Jenna McCarthy,2013-08-15,30101,171,8,Aug
1520,Everyday leadership - Drew Dudley,2013-08-15,997733,9182,445,Aug
1521,Shape-shifting dinosaurs - Jack Horner,2013-08-15,10605,221,7,Aug
1522,"Women entrepreneurs, example not exception - Gayle Tzemach Lemmon",2013-08-15,1788,37,1,Aug
1523,"1000 TEDTalks, 6 words - Sebastian Wernicke",2013-08-15,6876,60,3,Aug
1524,Life's third act - Jane Fonda,2013-08-15,6267,84,4,Aug
1525,There are no scraps of men - Alberto Cairo,2013-08-15,1379,28,5,Aug
1526,How to topple a dictator - Srdja Popovic,2013-08-15,5915,86,10,Aug
1527,It's time to question bio-engineering - Paul Root Wolpe,2013-08-15,168326,1627,212,Aug
1528,Should you trust your first impression? - Peter Mende-Siedlecki,2013-08-15,3098481,57263,1055,Aug
1529,Who won the space race?  - Jeff Steers,2013-08-14,1556431,14312,1453,Aug
1530,A brief history of video games (Part I) - Safwat Saleem,2013-08-13,1199808,11589,853,Aug
1531,"RNAi: Slicing, dicing and serving your cells - Alex Dainis",2013-08-12,352030,6579,177,Aug
1532,The good news of the decade? - Hans Rosling,2013-08-11,30946,188,13,Aug
1533,Taking imagination seriously - Janet Echelman,2013-08-11,110567,1274,39,Aug
1534,Inside an Antarctic time machine - Lee Hotz,2013-08-10,34892,350,52,Aug
1535,A warm embrace that saves lives - Jane Chen,2013-08-10,52824,343,9,Aug
1536,String theory - Brian Greene,2013-08-09,6669665,131948,6179,Aug
1537,The science behind a climate headline - Rachel Pike,2013-08-09,23240,67,19,Aug
1538,What we learn before we're born - Annie Murphy Paul,2013-08-09,9766,71,3,Aug
1539,How to stop torture - Karen Tse,2013-08-09,1791,20,3,Aug
1540,Experiments that hint of longer lives - Cynthia Kenyon,2013-08-09,6366,66,7,Aug
1541,A map of the brain - Allan Jones,2013-08-09,11189,116,3,Aug
1542,Ancient wonders captured in 3D - Ben Kacyra,2013-08-09,10130,106,7,Aug
1543,The real reason for brains - Daniel Wolpert,2013-08-09,13806,242,8,Aug
1544,A plane you can drive - Anna Mracek Dietrich,2013-08-09,7240,39,8,Aug
1545,"Trust, morality -- and oxytocin? - Paul Zak",2013-08-09,24036,418,14,Aug
1546,How economic inequality harms societies - Richard Wilkinson,2013-08-09,54890,541,74,Aug
1547,"A prosthetic arm that ""feels"" - Todd Kuiken",2013-08-09,8059,84,7,Aug
1548,Freeing energy from the grid - Justin Hall-Tipping,2013-08-09,2552,46,6,Aug
1549,Learning from a barefoot movement - Bunker Roy,2013-08-09,12983,241,14,Aug
1550,How to spot a liar - Pamela Meyer,2013-08-09,41559,685,39,Aug
1551,The day I turned down Tim Berners-Lee - Ian Ritchie,2013-08-09,1782,30,2,Aug
1552,What do babies think? - Alison Gopnik,2013-08-09,31657,324,29,Aug
1553,Trusting the ensemble - Charles Hazlewood,2013-08-09,9802,131,5,Aug
1554,We can recycle plastic - Mike Biddle,2013-08-09,5076,100,3,Aug
1555,The generation that's remaking China - Yang Lan,2013-08-09,14668,152,19,Aug
1556,Battling bad science - Ben Goldacre,2013-08-09,29129,360,27,Aug
1557,Filming democracy in Ghana - Jarreth Merz,2013-08-09,1387,28,0,Aug
1558,Mysteries of vernacular: Keister - Jessica Oreck and Rachael Teel,2013-08-09,38301,460,29,Aug
1559,Massive-scale online collaboration - Luis von Ahn,2013-08-08,2288,66,5,Aug
1560,How to defend Earth from asteroids - Phil Plait,2013-08-08,8027,122,10,Aug
1561,The shared experience of absurdity - Charlie Todd,2013-08-08,6170,88,3,Aug
1562,How cyberattacks threaten real-world peace - Guy-Philippe Goldstein,2013-08-08,1749,10,1,Aug
1563,Finding life we can't imagine - Christoph Adami,2013-08-08,2608,46,3,Aug
1564,A civil response to violence - Emiliano Salinas,2013-08-08,7607,27,18,Aug
1565,"We need a ""moral operating system"" - Damon Horowitz",2013-08-08,22777,157,9,Aug
1566,Faith versus tradition in Islam - Mustafa Akyol,2013-08-08,39073,537,103,Aug
1567,Distant time and the hint of a multiverse - Sean Carroll,2013-08-08,112086,1053,48,Aug
1568,A lab the size of a postage stamp - George Whitesides,2013-08-08,2297,34,0,Aug
1569,How to make work-life balance work - Nigel Marsh,2013-08-08,85818,654,25,Aug
1570,Are we born to run? - Christopher McDougall,2013-08-08,47260,503,33,Aug
1571,The economic injustice of plastic - Van Jones,2013-08-08,2767,28,4,Aug
1572,Why do we have to wear sunscreen? - Kevin P. Boyd,2013-08-06,2266166,25016,1057,Aug
1573,Mysteries of vernacular: X-ray - Jessica Oreck and Rachael Teel,2013-08-05,44161,662,54,Aug
1574,The hidden meanings of yin and yang - John Bellaimey,2013-08-02,4699333,113443,5415,Aug
1575,Obesity + Hunger = 1 global food issue - Ellen Gustafson,2013-08-01,7954,57,7,Aug
1576,Let's raise kids to be entrepreneurs - Cameron Herold,2013-08-01,27154,400,21,Aug
1577,Re-examining the remix - Lawrence Lessig,2013-08-01,8846,61,6,Aug
1578,Lessons from fashion's free culture - Johanna Blakley,2013-08-01,21647,221,5,Aug
1579,Math class needs a makeover -  Dan Meyer,2013-08-01,127909,811,20,Aug
1580,Why we need to go back to Mars - Joel Levine,2013-08-01,24942,253,48,Aug
1581,How I taught rats to sniff out land mines - Bart Weetjens,2013-08-01,6133,74,4,Aug
1582,Mysteries of vernacular: Zero - Jessica Oreck and Rachael Teel,2013-08-01,83037,1204,66,Aug
1583,The science of macaroni salad: What's in a mixture? - Josh Kurz,2013-07-31,566184,3476,242,Jul
1584,What's the definition of comedy? Banana. - Addison Anderson,2013-07-30,486919,5079,483,Jul
1585,How to take a great picture - Carolina Molinari,2013-07-29,138212,2632,75,Jul
1586,The shape-shifting future of the mobile phone - Fabian Hemmert,2013-07-28,47542,284,39,Jul
1587,Greening the ghetto - Majora Carter,2013-07-27,15930,142,9,Jul
1588,Atheism 2.0 - Alain de Botton,2013-07-26,20838,451,98,Jul
1589,Meet the Water Canary - Sonaar Luthra,2013-07-26,6761,33,6,Jul
1590,How healthy living nearly killed me - A.J. Jacobs,2013-07-26,5913,57,4,Jul
1591,A prosthetic eye to treat blindness - Sheila Nirenberg,2013-07-26,5864,53,2,Jul
1592,Put a value on nature! - Pavan Sukhdev,2013-07-26,2072,34,2,Jul
1593,Praising slowness - Carl Honore,2013-07-26,26082,246,12,Jul
1594,How I discovered DNA - James Watson,2013-07-26,310504,3839,780,Jul
1595,Mysteries of vernacular: Sarcophagus - Jessica Oreck and Rachael Teel,2013-07-26,38696,573,30,Jul
1596,3 stories of local eco-entrepreneurship - Majora Carter,2013-07-25,2867,43,2,Jul
1597,How to expose the corrupt - Peter Eigen,2013-07-25,6825,131,8,Jul
1598,Technology's epic story - Kevin Kelly,2013-07-25,3028,40,1,Jul
1599,Inside the Egyptian revolution - Wael Ghonim,2013-07-25,6876,78,3,Jul
1600,Don't insist on English! - Patricia Ryan,2013-07-25,173649,1843,87,Jul
1601,The terrors of sleep paralysis - Ami Angelowicz,2013-07-25,927754,12647,2451,Jul
1602,What's below the tip of the iceberg? - Camille Seaman,2013-07-24,497996,5123,174,Jul
1603,What is chemical equilibrium? - George Zaidan and Charles Morton,2013-07-23,852284,11406,275,Jul
1604,What creates a total solar eclipse? - Andy Cohen,2013-07-22,1057159,5877,438,Jul
1605,A brief history of plural word...s - John McWhorter,2013-07-22,880856,19393,1243,Jul
1606,Making a TED-Ed Lesson: Two ways to animate slam poetry,2013-07-20,48761,617,14,Jul
1607,Ultrasound surgery -- healing without cuts - Yoav Medan,2013-07-19,8052,148,8,Jul
1608,A census of the ocean - Paul Snelgrove,2013-07-19,3048,47,2,Jul
1609,Listening to shame - Brené Brown,2013-07-19,339561,5472,85,Jul
1610,Let's transform energy -- with natural gas - T. Boone Pickens,2013-07-19,7528,59,13,Jul
1611,"Yup, I built a nuclear fusion reactor - Taylor Wilson",2013-07-19,46546,337,141,Jul
1612,Mysteries of vernacular: Fizzle - Jessica Oreck and Rachael Teel,2013-07-19,36434,478,35,Jul
1613,How to read music - Tim Hansen,2013-07-18,6604066,227011,7455,Jul
1614,Tribal leadership - David Logan,2013-07-17,19739,141,6,Jul
1615,Animating a photo-real digital face - Paul Debevec,2013-07-17,12008,98,5,Jul
1616,Building a theater that remakes itself - Joshua Prince-Ramus,2013-07-17,16036,276,6,Jul
1617,Creative houses from reclaimed stuff - Dan Phillips,2013-07-17,50858,787,21,Jul
1618,The case for collaborative consumption - Rachel Botsman,2013-07-17,7768,42,4,Jul
1619,Exploring other dimensions - Alex Rosenthal and George Zaidan,2013-07-17,5102613,123157,6584,Jul
1620,"Got seeds? Just add bleach, acid and sandpaper - Mary Koga",2013-07-16,849229,18913,749,Jul
1621,What is dyslexia? - Kelli Sandman-Hurley,2013-07-15,6439745,117763,6213,Jul
1622,The moral dangers of non-lethal weapons - Stephen Coleman,2013-07-14,15969,217,25,Jul
1623,What we learned from 5 million books - Erez Lieberman Aiden and Jean-Baptiste Michel,2013-07-14,48903,1231,52,Jul
1624,Making a TED-Ed Lesson: Animating zombies,2013-07-14,73424,858,23,Jul
1625,Animation basics: The optical illusion of motion - TED-Ed,2013-07-13,216278,3198,116,Jul
1626,The best stats you've ever seen - Hans Rosling,2013-07-13,414052,4128,123,Jul
1627,The surprising science of happiness - Nancy Etcoff,2013-07-13,48407,190,18,Jul
1628,How to look inside the brain - Carl Schoonover,2013-07-12,4553,49,0,Jul
1629,Texting that saves lives - Nancy Lublin,2013-07-12,13493,111,3,Jul
1630,The 4 commandments of cities - Eduardo Paes,2013-07-12,9540,50,3,Jul
1631,Tracking ancient diseases using ... plaque - Christina Warinner,2013-07-12,4254,72,2,Jul
1632,"Unlock the intelligence, passion, greatness of girls - Leymah Gbowee",2013-07-12,11370,107,2,Jul
1633,Mysteries of vernacular: Jade - Jessica Oreck and Rachael Teel,2013-07-12,35672,625,28,Jul
1634,Da Vinci's Vitruvian Man of math - James Earle,2013-07-11,2407239,52361,978,Jul
1635,Visualizing the medical data explosion - Anders Ynnerman,2013-07-10,4401,50,2,Jul
1636,The linguistic genius of babies - Patricia Kuhl,2013-07-10,105653,829,97,Jul
1637,Why work doesn't happen at work - Jason Fried,2013-07-10,89902,852,49,Jul
1638,How Mr. Condom made Thailand a better place - Mechai Viravaidya,2013-07-10,30361,399,26,Jul
1639,The power of vulnerability - Brené Brown,2013-07-10,177157,2592,56,Jul
1640,The infinite life of pi - Reynaldo Lopes,2013-07-10,1543590,22489,1296,Jul
1641,Comma story - Terisa Folaron,2013-07-09,2666191,27228,1182,Jul
1642,Myths and misconceptions about evolution - Alex Gendler,2013-07-08,2962969,43159,7734,Jul
1643,Making a TED-Ed Lesson: Synesthesia and playing cards,2013-07-07,53029,676,30,Jul
1644,4 lessons from robots about being human - Ken Goldberg,2013-07-07,27198,242,11,Jul
1645,Toward a new understanding of mental illness - Thomas Insel,2013-07-07,54530,363,67,Jul
1646,Free falling in outer space - Matt J. Carlson,2013-07-06,210380,2652,247,Jul
1647,On spaghetti sauce - Malcolm Gladwell,2013-07-06,378238,5294,322,Jul
1648,On positive psychology - Martin Seligman,2013-07-06,150048,1336,35,Jul
1649,Mining minerals from seawater - Damian Palin,2013-07-05,13567,266,23,Jul
1650,What if our healthcare system kept us healthy? - Rebecca Onie,2013-07-05,5684,58,7,Jul
1651,"The 100,000-student classroom - Peter Norvig",2013-07-05,4438,91,3,Jul
1652,Advice to young scientists - E.O. Wilson,2013-07-05,6433,190,11,Jul
1653,How Arduino is open-sourcing imagination - Massimo Banzi,2013-07-05,15304,186,7,Jul
1654,Mysteries of vernacular: Quarantine - Jessica Oreck and Rachael Teel,2013-07-04,67248,823,72,Jul
1655,Why eyewitnesses get it wrong - Scott Fraser,2013-07-03,56721,551,21,Jul
1656,Welcome to the genomic revolution - Richard Resnick,2013-07-03,2826,46,6,Jul
1657,Your brain on improv - Charles Limb,2013-07-03,38817,714,48,Jul
1658,Moral behavior in animals - Frans de Waal,2013-07-03,130684,2653,124,Jul
1659,Distant time and the hint of a multiverse - Sean Carroll,2013-07-03,20659,268,23,Jul
1660,What is an aurora? - Michael Molina,2013-07-03,753714,16356,397,Jul
1661,Beatboxing 101 - BEAT NYC,2013-07-02,214886,2834,212,Jul
1662,Inside your computer - Bettina Bair,2013-07-01,2980977,32820,1167,Jul
1663,Image recognition that triggers augmented reality - Matt Mills,2013-06-29,22077,109,15,Jun
1664,The human and the honeybee - Dino Martins,2013-06-29,58858,618,52,Jun
1665,A tale of mental illness -- from the inside - Elyn Saks,2013-06-28,31455,453,20,Jun
1666,How I'm preparing to get Alzheimer's - Alanna Shaikh,2013-06-28,14033,150,16,Jun
1667,A vision of crimes in the future - Marc Goodman,2013-06-28,7487,74,12,Jun
